--
-- CREATE_INDEX
-- Create ancillary data structures (i.e. indices)
--
--
-- BTREE
--
CREATE INDEX onek_unique1 ON onek USING btree(unique1 int4_ops);
CREATE INDEX onek_unique2 ON onek USING btree(unique2 int4_ops);
CREATE INDEX onek_hundred ON onek USING btree(hundred int4_ops);
CREATE INDEX onek_stringu1 ON onek USING btree(stringu1 name_ops);
CREATE INDEX tenk1_unique1 ON tenk1 USING btree(unique1 int4_ops);
CREATE INDEX tenk1_unique2 ON tenk1 USING btree(unique2 int4_ops);
CREATE INDEX tenk1_hundred ON tenk1 USING btree(hundred int4_ops);
CREATE INDEX tenk1_thous_tenthous ON tenk1 (thousand, tenthous);
CREATE INDEX tenk2_unique1 ON tenk2 USING btree(unique1 int4_ops);
CREATE INDEX tenk2_unique2 ON tenk2 USING btree(unique2 int4_ops);
CREATE INDEX tenk2_hundred ON tenk2 USING btree(hundred int4_ops);
CREATE INDEX rix ON road USING btree (name text_ops);
CREATE INDEX iix ON ihighway USING btree (name text_ops);
CREATE INDEX six ON shighway USING btree (name text_ops);
-- test comments
COMMENT ON INDEX six_wrong IS 'bad index';
ERROR:  relation "six_wrong" does not exist
COMMENT ON INDEX six IS 'good index';
COMMENT ON INDEX six IS NULL;
--
-- BTREE ascending/descending cases
--
-- we load int4/text from pure descending data (each key is a new
-- low key) and name/f8 from pure ascending data (each key is a new
-- high key).  we had a bug where new low keys would sometimes be
-- "lost".
--
CREATE INDEX bt_i4_index ON bt_i4_heap USING btree (seqno int4_ops);
CREATE INDEX bt_name_index ON bt_name_heap USING btree (seqno name_ops);
CREATE INDEX bt_txt_index ON bt_txt_heap USING btree (seqno text_ops);
CREATE INDEX bt_f8_index ON bt_f8_heap USING btree (seqno float8_ops);
--
-- BTREE partial indices
--
CREATE INDEX onek2_u1_prtl ON onek2 USING btree(unique1 int4_ops)
	where unique1 < 20 or unique1 > 980;
CREATE INDEX onek2_u2_prtl ON onek2 USING btree(unique2 int4_ops)
	where stringu1 < 'B';
CREATE INDEX onek2_stu1_prtl ON onek2 USING btree(stringu1 name_ops)
	where onek2.stringu1 >= 'J' and onek2.stringu1 < 'K';
--
-- GiST (rtree-equivalent opclasses only)
--
CREATE INDEX grect2ind ON fast_emp4000 USING gist (home_base);
CREATE INDEX gpolygonind ON polygon_tbl USING gist (f1);
CREATE INDEX gcircleind ON circle_tbl USING gist (f1);
CREATE TEMP TABLE gpolygon_tbl AS
    SELECT polygon(home_base) AS f1 FROM slow_emp4000;
NOTICE:  Table doesn't have 'DISTRIBUTED BY' clause -- Using column(s) named '' as the Greenplum Database data distribution key for this table.
HINT:  The 'DISTRIBUTED BY' clause determines the distribution of data. Make sure column(s) chosen are the optimal data distribution key to minimize skew.
CREATE TEMP TABLE gcircle_tbl AS
    SELECT circle(home_base) AS f1 FROM slow_emp4000;
NOTICE:  Table doesn't have 'DISTRIBUTED BY' clause -- Using column(s) named '' as the Greenplum Database data distribution key for this table.
HINT:  The 'DISTRIBUTED BY' clause determines the distribution of data. Make sure column(s) chosen are the optimal data distribution key to minimize skew.
CREATE INDEX ggpolygonind ON gpolygon_tbl USING gist (f1);
CREATE INDEX ggcircleind ON gcircle_tbl USING gist (f1);
SET enable_seqscan = ON;
SET enable_indexscan = OFF;
SET enable_bitmapscan = OFF;
SELECT * FROM fast_emp4000
    WHERE home_base @ '(200,200),(2000,1000)'::box
    ORDER BY (home_base[0])[0];
       home_base       
-----------------------
 (337,455),(240,359)
 (1444,403),(1346,344)
(2 rows)

SELECT count(*) FROM fast_emp4000 WHERE home_base && '(1000,1000,0,0)'::box;
 count 
-------
     2
(1 row)

SELECT * FROM polygon_tbl WHERE f1 ~ '((1,1),(2,2),(2,1))'::polygon
    ORDER BY (poly_center(f1))[0];
 s |         f1          
---+---------------------
 1 | ((2,0),(2,4),(0,0))
(1 row)

SELECT * FROM circle_tbl WHERE f1 && circle(point(1,-2), 1)
    ORDER BY area(f1);
      f1       
---------------
 <(1,2),3>
 <(1,3),5>
 <(1,2),100>
 <(100,1),115>
(4 rows)

SELECT count(*) FROM gpolygon_tbl WHERE f1 && '(1000,1000,0,0)'::polygon;
 count 
-------
     2
(1 row)

SELECT count(*) FROM gcircle_tbl WHERE f1 && '<(500,500),500>'::circle;
 count 
-------
     2
(1 row)

SET enable_seqscan = OFF;
SET enable_indexscan = ON;
SET enable_bitmapscan = ON;
-- there's no easy way to check that these commands actually use
-- the index, unfortunately.  (EXPLAIN would work, but its output
-- changes too often for me to want to put an EXPLAIN in the test...)
SELECT * FROM fast_emp4000
    WHERE home_base @ '(200,200),(2000,1000)'::box
    ORDER BY (home_base[0])[0];
       home_base       
-----------------------
 (337,455),(240,359)
 (1444,403),(1346,344)
(2 rows)

SELECT count(*) FROM fast_emp4000 WHERE home_base && '(1000,1000,0,0)'::box;
 count 
-------
     2
(1 row)

SELECT * FROM polygon_tbl WHERE f1 ~ '((1,1),(2,2),(2,1))'::polygon
    ORDER BY (poly_center(f1))[0];
 s |         f1          
---+---------------------
 1 | ((2,0),(2,4),(0,0))
(1 row)

SELECT * FROM circle_tbl WHERE f1 && circle(point(1,-2), 1)
    ORDER BY area(f1);
      f1       
---------------
 <(1,2),3>
 <(1,3),5>
 <(1,2),100>
 <(100,1),115>
(4 rows)

SELECT count(*) FROM gpolygon_tbl WHERE f1 && '(1000,1000,0,0)'::polygon;
 count 
-------
     2
(1 row)

SELECT count(*) FROM gcircle_tbl WHERE f1 && '<(500,500),500>'::circle;
 count 
-------
     2
(1 row)

RESET enable_seqscan;
RESET enable_indexscan;
RESET enable_bitmapscan;
--
-- GIN over int[]
--
SET enable_seqscan = OFF;
SET enable_indexscan = ON;
SET enable_bitmapscan = ON;
CREATE INDEX intarrayidx ON array_index_op_test USING gin (i);
ERROR:  GIN indexes are not supported
SELECT * FROM array_index_op_test WHERE i @> '{32}' ORDER BY seqno;
 seqno |                i                |                                                                 t                                                                  
-------+---------------------------------+------------------------------------------------------------------------------------------------------------------------------------
     6 | {39,35,5,94,17,92,60,32}        | {AAAAAAAAAAAAAAA35875,AAAAAAAAAAAAAAAA23657}
    74 | {32}                            | {AAAAAAAAAAAAAAAA1729,AAAAAAAAAAAAA22860,AAAAAA99807,AAAAA17383,AAAAAAAAAAAAAAA67062,AAAAAAAAAAA15165,AAAAAAAAAAA50956}
    77 | {97,15,32,17,55,59,18,37,50,39} | {AAAAAAAAAAAA67946,AAAAAA54032,AAAAAAAA81587,55847,AAAAAAAAAAAAAA28620,AAAAAAAAAAAAAAAAA43052,AAAAAA75463,AAAA49534,AAAAAAAA44066}
    89 | {40,32,17,6,30,88}              | {AA44673,AAAAAAAAAAA6119,AAAAAAAAAAAAAAAA23657,AAAAAAAAAAAAAAAAAA47955,AAAAAAAAAAAAAAAA33598,AAAAAAAAAAA33576,AA44673}
    98 | {38,34,32,89}                   | {AAAAAAAAAAAAAAAAAA71621,AAAA8857,AAAAAAAAAAAAAAAAAAA65037,AAAAAAAAAAAAAAAA31334,AAAAAAAAAA48845}
   100 | {85,32,57,39,49,84,32,3,30}     | {AAAAAAA80240,AAAAAAAAAAAAAAAA1729,AAAAA60038,AAAAAAAAAAA92631,AAAAAAAA9523}
(6 rows)

SELECT * FROM array_index_op_test WHERE i && '{32}' ORDER BY seqno;
 seqno |                i                |                                                                 t                                                                  
-------+---------------------------------+------------------------------------------------------------------------------------------------------------------------------------
     6 | {39,35,5,94,17,92,60,32}        | {AAAAAAAAAAAAAAA35875,AAAAAAAAAAAAAAAA23657}
    74 | {32}                            | {AAAAAAAAAAAAAAAA1729,AAAAAAAAAAAAA22860,AAAAAA99807,AAAAA17383,AAAAAAAAAAAAAAA67062,AAAAAAAAAAA15165,AAAAAAAAAAA50956}
    77 | {97,15,32,17,55,59,18,37,50,39} | {AAAAAAAAAAAA67946,AAAAAA54032,AAAAAAAA81587,55847,AAAAAAAAAAAAAA28620,AAAAAAAAAAAAAAAAA43052,AAAAAA75463,AAAA49534,AAAAAAAA44066}
    89 | {40,32,17,6,30,88}              | {AA44673,AAAAAAAAAAA6119,AAAAAAAAAAAAAAAA23657,AAAAAAAAAAAAAAAAAA47955,AAAAAAAAAAAAAAAA33598,AAAAAAAAAAA33576,AA44673}
    98 | {38,34,32,89}                   | {AAAAAAAAAAAAAAAAAA71621,AAAA8857,AAAAAAAAAAAAAAAAAAA65037,AAAAAAAAAAAAAAAA31334,AAAAAAAAAA48845}
   100 | {85,32,57,39,49,84,32,3,30}     | {AAAAAAA80240,AAAAAAAAAAAAAAAA1729,AAAAA60038,AAAAAAAAAAA92631,AAAAAAAA9523}
(6 rows)

SELECT * FROM array_index_op_test WHERE i @> '{17}' ORDER BY seqno;
 seqno |                i                |                                                                 t                                                                  
-------+---------------------------------+------------------------------------------------------------------------------------------------------------------------------------
     6 | {39,35,5,94,17,92,60,32}        | {AAAAAAAAAAAAAAA35875,AAAAAAAAAAAAAAAA23657}
    12 | {17,99,18,52,91,72,0,43,96,23}  | {AAAAA33250,AAAAAAAAAAAAAAAAAAA85420,AAAAAAAAAAA33576}
    15 | {17,14,16,63,67}                | {AA6416,AAAAAAAAAA646,AAAAA95309}
    19 | {52,82,17,74,23,46,69,51,75}    | {AAAAAAAAAAAAA73084,AAAAA75968,AAAAAAAAAAAAAAAA14047,AAAAAAA80240,AAAAAAAAAAAAAAAAAAA1205,A68938}
    53 | {38,17}                         | {AAAAAAAAAAA21658}
    65 | {61,5,76,59,17}                 | {AAAAAA99807,AAAAA64741,AAAAAAAAAAA53908,AA21643,AAAAAAAAA10012}
    77 | {97,15,32,17,55,59,18,37,50,39} | {AAAAAAAAAAAA67946,AAAAAA54032,AAAAAAAA81587,55847,AAAAAAAAAAAAAA28620,AAAAAAAAAAAAAAAAA43052,AAAAAA75463,AAAA49534,AAAAAAAA44066}
    89 | {40,32,17,6,30,88}              | {AA44673,AAAAAAAAAAA6119,AAAAAAAAAAAAAAAA23657,AAAAAAAAAAAAAAAAAA47955,AAAAAAAAAAAAAAAA33598,AAAAAAAAAAA33576,AA44673}
(8 rows)

SELECT * FROM array_index_op_test WHERE i && '{17}' ORDER BY seqno;
 seqno |                i                |                                                                 t                                                                  
-------+---------------------------------+------------------------------------------------------------------------------------------------------------------------------------
     6 | {39,35,5,94,17,92,60,32}        | {AAAAAAAAAAAAAAA35875,AAAAAAAAAAAAAAAA23657}
    12 | {17,99,18,52,91,72,0,43,96,23}  | {AAAAA33250,AAAAAAAAAAAAAAAAAAA85420,AAAAAAAAAAA33576}
    15 | {17,14,16,63,67}                | {AA6416,AAAAAAAAAA646,AAAAA95309}
    19 | {52,82,17,74,23,46,69,51,75}    | {AAAAAAAAAAAAA73084,AAAAA75968,AAAAAAAAAAAAAAAA14047,AAAAAAA80240,AAAAAAAAAAAAAAAAAAA1205,A68938}
    53 | {38,17}                         | {AAAAAAAAAAA21658}
    65 | {61,5,76,59,17}                 | {AAAAAA99807,AAAAA64741,AAAAAAAAAAA53908,AA21643,AAAAAAAAA10012}
    77 | {97,15,32,17,55,59,18,37,50,39} | {AAAAAAAAAAAA67946,AAAAAA54032,AAAAAAAA81587,55847,AAAAAAAAAAAAAA28620,AAAAAAAAAAAAAAAAA43052,AAAAAA75463,AAAA49534,AAAAAAAA44066}
    89 | {40,32,17,6,30,88}              | {AA44673,AAAAAAAAAAA6119,AAAAAAAAAAAAAAAA23657,AAAAAAAAAAAAAAAAAA47955,AAAAAAAAAAAAAAAA33598,AAAAAAAAAAA33576,AA44673}
(8 rows)

SELECT * FROM array_index_op_test WHERE i @> '{32,17}' ORDER BY seqno;
 seqno |                i                |                                                                 t                                                                  
-------+---------------------------------+------------------------------------------------------------------------------------------------------------------------------------
     6 | {39,35,5,94,17,92,60,32}        | {AAAAAAAAAAAAAAA35875,AAAAAAAAAAAAAAAA23657}
    77 | {97,15,32,17,55,59,18,37,50,39} | {AAAAAAAAAAAA67946,AAAAAA54032,AAAAAAAA81587,55847,AAAAAAAAAAAAAA28620,AAAAAAAAAAAAAAAAA43052,AAAAAA75463,AAAA49534,AAAAAAAA44066}
    89 | {40,32,17,6,30,88}              | {AA44673,AAAAAAAAAAA6119,AAAAAAAAAAAAAAAA23657,AAAAAAAAAAAAAAAAAA47955,AAAAAAAAAAAAAAAA33598,AAAAAAAAAAA33576,AA44673}
(3 rows)

SELECT * FROM array_index_op_test WHERE i && '{32,17}' ORDER BY seqno;
 seqno |                i                |                                                                 t                                                                  
-------+---------------------------------+------------------------------------------------------------------------------------------------------------------------------------
     6 | {39,35,5,94,17,92,60,32}        | {AAAAAAAAAAAAAAA35875,AAAAAAAAAAAAAAAA23657}
    12 | {17,99,18,52,91,72,0,43,96,23}  | {AAAAA33250,AAAAAAAAAAAAAAAAAAA85420,AAAAAAAAAAA33576}
    15 | {17,14,16,63,67}                | {AA6416,AAAAAAAAAA646,AAAAA95309}
    19 | {52,82,17,74,23,46,69,51,75}    | {AAAAAAAAAAAAA73084,AAAAA75968,AAAAAAAAAAAAAAAA14047,AAAAAAA80240,AAAAAAAAAAAAAAAAAAA1205,A68938}
    53 | {38,17}                         | {AAAAAAAAAAA21658}
    65 | {61,5,76,59,17}                 | {AAAAAA99807,AAAAA64741,AAAAAAAAAAA53908,AA21643,AAAAAAAAA10012}
    74 | {32}                            | {AAAAAAAAAAAAAAAA1729,AAAAAAAAAAAAA22860,AAAAAA99807,AAAAA17383,AAAAAAAAAAAAAAA67062,AAAAAAAAAAA15165,AAAAAAAAAAA50956}
    77 | {97,15,32,17,55,59,18,37,50,39} | {AAAAAAAAAAAA67946,AAAAAA54032,AAAAAAAA81587,55847,AAAAAAAAAAAAAA28620,AAAAAAAAAAAAAAAAA43052,AAAAAA75463,AAAA49534,AAAAAAAA44066}
    89 | {40,32,17,6,30,88}              | {AA44673,AAAAAAAAAAA6119,AAAAAAAAAAAAAAAA23657,AAAAAAAAAAAAAAAAAA47955,AAAAAAAAAAAAAAAA33598,AAAAAAAAAAA33576,AA44673}
    98 | {38,34,32,89}                   | {AAAAAAAAAAAAAAAAAA71621,AAAA8857,AAAAAAAAAAAAAAAAAAA65037,AAAAAAAAAAAAAAAA31334,AAAAAAAAAA48845}
   100 | {85,32,57,39,49,84,32,3,30}     | {AAAAAAA80240,AAAAAAAAAAAAAAAA1729,AAAAA60038,AAAAAAAAAAA92631,AAAAAAAA9523}
(11 rows)

SELECT * FROM array_index_op_test WHERE i <@ '{38,34,32,89}' ORDER BY seqno;
 seqno |       i       |                                                             t                                                              
-------+---------------+----------------------------------------------------------------------------------------------------------------------------
    40 | {34}          | {AAAAAAAAAAAAAA10611,AAAAAAAAAAAAAAAAAAA1205,AAAAAAAAAAA50956,AAAAAAAAAAAAAAAA31334,AAAAA70466,AAAAAAAA81587,AAAAAAA74623}
    74 | {32}          | {AAAAAAAAAAAAAAAA1729,AAAAAAAAAAAAA22860,AAAAAA99807,AAAAA17383,AAAAAAAAAAAAAAA67062,AAAAAAAAAAA15165,AAAAAAAAAAA50956}
    98 | {38,34,32,89} | {AAAAAAAAAAAAAAAAAA71621,AAAA8857,AAAAAAAAAAAAAAAAAAA65037,AAAAAAAAAAAAAAAA31334,AAAAAAAAAA48845}
(3 rows)

SELECT * FROM array_index_op_test WHERE i = '{47,77}' ORDER BY seqno;
 seqno |    i    |                                                        t                                                        
-------+---------+-----------------------------------------------------------------------------------------------------------------
    95 | {47,77} | {AAAAAAAAAAAAAAAAA764,AAAAAAAAAAA74076,AAAAAAAAAA18107,AAAAA40681,AAAAAAAAAAAAAAA35875,AAAAA60038,AAAAAAA56483}
(1 row)

CREATE INDEX textarrayidx ON array_index_op_test USING gin (t);
ERROR:  GIN indexes are not supported
SELECT * FROM array_index_op_test WHERE t @> '{AAAAAAAA72908}' ORDER BY seqno;
 seqno |           i           |                                                                     t                                                                      
-------+-----------------------+--------------------------------------------------------------------------------------------------------------------------------------------
    22 | {11,6,56,62,53,30}    | {AAAAAAAA72908}
    45 | {99,45}               | {AAAAAAAA72908,AAAAAAAAAAAAAAAAAAA17075,AA88409,AAAAAAAAAAAAAAAAAA36842,AAAAAAA48038,AAAAAAAAAAAAAA10611}
    72 | {22,1,16,78,20,91,83} | {47735,AAAAAAA56483,AAAAAAAAAAAAA93788,AA42406,AAAAAAAAAAAAA73084,AAAAAAAA72908,AAAAAAAAAAAAAAAAAA61286,AAAAA66674,AAAAAAAAAAAAAAAAA50407}
    79 | {45}                  | {AAAAAAAAAA646,AAAAAAAAAAAAAAAAAAA70415,AAAAAA43678,AAAAAAAA72908}
(4 rows)

SELECT * FROM array_index_op_test WHERE t && '{AAAAAAAA72908}' ORDER BY seqno;
 seqno |           i           |                                                                     t                                                                      
-------+-----------------------+--------------------------------------------------------------------------------------------------------------------------------------------
    22 | {11,6,56,62,53,30}    | {AAAAAAAA72908}
    45 | {99,45}               | {AAAAAAAA72908,AAAAAAAAAAAAAAAAAAA17075,AA88409,AAAAAAAAAAAAAAAAAA36842,AAAAAAA48038,AAAAAAAAAAAAAA10611}
    72 | {22,1,16,78,20,91,83} | {47735,AAAAAAA56483,AAAAAAAAAAAAA93788,AA42406,AAAAAAAAAAAAA73084,AAAAAAAA72908,AAAAAAAAAAAAAAAAAA61286,AAAAA66674,AAAAAAAAAAAAAAAAA50407}
    79 | {45}                  | {AAAAAAAAAA646,AAAAAAAAAAAAAAAAAAA70415,AAAAAA43678,AAAAAAAA72908}
(4 rows)

SELECT * FROM array_index_op_test WHERE t @> '{AAAAAAAAAA646}' ORDER BY seqno;
 seqno |        i         |                                 t                                  
-------+------------------+--------------------------------------------------------------------
    15 | {17,14,16,63,67} | {AA6416,AAAAAAAAAA646,AAAAA95309}
    79 | {45}             | {AAAAAAAAAA646,AAAAAAAAAAAAAAAAAAA70415,AAAAAA43678,AAAAAAAA72908}
    96 | {23,97,43}       | {AAAAAAAAAA646,A87088}
(3 rows)

SELECT * FROM array_index_op_test WHERE t && '{AAAAAAAAAA646}' ORDER BY seqno;
 seqno |        i         |                                 t                                  
-------+------------------+--------------------------------------------------------------------
    15 | {17,14,16,63,67} | {AA6416,AAAAAAAAAA646,AAAAA95309}
    79 | {45}             | {AAAAAAAAAA646,AAAAAAAAAAAAAAAAAAA70415,AAAAAA43678,AAAAAAAA72908}
    96 | {23,97,43}       | {AAAAAAAAAA646,A87088}
(3 rows)

SELECT * FROM array_index_op_test WHERE t @> '{AAAAAAAA72908,AAAAAAAAAA646}' ORDER BY seqno;
 seqno |  i   |                                 t                                  
-------+------+--------------------------------------------------------------------
    79 | {45} | {AAAAAAAAAA646,AAAAAAAAAAAAAAAAAAA70415,AAAAAA43678,AAAAAAAA72908}
(1 row)

SELECT * FROM array_index_op_test WHERE t && '{AAAAAAAA72908,AAAAAAAAAA646}' ORDER BY seqno;
 seqno |           i           |                                                                     t                                                                      
-------+-----------------------+--------------------------------------------------------------------------------------------------------------------------------------------
    15 | {17,14,16,63,67}      | {AA6416,AAAAAAAAAA646,AAAAA95309}
    22 | {11,6,56,62,53,30}    | {AAAAAAAA72908}
    45 | {99,45}               | {AAAAAAAA72908,AAAAAAAAAAAAAAAAAAA17075,AA88409,AAAAAAAAAAAAAAAAAA36842,AAAAAAA48038,AAAAAAAAAAAAAA10611}
    72 | {22,1,16,78,20,91,83} | {47735,AAAAAAA56483,AAAAAAAAAAAAA93788,AA42406,AAAAAAAAAAAAA73084,AAAAAAAA72908,AAAAAAAAAAAAAAAAAA61286,AAAAA66674,AAAAAAAAAAAAAAAAA50407}
    79 | {45}                  | {AAAAAAAAAA646,AAAAAAAAAAAAAAAAAAA70415,AAAAAA43678,AAAAAAAA72908}
    96 | {23,97,43}            | {AAAAAAAAAA646,A87088}
(6 rows)

SELECT * FROM array_index_op_test WHERE t <@ '{AAAAAAAA72908,AAAAAAAAAAAAAAAAAAA17075,AA88409,AAAAAAAAAAAAAAAAAA36842,AAAAAAA48038,AAAAAAAAAAAAAA10611}' ORDER BY seqno;
 seqno |         i          |                                                     t                                                     
-------+--------------------+-----------------------------------------------------------------------------------------------------------
    22 | {11,6,56,62,53,30} | {AAAAAAAA72908}
    45 | {99,45}            | {AAAAAAAA72908,AAAAAAAAAAAAAAAAAAA17075,AA88409,AAAAAAAAAAAAAAAAAA36842,AAAAAAA48038,AAAAAAAAAAAAAA10611}
(2 rows)

SELECT * FROM array_index_op_test WHERE t = '{AAAAAAAAAA646,A87088}' ORDER BY seqno;
 seqno |     i      |           t            
-------+------------+------------------------
    96 | {23,97,43} | {AAAAAAAAAA646,A87088}
(1 row)

RESET enable_seqscan;
RESET enable_indexscan;
RESET enable_bitmapscan;
--
-- HASH
--
set gp_hash_index = true;
WARNING:  gp_hash_index is deprecated and has no effect
CREATE INDEX hash_i4_index ON hash_i4_heap USING hash (random int4_ops);
ERROR:  hash indexes are not supported
CREATE INDEX hash_name_index ON hash_name_heap USING hash (random name_ops);
ERROR:  hash indexes are not supported
CREATE INDEX hash_txt_index ON hash_txt_heap USING hash (random text_ops);
ERROR:  hash indexes are not supported
CREATE INDEX hash_f8_index ON hash_f8_heap USING hash (random float8_ops);
ERROR:  hash indexes are not supported
set gp_hash_index = false;
-- CREATE INDEX hash_ovfl_index ON hash_ovfl_heap USING hash (x int4_ops);
--
-- Test functional index
--
CREATE TABLE func_index_heap (f1 text, f2 text);
NOTICE:  Table doesn't have 'DISTRIBUTED BY' clause -- Using column named 'f1' as the Greenplum Database data distribution key for this table.
HINT:  The 'DISTRIBUTED BY' clause determines the distribution of data. Make sure column(s) chosen are the optimal data distribution key to minimize skew.
CREATE INDEX func_index_index on func_index_heap (textcat(f1,f2));
INSERT INTO func_index_heap VALUES('ABC','DEF');
INSERT INTO func_index_heap VALUES('AB','CDEFG');
INSERT INTO func_index_heap VALUES('QWE','RTY');
-- this should fail because of unique index:
INSERT INTO func_index_heap VALUES('ABCD', 'EF');
-- but this shouldn't:
INSERT INTO func_index_heap VALUES('QWERTY');
--
-- Same test, expressional index
--
DROP TABLE func_index_heap;
CREATE TABLE func_index_heap (f1 text, f2 text);
NOTICE:  Table doesn't have 'DISTRIBUTED BY' clause -- Using column named 'f1' as the Greenplum Database data distribution key for this table.
HINT:  The 'DISTRIBUTED BY' clause determines the distribution of data. Make sure column(s) chosen are the optimal data distribution key to minimize skew.
CREATE  INDEX func_index_index on func_index_heap ((f1 || f2) text_ops);
INSERT INTO func_index_heap VALUES('ABC','DEF');
INSERT INTO func_index_heap VALUES('AB','CDEFG');
INSERT INTO func_index_heap VALUES('QWE','RTY');
-- this should fail because of unique index:
INSERT INTO func_index_heap VALUES('ABCD', 'EF');
-- but this shouldn't:
INSERT INTO func_index_heap VALUES('QWERTY');
--
-- Also try building functional, expressional, and partial indexes on
-- tables that already contain data.
--
create index hash_f8_index_1 on hash_f8_heap(abs(random));
create index hash_f8_index_2 on hash_f8_heap((seqno + 1), random);
create index hash_f8_index_3 on hash_f8_heap(random) where seqno > 1000;
--
-- Try some concurrent index builds
--
-- Unfortunately this only tests about half the code paths because there are
-- no concurrent updates happening to the table at the same time.
CREATE TABLE concur_heap (f1 text, f2 text);
NOTICE:  Table doesn't have 'DISTRIBUTED BY' clause -- Using column named 'f1' as the Greenplum Database data distribution key for this table.
HINT:  The 'DISTRIBUTED BY' clause determines the distribution of data. Make sure column(s) chosen are the optimal data distribution key to minimize skew.
-- empty table
CREATE INDEX CONCURRENTLY concur_index1 ON concur_heap(f2,f1);
ERROR:  CREATE INDEX CONCURRENTLY is not supported
-- MPP-9772, MPP-9773: re-enable CREATE INDEX CONCURRENTLY (off by default)
set gp_create_index_concurrently=true;
CREATE INDEX CONCURRENTLY concur_index1 ON concur_heap(f2,f1);
INSERT INTO concur_heap VALUES  ('a','b');
INSERT INTO concur_heap VALUES  ('b','b');
-- unique index
CREATE UNIQUE INDEX CONCURRENTLY concur_index2 ON concur_heap(f1);
-- check if constraint is set up properly to be enforced
INSERT INTO concur_heap VALUES ('b','x');
ERROR:  duplicate key violates unique constraint "concur_index2"  (seg1 jeffsmac:11002 pid=62533)
-- check if constraint is enforced properly at build time
--CREATE UNIQUE INDEX CONCURRENTLY concur_index3 ON concur_heap(f2);
-- test that expression indexes and partial indexes work concurrently
CREATE INDEX CONCURRENTLY concur_index4 on concur_heap(f2) WHERE f1='a';
CREATE INDEX CONCURRENTLY concur_index5 on concur_heap(f2) WHERE f1='x';
CREATE INDEX CONCURRENTLY concur_index6 on concur_heap((f2||f1));
-- You can't do a concurrent index build in a transaction
BEGIN;
CREATE INDEX CONCURRENTLY concur_index7 ON concur_heap(f1);
ERROR:  CREATE INDEX CONCURRENTLY cannot run inside a transaction block
COMMIT;
-- But you can do a regular index build in a transaction
BEGIN;
CREATE INDEX std_index on concur_heap(f2);
COMMIT;
-- check to make sure that the failed indexes were cleaned up properly and the
-- successful indexes are created properly. Notably that they do NOT have the
-- "invalid" flag set.
\d concur_heap
Table "public.concur_heap"
 Column | Type | Modifiers 
--------+------+-----------
 f1     | text | 
 f2     | text | 
Indexes:
    "concur_index2" UNIQUE, btree (f1)
    "concur_index1" btree (f2, f1)
    "concur_index4" btree (f2) WHERE f1 = 'a'::text
    "concur_index5" btree (f2) WHERE f1 = 'x'::text
    "concur_index6" btree ((f2 || f1))
    "std_index" btree (f2)
Distributed by: (f1)

DROP TABLE concur_heap;
SET enable_seqscan = OFF;
SET enable_indexscan = ON;
SET enable_bitmapscan = ON;
create table bm_test (i int, t text);
NOTICE:  Table doesn't have 'DISTRIBUTED BY' clause -- Using column named 'i' as the Greenplum Database data distribution key for this table.
HINT:  The 'DISTRIBUTED BY' clause determines the distribution of data. Make sure column(s) chosen are the optimal data distribution key to minimize skew.
insert into bm_test select i % 10, (i % 10)::text  from generate_series(1, 100) i;
create index bm_test_idx on bm_test using bitmap (i);
select count(*) from bm_test where i=1;
 count 
-------
    10
(1 row)

select count(*) from bm_test where i in(1, 2);
 count 
-------
    20
(1 row)

select * from bm_test where i > 10;
 i | t 
---+---
(0 rows)

reindex index bm_test_idx;
select count(*) from bm_test where i in(1, 2);
 count 
-------
    20
(1 row)

drop index bm_test_idx;
create index bm_test_multi_idx on bm_test using bitmap(i, t);
select * from bm_test where i=5 and t='5';
 i | t 
---+---
 5 | 5
 5 | 5
 5 | 5
 5 | 5
 5 | 5
 5 | 5
 5 | 5
 5 | 5
 5 | 5
 5 | 5
(10 rows)

select * from bm_test where i=5 or t='6';
 i | t 
---+---
 5 | 5
 5 | 5
 5 | 5
 5 | 5
 5 | 5
 5 | 5
 5 | 5
 5 | 5
 5 | 5
 5 | 5
 6 | 6
 6 | 6
 6 | 6
 6 | 6
 6 | 6
 6 | 6
 6 | 6
 6 | 6
 6 | 6
 6 | 6
(20 rows)

select * from bm_test where i between 1 and 10 and i::text = t;
 i | t 
---+---
 2 | 2
 4 | 4
 6 | 6
 8 | 8
 2 | 2
 4 | 4
 6 | 6
 8 | 8
 2 | 2
 4 | 4
 6 | 6
 8 | 8
 2 | 2
 4 | 4
 6 | 6
 8 | 8
 2 | 2
 4 | 4
 6 | 6
 8 | 8
 2 | 2
 4 | 4
 6 | 6
 8 | 8
 2 | 2
 4 | 4
 6 | 6
 8 | 8
 2 | 2
 4 | 4
 6 | 6
 8 | 8
 2 | 2
 4 | 4
 6 | 6
 8 | 8
 2 | 2
 4 | 4
 6 | 6
 8 | 8
 1 | 1
 3 | 3
 5 | 5
 7 | 7
 9 | 9
 1 | 1
 3 | 3
 5 | 5
 7 | 7
 9 | 9
 1 | 1
 3 | 3
 5 | 5
 7 | 7
 9 | 9
 1 | 1
 3 | 3
 5 | 5
 7 | 7
 9 | 9
 1 | 1
 3 | 3
 5 | 5
 7 | 7
 9 | 9
 1 | 1
 3 | 3
 5 | 5
 7 | 7
 9 | 9
 1 | 1
 3 | 3
 5 | 5
 7 | 7
 9 | 9
 1 | 1
 3 | 3
 5 | 5
 7 | 7
 9 | 9
 1 | 1
 3 | 3
 5 | 5
 7 | 7
 9 | 9
 1 | 1
 3 | 3
 5 | 5
 7 | 7
 9 | 9
(90 rows)

drop table bm_test;
-- test a bunch of different data types
create table bm_test (i2 int2, i4 int4, i8 int8, f4 float4, f8 float8,
	n numeric(10, 3), t1 varchar(3), t2 char(3), t3 text, a int[2],
	ip inet, b bytea, t timestamp, d date, g bool);
NOTICE:  Table doesn't have 'DISTRIBUTED BY' clause -- Using column named 'i2' as the Greenplum Database data distribution key for this table.
HINT:  The 'DISTRIBUTED BY' clause determines the distribution of data. Make sure column(s) chosen are the optimal data distribution key to minimize skew.
insert into bm_test values(1, 1, 1, 1.0, 1.0, 1000.333, '1', '1', '1',
    array[1, 3], '127.0.0.1', E'\001', '2007-01-01 01:01:01',
    '2007-01-01', 't');
insert into bm_test values(2, 2, 2, 2.0, 2.0, 2000.333, '2', '2', 'foo',
    array[2, 6], '127.0.0.2', E'\002', '2007-01-02 01:01:01',
    '2007-01-02', 'f');
insert into bm_test default values; -- test nulls
create index bm_i2_idx on bm_test using bitmap(i2);
create index bm_i4_idx on bm_test using bitmap(i4);
create index bm_i8_idx on bm_test using bitmap(i8);
create index bm_f4_idx on bm_test using bitmap(f4);
create index bm_f8_idx on bm_test using bitmap(f8);
create index bm_n_idx on bm_test using bitmap(n);
create index bm_t1_idx on bm_test using bitmap(t1);
create index bm_t2_idx on bm_test using bitmap(t2);
create index bm_t3_idx on bm_test using bitmap(t3);
create index bm_a_idx on bm_test using bitmap(a);
create index bm_ip_idx on bm_test using bitmap(ip);
create index bm_b_idx on bm_test using bitmap(b);
create index bm_t_idx on bm_test using bitmap(t);
create index bm_d_idx on bm_test using bitmap(d);
create index bm_g_idx on bm_test using bitmap(g);
create index bm_t3_upper_idx on bm_test using bitmap(upper(t3));
create index bm_n_null_idx on bm_test using bitmap(n) WHERE n ISNULL;
-- Try some cross type stuff
select a.t from bm_test a, bm_test b where a.i2 = b.i2;
            t             
--------------------------
 Tue Jan 02 01:01:01 2007
 Mon Jan 01 01:01:01 2007
(2 rows)

select a.t from bm_test a, bm_test b where a.i2 = b.i4;
            t             
--------------------------
 Mon Jan 01 01:01:01 2007
 Tue Jan 02 01:01:01 2007
(2 rows)

select a.t from bm_test a, bm_test b where a.i2 = b.i8;
            t             
--------------------------
 Mon Jan 01 01:01:01 2007
 Tue Jan 02 01:01:01 2007
(2 rows)

select a.t from bm_test a, bm_test b where b.f4 = a.f8 and a.f8 = '2.0';
            t             
--------------------------
 Tue Jan 02 01:01:01 2007
(1 row)

-- some range queries
select a.t from bm_test a, bm_test b where a.n < b.n;
            t             
--------------------------
 Mon Jan 01 01:01:01 2007
(1 row)

select a.t from bm_test a, bm_test b where a.ip < b.ip;
            t             
--------------------------
 Mon Jan 01 01:01:01 2007
(1 row)

-- or queries
select a.t from bm_test a, bm_test b where a.ip=b.ip OR a.b = b.b;
            t             
--------------------------
 Mon Jan 01 01:01:01 2007
 Tue Jan 02 01:01:01 2007
(2 rows)

-- and
select a.t from bm_test a, bm_test b where a.ip=b.ip and a.b = b.b and a.i2=1;
            t             
--------------------------
 Mon Jan 01 01:01:01 2007
(1 row)

-- subquery
select a.t from bm_test a where d in(select d from bm_test b where a.g=b.g);
            t             
--------------------------
 Mon Jan 01 01:01:01 2007
 Tue Jan 02 01:01:01 2007
(2 rows)

-- functional and predicate indexes
select t from bm_test where upper(t3) = 'FOO';
            t             
--------------------------
 Tue Jan 02 01:01:01 2007
(1 row)

select t from bm_test where n ISNULL;
 t 
---
 
(1 row)

-- bitmap index builds do not support concurrent building, test for this
create index concurrently should_not_work on bm_test using bitmap(a);
ERROR:  CONCURRENTLY is not supported when creating bitmap indexes (bitmap.c:69)
-- test updates
update bm_test set i4 = 3;
-- should return nothing
select * from bm_test where i4 = 1;
 i2 | i4 | i8 | f4 | f8 | n | t1 | t2 | t3 | a | ip | b | t | d | g 
----+----+----+----+----+---+----+----+----+---+----+---+---+---+---
(0 rows)

-- should return all
select * from bm_test where i4=3;
 i2 | i4 | i8 | f4 | f8 |    n     | t1 | t2  | t3  |   a   |    ip     |  b   |            t             |     d      | g 
----+----+----+----+----+----------+----+-----+-----+-------+-----------+------+--------------------------+------------+---
  1 |  3 |  1 |  1 |  1 | 1000.333 | 1  | 1   | 1   | {1,3} | 127.0.0.1 | \001 | Mon Jan 01 01:01:01 2007 | 01-01-2007 | t
    |  3 |    |    |    |          |    |     |     |       |           |      |                          |            | 
  2 |  3 |  2 |  2 |  2 | 2000.333 | 2  | 2   | foo | {2,6} | 127.0.0.2 | \002 | Tue Jan 02 01:01:01 2007 | 01-02-2007 | f
(3 rows)

-- should return one row
select * from bm_test where i2=1;
 i2 | i4 | i8 | f4 | f8 |    n     | t1 | t2  | t3 |   a   |    ip     |  b   |            t             |     d      | g 
----+----+----+----+----+----------+----+-----+----+-------+-----------+------+--------------------------+------------+---
  1 |  3 |  1 |  1 |  1 | 1000.333 | 1  | 1   | 1  | {1,3} | 127.0.0.1 | \001 | Mon Jan 01 01:01:01 2007 | 01-01-2007 | t
(1 row)

-- test splitting of words
-- We distribute by k and only insert a single distinct value in that 
-- field so that we can be guaranteed of behaviour. We're not testing
-- the parallel mechanism here so it's fine to harass a single backend
create table bm_test2 (i int, j int, k int) distributed by (k);
create index bm_test2_i_idx on bm_test2 using bitmap(i);
insert into bm_test2 select 1,
case when (i % (16 * 16 + 8)) = 0 then 2  else 1 end, 1
from generate_series(1, 16 * 16 * 16) i;
select count(*) from bm_test2 where i = 1;
 count 
-------
  4096
(1 row)

select count(*) from bm_test2 where j = 2;
 count 
-------
    15
(1 row)

-- break some compressed words
update bm_test2 set i = 2 where j = 2;
select count(*) from bm_test2 where i = 1;
 count 
-------
  4081
(1 row)

select count(*) from bm_test2 where i = 2;
 count 
-------
    15
(1 row)

update bm_test2 set i = 3 where i = 1;
select count(*) from bm_test2 where i = 1;
 count 
-------
     0
(1 row)

select count(*) from bm_test2 where i = 2;
 count 
-------
    15
(1 row)

select count(*) from bm_test2 where i = 3;
 count 
-------
  4081
(1 row)

-- now try and break a whole page
-- bitmap words are 16 bits so, with no compression we get about 
-- 16500 words per 32K page. So, what we want to do is, insert
-- 8250 uncompressed words, then a compressed word, then more uncompressed
-- words until the page is full. After this, we can break the compressed word
-- and there by test the word spliting system
create table bm_test3 (i int, j int, k int) distributed by (k);
create index bm_test3_i_idx on bm_test3 using bitmap(i);
insert into bm_test3 select i, 1, 1 from
generate_series(1, 8250 * 8) g, generate_series(1, 2) i;
insert into bm_test3 
select 17, 1, 1 from generate_series(1, 16 * 16) i;
insert into bm_test3 values(17, 2, 1);
insert into bm_test3
select 17, 1, 1 from generate_series(1, 16 * 16) i;
insert into bm_test3 select i, 1, 1 from
generate_series(1, 8250 * 8) g, generate_series(1, 2) i;
select count(*) from bm_test3 where i = 1;
 count  
--------
 132000
(1 row)

select count(*) from bm_test3 where i = 17;
 count 
-------
   513
(1 row)

select count(*) from bm_test3 where i = 17 and j = 2;
 count 
-------
     1
(1 row)

update bm_test3 set i = 18 where i = 17 and j = 2;
select count(*) from bm_test3 where i = 1;
 count  
--------
 132000
(1 row)

select count(*) from bm_test3 where i = 2;
 count  
--------
 132000
(1 row)

select count(*) from bm_test3 where i = 17;
 count 
-------
   512
(1 row)

select count(*) from bm_test3 where i = 18;
 count 
-------
     1
(1 row)

drop table bm_test;
drop table bm_test2;
drop table bm_test3;
create table bm_test (i int, j int);
NOTICE:  Table doesn't have 'DISTRIBUTED BY' clause -- Using column named 'i' as the Greenplum Database data distribution key for this table.
HINT:  The 'DISTRIBUTED BY' clause determines the distribution of data. Make sure column(s) chosen are the optimal data distribution key to minimize skew.
insert into bm_test values (0, 0), (0, 0), (0, 1), (1,0), (1,0), (1,1);
create index bm_test_j on bm_test using bitmap(j);
delete from bm_test where j =1;
vacuum bm_test;
insert into bm_test values (0, 0), (1,0);
set enable_seqscan=off;
set enable_bitmapscan=off;
explain select * from bm_test where j = 1;
                                   QUERY PLAN                                    
---------------------------------------------------------------------------------
 Gather Motion 2:1  (slice1; segments: 2)  (cost=0.00..400.28 rows=1 width=8)
   ->  Index Scan using bm_test_j on bm_test  (cost=0.00..400.28 rows=1 width=8)
         Index Cond: j = 1
 Settings:  enable_bitmapscan=off; enable_indexscan=on; enable_seqscan=off
(4 rows)

select * from bm_test where j = 1;
 i | j 
---+---
(0 rows)

drop table bm_test;
-- MPP-3232
create table bm_test (i int,j int);
NOTICE:  Table doesn't have 'DISTRIBUTED BY' clause -- Using column named 'i' as the Greenplum Database data distribution key for this table.
HINT:  The 'DISTRIBUTED BY' clause determines the distribution of data. Make sure column(s) chosen are the optimal data distribution key to minimize skew.
insert into bm_test values (1, 1), (1, 2);
create index bm_test_j on bm_test using bitmap(j);
update bm_test set j=20 where j=1;
vacuum bm_test;
drop table bm_test;
-- unique index with null value tests
drop table if exists ijk;
NOTICE:  table "ijk" does not exist, skipping
create table ijk(i int, j int, k int);
NOTICE:  Table doesn't have 'DISTRIBUTED BY' clause -- Using column named 'i' as the Greenplum Database data distribution key for this table.
HINT:  The 'DISTRIBUTED BY' clause determines the distribution of data. Make sure column(s) chosen are the optimal data distribution key to minimize skew.
insert into ijk values (1, 1, 3);
insert into ijk values (1, 2, 4);
insert into ijk values (1, 3, NULL);
insert into ijk values (1, 3, NULL);
insert into ijk values (1, NULL, NULL);
insert into ijk values (1, NULL, NULL);
-- should fail.
create unique index ijk_i on ijk(i);
ERROR:  could not create unique index  (seg0 jeffsmac:11001 pid=62532)
DETAIL:  Table contains duplicate values.
create unique index ijk_ij on ijk(i,j);
ERROR:  could not create unique index  (seg0 jeffsmac:11001 pid=62532)
DETAIL:  Table contains duplicate values.
-- should OK.
create unique index ijk_ijk on ijk(i,j,k);
set gp_enable_mk_sort=on;
drop table if exists ijk;
create table ijk(i int, j int, k int);
NOTICE:  Table doesn't have 'DISTRIBUTED BY' clause -- Using column named 'i' as the Greenplum Database data distribution key for this table.
HINT:  The 'DISTRIBUTED BY' clause determines the distribution of data. Make sure column(s) chosen are the optimal data distribution key to minimize skew.
insert into ijk values (1, 1, 3);
insert into ijk values (1, 2, 4);
insert into ijk values (1, 3, NULL);
insert into ijk values (1, 3, NULL);
insert into ijk values (1, NULL, NULL);
insert into ijk values (1, NULL, NULL);
-- should fail.
create unique index ijk_i on ijk(i);
ERROR:  could not create unique index  (seg0 jeffsmac:11001 pid=62532)
DETAIL:  Table contains duplicate values.
create unique index ijk_ij on ijk(i,j);
ERROR:  could not create unique index  (seg0 jeffsmac:11001 pid=62532)
DETAIL:  Table contains duplicate values.
-- should OK.
create unique index ijk_ijk on ijk(i,j,k);
set gp_enable_mk_sort=off;
drop table ijk;
---------
-- test bitmaps with NULL and non-NULL values (MPP-8461)
--
create table bmap_test (x int, y int, z int);
NOTICE:  Table doesn't have 'DISTRIBUTED BY' clause -- Using column named 'x' as the Greenplum Database data distribution key for this table.
HINT:  The 'DISTRIBUTED BY' clause determines the distribution of data. Make sure column(s) chosen are the optimal data distribution key to minimize skew.
insert into bmap_test values (1,NULL,NULL);
insert into bmap_test values (NULL,1,NULL);
insert into bmap_test values (NULL,NULL,1);
insert into bmap_test values (1,NULL,NULL);
insert into bmap_test values (NULL,1,NULL);
insert into bmap_test values (NULL,NULL,1);
insert into bmap_test values (1,NULL,5);
insert into bmap_test values (NULL,1,NULL);
insert into bmap_test values (NULL,NULL,1);
insert into bmap_test select a from generate_series(1,10*1000) as s(a);
create index bmap_test_idx_1 on bmap_test using bitmap (x,y,z);
analyze bmap_test;
select * from bmap_test where x = 1 order by x,y,z;
 x | y | z 
---+---+---
 1 |   | 5
 1 |   |  
 1 |   |  
 1 |   |  
(4 rows)

drop table bmap_test;
