-- turn off autostats so we don't have to worry about the logging of the autostat queries
set gp_autostats_mode = None;
-- create needed tables
create table direct_test
(
  key int NULL,
  value varchar(50) NULL
)
distributed by (key); 
create table direct_test_two_column
(
  key1 int NULL,
  key2 int NULL,
  value varchar(50) NULL
)
distributed by (key1, key2);
create table direct_test_bitmap  as select '2008-02-01'::DATE AS DT,
        case when j <= 996
                then 0
        when j<= 998 then 2
        when j<=999 then 3
        when i%10000 < 9000 then 4
        when i%10000 < 9800 then 5
        when i % 10000 <= 9998 then 5 else 6
        end as ind,
        (i*1017-j)::bigint as s from generate_series(1,10) i, generate_series(1,10) j distributed by (dt);
create index direct_test_bitmap_idx on direct_test_bitmap using bitmap (ind, dt);
CREATE TABLE direct_test_partition (trans_id int, date date, amount decimal(9,2), region text) DISTRIBUTED BY (trans_id) PARTITION BY RANGE (date) (START (date '2008-01-01') INCLUSIVE END (date '2009-01-01') EXCLUSIVE EVERY (INTERVAL '1month') );
NOTICE:  CREATE TABLE will create partition "direct_test_partition_1_prt_1" for table "direct_test_partition"
NOTICE:  CREATE TABLE will create partition "direct_test_partition_1_prt_2" for table "direct_test_partition"
NOTICE:  CREATE TABLE will create partition "direct_test_partition_1_prt_3" for table "direct_test_partition"
NOTICE:  CREATE TABLE will create partition "direct_test_partition_1_prt_4" for table "direct_test_partition"
NOTICE:  CREATE TABLE will create partition "direct_test_partition_1_prt_5" for table "direct_test_partition"
NOTICE:  CREATE TABLE will create partition "direct_test_partition_1_prt_6" for table "direct_test_partition"
NOTICE:  CREATE TABLE will create partition "direct_test_partition_1_prt_7" for table "direct_test_partition"
NOTICE:  CREATE TABLE will create partition "direct_test_partition_1_prt_8" for table "direct_test_partition"
NOTICE:  CREATE TABLE will create partition "direct_test_partition_1_prt_9" for table "direct_test_partition"
NOTICE:  CREATE TABLE will create partition "direct_test_partition_1_prt_10" for table "direct_test_partition"
NOTICE:  CREATE TABLE will create partition "direct_test_partition_1_prt_11" for table "direct_test_partition"
NOTICE:  CREATE TABLE will create partition "direct_test_partition_1_prt_12" for table "direct_test_partition"
create unique index direct_test_uk on direct_test_partition(trans_id);
NOTICE:  building index for child partition "direct_test_partition_1_prt_1"
NOTICE:  building index for child partition "direct_test_partition_1_prt_2"
NOTICE:  building index for child partition "direct_test_partition_1_prt_3"
NOTICE:  building index for child partition "direct_test_partition_1_prt_4"
NOTICE:  building index for child partition "direct_test_partition_1_prt_5"
NOTICE:  building index for child partition "direct_test_partition_1_prt_6"
NOTICE:  building index for child partition "direct_test_partition_1_prt_7"
NOTICE:  building index for child partition "direct_test_partition_1_prt_8"
NOTICE:  building index for child partition "direct_test_partition_1_prt_9"
NOTICE:  building index for child partition "direct_test_partition_1_prt_10"
NOTICE:  building index for child partition "direct_test_partition_1_prt_11"
NOTICE:  building index for child partition "direct_test_partition_1_prt_12"
create table direct_test_range_partition (a int, b int, c int, d int) partition by range(d) (start(1) end(10) every(1));
NOTICE:  Table doesn't have 'DISTRIBUTED BY' clause -- Using column named 'a' as the Greenplum Database data distribution key for this table.
HINT:  The 'DISTRIBUTED BY' clause determines the distribution of data. Make sure column(s) chosen are the optimal data distribution key to minimize skew.
NOTICE:  CREATE TABLE will create partition "direct_test_range_partition_1_prt_1" for table "direct_test_range_partition"
NOTICE:  CREATE TABLE will create partition "direct_test_range_partition_1_prt_2" for table "direct_test_range_partition"
NOTICE:  CREATE TABLE will create partition "direct_test_range_partition_1_prt_3" for table "direct_test_range_partition"
NOTICE:  CREATE TABLE will create partition "direct_test_range_partition_1_prt_4" for table "direct_test_range_partition"
NOTICE:  CREATE TABLE will create partition "direct_test_range_partition_1_prt_5" for table "direct_test_range_partition"
NOTICE:  CREATE TABLE will create partition "direct_test_range_partition_1_prt_6" for table "direct_test_range_partition"
NOTICE:  CREATE TABLE will create partition "direct_test_range_partition_1_prt_7" for table "direct_test_range_partition"
NOTICE:  CREATE TABLE will create partition "direct_test_range_partition_1_prt_8" for table "direct_test_range_partition"
NOTICE:  CREATE TABLE will create partition "direct_test_range_partition_1_prt_9" for table "direct_test_range_partition"
insert into direct_test_range_partition select i, i+1, i+2, i+3 from generate_series(1, 2) i;
create table direct_test_type_real (real1 real, smallint1 smallint, boolean1 boolean, int1 int, double1 double precision, date1 date, numeric1 numeric) distributed by (real1);
create table direct_test_type_smallint (real1 real, smallint1 smallint, boolean1 boolean, int1 int, double1 double precision, date1 date, numeric1 numeric) distributed by (smallint1);
create table direct_test_type_boolean (real1 real, smallint1 smallint, boolean1 boolean, int1 int, double1 double precision, date1 date, numeric1 numeric) distributed by (boolean1);
create table direct_test_type_int (real1 real, smallint1 smallint, boolean1 boolean, int1 int, double1 double precision, date1 date, numeric1 numeric) distributed by (int1);
create table direct_test_type_double (real1 real, smallint1 smallint, boolean1 boolean, int1 int, double1 double precision, date1 date, numeric1 numeric) distributed by (double1);
create table direct_test_type_date (real1 real, smallint1 smallint, boolean1 boolean, int1 int, double1 double precision, date1 date, numeric1 numeric) distributed by (date1);
create table direct_test_type_numeric (real1 real, smallint1 smallint, boolean1 boolean, int1 int, double1 double precision, date1 date, numeric1 numeric) distributed by (numeric1);
create table direct_test_type_abstime (x abstime) distributed by (x);
create table direct_test_type_bit (x bit) distributed by (x);
create table direct_test_type_bpchar (x bpchar) distributed by (x);
create table direct_test_type_bytea (x bytea) distributed by (x);
create table direct_test_type_cidr (x cidr) distributed by (x);
create table direct_test_type_inet (x inet) distributed by (x);
create table direct_test_type_macaddr (x macaddr) distributed by (x);
create table direct_test_type_tinterval (x tinterval) distributed by (x);
create table direct_test_type_varbit (x varbit) distributed by (x);
-- enable printing of printing info
set test_print_direct_dispatch_info=on;
-- Constant single-row insert, one column in distribution
-- DO direct dispatch
insert into direct_test values (100, 'cow');
INFO:  Dispatch command to SINGLE content
INFO:  Distributed transaction command 'Distributed Prepare' to SINGLE content
INFO:  Distributed transaction command 'Distributed Commit Prepared' to SINGLE content
-- verify
select * from direct_test order by key, value;
INFO:  Dispatch command to ALL contents
 key | value 
-----+-------
 100 | cow
(1 row)

-- Constant single-row update, one column in distribution
-- DO direct dispatch
update direct_test set value = 'horse' where key = 100;
INFO:  Dispatch command to SINGLE content
INFO:  Distributed transaction command 'Distributed Prepare' to SINGLE content
INFO:  Distributed transaction command 'Distributed Commit Prepared' to SINGLE content
-- verify
select * from direct_test order by key, value;
INFO:  Dispatch command to ALL contents
 key | value 
-----+-------
 100 | horse
(1 row)

-- Constant single-row delete, one column in distribution
-- DO direct dispatch
delete from direct_test where key = 100;
INFO:  Dispatch command to SINGLE content
INFO:  Distributed transaction command 'Distributed Prepare' to SINGLE content
INFO:  Distributed transaction command 'Distributed Commit Prepared' to SINGLE content
-- verify
select * from direct_test order by key, value;
INFO:  Dispatch command to ALL contents
 key | value 
-----+-------
(0 rows)

-- Constant single-row insert, one column in distribution
-- DO direct dispatch
insert into direct_test values (NULL, 'cow');
INFO:  Dispatch command to SINGLE content
INFO:  Distributed transaction command 'Distributed Prepare' to SINGLE content
INFO:  Distributed transaction command 'Distributed Commit Prepared' to SINGLE content
-- verify
select * from direct_test order by key, value;
INFO:  Dispatch command to ALL contents
 key | value 
-----+-------
     | cow
(1 row)

-- Constant single-row insert, two columns in distribution
-- DO direct dispatch
insert into direct_test_two_column values (100, 101, 'cow');
INFO:  Dispatch command to SINGLE content
INFO:  Distributed transaction command 'Distributed Prepare' to SINGLE content
INFO:  Distributed transaction command 'Distributed Commit Prepared' to SINGLE content
-- verify
select * from direct_test_two_column order by key1, key2, value;
INFO:  Dispatch command to ALL contents
 key1 | key2 | value 
------+------+-------
  100 |  101 | cow
(1 row)

-- Constant single-row update, two columns in distribution
-- DO direct dispatch
update direct_test_two_column set value = 'horse' where key1 = 100 and key2 = 101;
INFO:  Dispatch command to SINGLE content
INFO:  Distributed transaction command 'Distributed Prepare' to SINGLE content
INFO:  Distributed transaction command 'Distributed Commit Prepared' to SINGLE content
-- verify
select * from direct_test_two_column order by key1, key2, value;
INFO:  Dispatch command to ALL contents
 key1 | key2 | value 
------+------+-------
  100 |  101 | horse
(1 row)

-- Constant single-row delete, two columns in distribution
-- DO direct dispatch
delete from direct_test_two_column where key1 = 100 and key2 = 101;
INFO:  Dispatch command to SINGLE content
INFO:  Distributed transaction command 'Distributed Prepare' to SINGLE content
INFO:  Distributed transaction command 'Distributed Commit Prepared' to SINGLE content
-- verify
select * from direct_test_two_column order by key1, key2, value;
INFO:  Dispatch command to ALL contents
 key1 | key2 | value 
------+------+-------
(0 rows)

-- expression single-row insert
-- DO direct dispatch
insert into direct_test (key, value) values ('123',123123);
INFO:  Dispatch command to SINGLE content
INFO:  Distributed transaction command 'Distributed Prepare' to SINGLE content
INFO:  Distributed transaction command 'Distributed Commit Prepared' to SINGLE content
insert into direct_test (key, value) values (sqrt(100*10*10),123123);
INFO:  Dispatch command to SINGLE content
INFO:  Distributed transaction command 'Distributed Prepare' to SINGLE content
INFO:  Distributed transaction command 'Distributed Commit Prepared' to SINGLE content
--
-- should get 100 and 123 as the values
--
select * from direct_test where value = 123123 order by key;
INFO:  Dispatch command to ALL contents
 key | value  
-----+--------
 100 | 123123
 123 | 123123
(2 rows)

delete from direct_test where value = 123123;
INFO:  Dispatch command to ALL contents
INFO:  Distributed transaction command 'Distributed Prepare' to ALL contents
INFO:  Distributed transaction command 'Distributed Commit Prepared' to ALL contents
--------------------------------------------------------------------------------
-- Multiple row update, where clause lists multiple values which hash differently so no direct dispatch
--
-- note that if the hash function for values changes then certain segment configurations may actually 
--                hash all these values to the same content! (and so test would change)
--
update direct_test set value = 'pig' where key in (1,2,3,4,5);
INFO:  Dispatch command to ALL contents
INFO:  Distributed transaction command 'Distributed Prepare' to ALL contents
INFO:  Distributed transaction command 'Distributed Commit Prepared' to ALL contents
update direct_test_two_column set value = 'pig' where key1 = 100 and key2 in (1,2,3,4);
INFO:  Dispatch command to ALL contents
INFO:  Distributed transaction command 'Distributed Prepare' to ALL contents
INFO:  Distributed transaction command 'Distributed Commit Prepared' to ALL contents
update direct_test_two_column set value = 'pig' where key1 in (100,101,102,103,104) and key2 in (1);
INFO:  Dispatch command to ALL contents
INFO:  Distributed transaction command 'Distributed Prepare' to ALL contents
INFO:  Distributed transaction command 'Distributed Commit Prepared' to ALL contents
update direct_test_two_column set value = 'pig' where key1 in (100,101) and key2 in (1,2);
INFO:  Dispatch command to ALL contents
INFO:  Distributed transaction command 'Distributed Prepare' to ALL contents
INFO:  Distributed transaction command 'Distributed Commit Prepared' to ALL contents
-- Multiple row update, where clause lists values which all hash to same segment
-- DO direct dispatch
-- CAN'T IMPLEMENT THIS TEST BECAUSE THE # of segments changes again (unless we use a # of segments function, and exploit the simple nature of int4 hashing -- can we do that?)
------------------------------
-- Transaction cases
--
-- note that single-row insert can happen BUT DTM will always go to all contents
--
begin;
insert into direct_test values (1,100);
INFO:  Dispatch command to SINGLE content
rollback;
INFO:  Distributed transaction command 'Distributed Abort (No Prepared)' to ALL contents
begin;
insert into direct_test values (1,100);
INFO:  Dispatch command to SINGLE content
insert into direct_test values (2,100);
INFO:  Dispatch command to SINGLE content
insert into direct_test values (3,100);
INFO:  Dispatch command to SINGLE content
rollback;
INFO:  Distributed transaction command 'Distributed Abort (No Prepared)' to ALL contents
-------------------
-- MPP-7634: bitmap index scan
--
select count(*) from direct_test_bitmap where dt='2008-02-05';
INFO:  Dispatch command to SINGLE content
 count 
-------
     0
(1 row)

select count(*) from direct_test_bitmap where dt='2008-02-01';
INFO:  Dispatch command to SINGLE content
 count 
-------
   100
(1 row)

----------------------------------------------------------------------------------
-- MPP-7637: partitioned table
--
insert into direct_test_partition values (1,'2008-01-02',1,'usa');
INFO:  Dispatch command to SINGLE content
INFO:  Distributed transaction command 'Distributed Prepare' to SINGLE content
INFO:  Distributed transaction command 'Distributed Commit Prepared' to SINGLE content
select * from direct_test_partition where trans_id =1;
INFO:  Dispatch command to SINGLE content
 trans_id |    date    | amount | region 
----------+------------+--------+--------
        1 | 01-02-2008 |   1.00 | usa
(1 row)

----------------------------------------------------------------------------------
-- MPP-7638: range table partition
--
select count(*) from direct_test_range_partition where a =1;
INFO:  Dispatch command to SINGLE content
 count 
-------
     1
(1 row)

----------------------------------------------------------------------------------
-- MPP-7643: various types
--
insert into direct_test_type_real values (8,8,true,8,8,'2008-08-08',8.8);
INFO:  Dispatch command to SINGLE content
INFO:  Distributed transaction command 'Distributed Prepare' to SINGLE content
INFO:  Distributed transaction command 'Distributed Commit Prepared' to SINGLE content
insert into direct_test_type_smallint values (8,8,true,8,8,'2008-08-08',8.8);
INFO:  Dispatch command to SINGLE content
INFO:  Distributed transaction command 'Distributed Prepare' to SINGLE content
INFO:  Distributed transaction command 'Distributed Commit Prepared' to SINGLE content
insert into direct_test_type_boolean values (8,8,true,8,8,'2008-08-08',8.8);
INFO:  Dispatch command to SINGLE content
INFO:  Distributed transaction command 'Distributed Prepare' to SINGLE content
INFO:  Distributed transaction command 'Distributed Commit Prepared' to SINGLE content
insert into direct_test_type_int values (8,8,true,8,8,'2008-08-08',8.8);
INFO:  Dispatch command to SINGLE content
INFO:  Distributed transaction command 'Distributed Prepare' to SINGLE content
INFO:  Distributed transaction command 'Distributed Commit Prepared' to SINGLE content
insert into direct_test_type_double values (8,8,true,8,8,'2008-08-08',8.8);
INFO:  Dispatch command to SINGLE content
INFO:  Distributed transaction command 'Distributed Prepare' to SINGLE content
INFO:  Distributed transaction command 'Distributed Commit Prepared' to SINGLE content
insert into direct_test_type_date values (8,8,true,8,8,'2008-08-08',8.8);
INFO:  Dispatch command to SINGLE content
INFO:  Distributed transaction command 'Distributed Prepare' to SINGLE content
INFO:  Distributed transaction command 'Distributed Commit Prepared' to SINGLE content
insert into direct_test_type_numeric values (8,8,true,8,8,'2008-08-08',8.8);
INFO:  Dispatch command to SINGLE content
INFO:  Distributed transaction command 'Distributed Prepare' to SINGLE content
INFO:  Distributed transaction command 'Distributed Commit Prepared' to SINGLE content
select * from direct_test_type_real where real1 = 8::real;
INFO:  Dispatch command to SINGLE content
 real1 | smallint1 | boolean1 | int1 | double1 |   date1    | numeric1 
-------+-----------+----------+------+---------+------------+----------
     8 |         8 | t        |    8 |       8 | 08-08-2008 |      8.8
(1 row)

select * from direct_test_type_smallint where smallint1 = 8::smallint;
INFO:  Dispatch command to SINGLE content
 real1 | smallint1 | boolean1 | int1 | double1 |   date1    | numeric1 
-------+-----------+----------+------+---------+------------+----------
     8 |         8 | t        |    8 |       8 | 08-08-2008 |      8.8
(1 row)

select * from direct_test_type_int where int1 = 8;
INFO:  Dispatch command to SINGLE content
 real1 | smallint1 | boolean1 | int1 | double1 |   date1    | numeric1 
-------+-----------+----------+------+---------+------------+----------
     8 |         8 | t        |    8 |       8 | 08-08-2008 |      8.8
(1 row)

select * from direct_test_type_double where double1 = 8;
INFO:  Dispatch command to SINGLE content
 real1 | smallint1 | boolean1 | int1 | double1 |   date1    | numeric1 
-------+-----------+----------+------+---------+------------+----------
     8 |         8 | t        |    8 |       8 | 08-08-2008 |      8.8
(1 row)

select * from direct_test_type_date where date1 = '2008-08-08';
INFO:  Dispatch command to SINGLE content
 real1 | smallint1 | boolean1 | int1 | double1 |   date1    | numeric1 
-------+-----------+----------+------+---------+------------+----------
     8 |         8 | t        |    8 |       8 | 08-08-2008 |      8.8
(1 row)

select * from direct_test_type_numeric where numeric1 = 8.8;
INFO:  Dispatch command to SINGLE content
 real1 | smallint1 | boolean1 | int1 | double1 |   date1    | numeric1 
-------+-----------+----------+------+---------+------------+----------
     8 |         8 | t        |    8 |       8 | 08-08-2008 |      8.8
(1 row)

----------------------------------------------------------------------------------
-- Prepared statements
--  do same as above ones but using prepared statements, verify data goes to the right spot
prepare test_insert (int) as insert into direct_test values ($1,100);
execute test_insert(1);
INFO:  Dispatch command to SINGLE content
INFO:  Distributed transaction command 'Distributed Prepare' to SINGLE content
INFO:  Distributed transaction command 'Distributed Commit Prepared' to SINGLE content
execute test_insert(2);
INFO:  Dispatch command to SINGLE content
INFO:  Distributed transaction command 'Distributed Prepare' to SINGLE content
INFO:  Distributed transaction command 'Distributed Commit Prepared' to SINGLE content
select * from direct_test;
INFO:  Dispatch command to ALL contents
 key | value 
-----+-------
   2 | 100
     | cow
   1 | 100
(3 rows)

prepare test_update (int) as update direct_test set value = 'boo' where key = $1;
execute test_update(2);
INFO:  Dispatch command to SINGLE content
INFO:  Distributed transaction command 'Distributed Prepare' to SINGLE content
INFO:  Distributed transaction command 'Distributed Commit Prepared' to SINGLE content
select * from direct_test;
INFO:  Dispatch command to ALL contents
 key | value 
-----+-------
     | cow
   1 | 100
   2 | boo
(3 rows)

------------------------
-- A subquery
--
set test_print_direct_dispatch_info=off;
CREATE TEMP TABLE direct_dispatch_foo (id integer) DISTRIBUTED BY (id);
CREATE TEMP TABLE direct_dispatch_bar (id1 integer, id2 integer) DISTRIBUTED by (id1);
INSERT INTO direct_dispatch_foo VALUES (1);
INSERT INTO direct_dispatch_bar VALUES (1, 1);
INSERT INTO direct_dispatch_bar VALUES (2, 2);
INSERT INTO direct_dispatch_bar VALUES (3, 1);
set test_print_direct_dispatch_info=on;
SELECT * FROM direct_dispatch_foo WHERE id IN
    (SELECT id2 FROM (SELECT DISTINCT id1, id2 FROM direct_dispatch_bar WHERE direct_dispatch_bar.id1 = 1) AS s) ORDER BY 1;
INFO:  Dispatch command to ALL contents
INFO:  Dispatch command to SINGLE content
 id 
----
  1
(1 row)

--
-- this one will NOT do direct dispatch because it is a many slice query and those are disabled right now
SELECT * FROM direct_dispatch_foo WHERE id IN
    (SELECT id2 FROM (SELECT id1, id2 FROM direct_dispatch_bar WHERE direct_dispatch_bar.id1 = 1 UNION
                      SELECT id1, id2 FROM direct_dispatch_bar WHERE direct_dispatch_bar.id1 = 2) AS s) ORDER BY 1;
INFO:  Dispatch command to ALL contents
INFO:  Dispatch command to ALL contents
INFO:  Dispatch command to ALL contents
 id 
----
  1
(1 row)

-- simple one using an expression on the variable
SELECT * from direct_dispatch_foo WHERE id * id = 1;
INFO:  Dispatch command to ALL contents
 id 
----
  1
(1 row)

SELECT * from direct_dispatch_foo WHERE id * id = 1 OR id = 1;
INFO:  Dispatch command to ALL contents
 id 
----
  1
(1 row)

SELECT * from direct_dispatch_foo where id * id = 1 AND id = 1;
INFO:  Dispatch command to SINGLE content
 id 
----
  1
(1 row)

-- init plan to see how transaction escalation happens
delete from direct_dispatch_foo where id = (select max(id2) from direct_dispatch_bar where id1 = 5);
INFO:  Dispatch command to SINGLE content
INFO:  Dispatch command to ALL contents
INFO:  Distributed transaction command 'Distributed Prepare' to ALL contents
INFO:  Distributed transaction command 'Distributed Commit Prepared' to ALL contents
delete from direct_dispatch_foo where id * id = (select max(id2) from direct_dispatch_bar where id1 = 5) AND id = 3;
INFO:  Distributed transaction command 'Distributed Force Implied Writer' to ALL contents
INFO:  Dispatch command to SINGLE content
INFO:  Dispatch command to SINGLE content
INFO:  Distributed transaction command 'Distributed Prepare' to ALL contents
INFO:  Distributed transaction command 'Distributed Commit Prepared' to ALL contents
delete from direct_dispatch_foo where id * id = (select max(id2) from direct_dispatch_bar) AND id = 3;
INFO:  Distributed transaction command 'Distributed Force Implied Writer' to ALL contents
INFO:  Dispatch command to ALL contents
INFO:  Dispatch command to SINGLE content
INFO:  Distributed transaction command 'Distributed Prepare' to ALL contents
INFO:  Distributed transaction command 'Distributed Commit Prepared' to ALL contents
------------------------------------
-- more type tests 
--
-- abstime
insert into direct_test_type_abstime values('2008-08-08');
INFO:  Dispatch command to SINGLE content
INFO:  Distributed transaction command 'Distributed Prepare' to SINGLE content
INFO:  Distributed transaction command 'Distributed Commit Prepared' to SINGLE content
select 1 from direct_test_type_abstime where x = '2008-08-08';
INFO:  Dispatch command to SINGLE content
 ?column? 
----------
        1
(1 row)

insert into direct_test_type_bit values('1');
INFO:  Dispatch command to SINGLE content
INFO:  Distributed transaction command 'Distributed Prepare' to SINGLE content
INFO:  Distributed transaction command 'Distributed Commit Prepared' to SINGLE content
select * from direct_test_type_bit where x = '1';
INFO:  Dispatch command to SINGLE content
 x 
---
 1
(1 row)

insert into direct_test_type_bpchar values('abs');
INFO:  Dispatch command to SINGLE content
INFO:  Distributed transaction command 'Distributed Prepare' to SINGLE content
INFO:  Distributed transaction command 'Distributed Commit Prepared' to SINGLE content
select * from direct_test_type_bpchar where x = 'abs';
INFO:  Dispatch command to SINGLE content
  x  
-----
 abs
(1 row)

insert into direct_test_type_bytea values('greenplum');
INFO:  Dispatch command to SINGLE content
INFO:  Distributed transaction command 'Distributed Prepare' to SINGLE content
INFO:  Distributed transaction command 'Distributed Commit Prepared' to SINGLE content
select * from direct_test_type_bytea where x = 'greenplum';
INFO:  Dispatch command to SINGLE content
     x     
-----------
 greenplum
(1 row)

insert into direct_test_type_cidr values('68.44.55.111');
INFO:  Dispatch command to SINGLE content
INFO:  Distributed transaction command 'Distributed Prepare' to SINGLE content
INFO:  Distributed transaction command 'Distributed Commit Prepared' to SINGLE content
select * from direct_test_type_cidr where x = '68.44.55.111';
INFO:  Dispatch command to SINGLE content
        x        
-----------------
 68.44.55.111/32
(1 row)

insert into direct_test_type_inet values('68.44.55.111');
INFO:  Dispatch command to SINGLE content
INFO:  Distributed transaction command 'Distributed Prepare' to SINGLE content
INFO:  Distributed transaction command 'Distributed Commit Prepared' to SINGLE content
select * from direct_test_type_inet where x = '68.44.55.111';
INFO:  Dispatch command to SINGLE content
      x       
--------------
 68.44.55.111
(1 row)

insert into direct_test_type_macaddr values('12:34:56:78:90:ab');
INFO:  Dispatch command to SINGLE content
INFO:  Distributed transaction command 'Distributed Prepare' to SINGLE content
INFO:  Distributed transaction command 'Distributed Commit Prepared' to SINGLE content
select * from direct_test_type_macaddr where x = '12:34:56:78:90:ab';
INFO:  Dispatch command to SINGLE content
         x         
-------------------
 12:34:56:78:90:ab
(1 row)

insert into direct_test_type_tinterval values('["2008-08-08" "2010-10-10"]');
INFO:  Dispatch command to SINGLE content
INFO:  Distributed transaction command 'Distributed Prepare' to SINGLE content
INFO:  Distributed transaction command 'Distributed Commit Prepared' to SINGLE content
select 1 from direct_test_type_tinterval where x = '["2008-08-08" "2010-10-10"]';
INFO:  Dispatch command to SINGLE content
 ?column? 
----------
        1
(1 row)

insert into direct_test_type_varbit values('0101010');
INFO:  Dispatch command to SINGLE content
INFO:  Distributed transaction command 'Distributed Prepare' to SINGLE content
INFO:  Distributed transaction command 'Distributed Commit Prepared' to SINGLE content
select * from direct_test_type_varbit where x = '0101010';
INFO:  Dispatch command to SINGLE content
    x    
---------
 0101010
(1 row)

------------------------------------
-- int28, int82, etc. checks
set test_print_direct_dispatch_info=off;
CREATE TABLE direct_test_type_int2 (id int2) DISTRIBUTED BY (id);
CREATE TABLE direct_test_type_int4 (id int4) DISTRIBUTED BY (id);
CREATE TABLE direct_test_type_int8 (id int8) DISTRIBUTED BY (id);
INSERT INTO direct_test_type_int2 VALUES (1);
INSERT INTO direct_test_type_int4 VALUES (1);
INSERT INTO direct_test_type_int8 VALUES (1);
set test_print_direct_dispatch_info=on;
SELECT * FROM direct_test_type_int2 WHERE id = 1::int2;
INFO:  Dispatch command to SINGLE content
 id 
----
  1
(1 row)

SELECT * FROM direct_test_type_int2 WHERE id = 1::int4;
INFO:  Dispatch command to SINGLE content
 id 
----
  1
(1 row)

SELECT * FROM direct_test_type_int2 WHERE id = 1::int8;
INFO:  Dispatch command to SINGLE content
 id 
----
  1
(1 row)

SELECT * FROM direct_test_type_int2 WHERE 1::int2 = id;
INFO:  Dispatch command to SINGLE content
 id 
----
  1
(1 row)

SELECT * FROM direct_test_type_int2 WHERE 1::int4 = id;
INFO:  Dispatch command to SINGLE content
 id 
----
  1
(1 row)

SELECT * FROM direct_test_type_int2 WHERE 1::int8 = id;
INFO:  Dispatch command to SINGLE content
 id 
----
  1
(1 row)

SELECT * FROM direct_test_type_int4 WHERE id = 1::int2;
INFO:  Dispatch command to SINGLE content
 id 
----
  1
(1 row)

SELECT * FROM direct_test_type_int4 WHERE id = 1::int4;
INFO:  Dispatch command to SINGLE content
 id 
----
  1
(1 row)

SELECT * FROM direct_test_type_int4 WHERE id = 1::int8;
INFO:  Dispatch command to SINGLE content
 id 
----
  1
(1 row)

SELECT * FROM direct_test_type_int4 WHERE 1::int2 = id;
INFO:  Dispatch command to SINGLE content
 id 
----
  1
(1 row)

SELECT * FROM direct_test_type_int4 WHERE 1::int4 = id;
INFO:  Dispatch command to SINGLE content
 id 
----
  1
(1 row)

SELECT * FROM direct_test_type_int4 WHERE 1::int8 = id;
INFO:  Dispatch command to SINGLE content
 id 
----
  1
(1 row)

SELECT * FROM direct_test_type_int8 WHERE id = 1::int2;
INFO:  Dispatch command to SINGLE content
 id 
----
  1
(1 row)

SELECT * FROM direct_test_type_int8 WHERE id = 1::int4;
INFO:  Dispatch command to SINGLE content
 id 
----
  1
(1 row)

SELECT * FROM direct_test_type_int8 WHERE id = 1::int8;
INFO:  Dispatch command to SINGLE content
 id 
----
  1
(1 row)

SELECT * FROM direct_test_type_int8 WHERE 1::int2 = id;
INFO:  Dispatch command to SINGLE content
 id 
----
  1
(1 row)

SELECT * FROM direct_test_type_int8 WHERE 1::int4 = id;
INFO:  Dispatch command to SINGLE content
 id 
----
  1
(1 row)

SELECT * FROM direct_test_type_int8 WHERE 1::int8 = id;
INFO:  Dispatch command to SINGLE content
 id 
----
  1
(1 row)

-- overflow test
SELECT * FROM direct_test_type_int2 WHERE id = 32768::int4;
INFO:  Dispatch command to SINGLE content
 id 
----
(0 rows)

SELECT * FROM direct_test_type_int2 WHERE id = -32769::int4;
INFO:  Dispatch command to SINGLE content
 id 
----
(0 rows)

SELECT * FROM direct_test_type_int2 WHERE 32768::int4 = id;
INFO:  Dispatch command to SINGLE content
 id 
----
(0 rows)

SELECT * FROM direct_test_type_int2 WHERE -32769::int4 = id;
INFO:  Dispatch command to SINGLE content
 id 
----
(0 rows)

SELECT * FROM direct_test_type_int2 WHERE id = 2147483648::int8;
INFO:  Dispatch command to SINGLE content
 id 
----
(0 rows)

SELECT * FROM direct_test_type_int2 WHERE id = -2147483649::int8;
INFO:  Dispatch command to SINGLE content
 id 
----
(0 rows)

SELECT * FROM direct_test_type_int2 WHERE 2147483648::int8 = id;
INFO:  Dispatch command to SINGLE content
 id 
----
(0 rows)

SELECT * FROM direct_test_type_int2 WHERE -2147483649::int8 = id;
INFO:  Dispatch command to SINGLE content
 id 
----
(0 rows)

-- cleanup
set test_print_direct_dispatch_info=off;
drop table direct_test;
drop table direct_test_two_column;
drop table direct_test_bitmap;
drop table direct_test_partition;
drop table direct_test_range_partition;
drop table direct_test_type_real;
drop table direct_test_type_smallint;
drop table direct_test_type_int;
drop table direct_test_type_double;
drop table direct_test_type_date;
drop table direct_test_type_numeric;
drop table direct_dispatch_foo;
drop table direct_dispatch_bar;
drop table direct_test_type_int2;
drop table direct_test_type_int4;
drop table direct_test_type_int8;
drop table direct_test_type_abstime;
drop table direct_test_type_bit;
drop table direct_test_type_bpchar;
drop table direct_test_type_bytea;
drop table direct_test_type_cidr;
drop table direct_test_type_inet;
drop table direct_test_type_macaddr;
drop table direct_test_type_tinterval;
drop table direct_test_type_varbit;
