set optimizer_disable_missing_stats_collection = on;
--
-- ALTER_TABLE
-- add attribute
--
DROP TABLE IF EXISTS tmp;
NOTICE:  table "tmp" does not exist, skipping
CREATE TABLE tmp (initial int4);
NOTICE:  Table doesn't have 'DISTRIBUTED BY' clause -- Using column named 'initial' as the Greenplum Database data distribution key for this table.
HINT:  The 'DISTRIBUTED BY' clause determines the distribution of data. Make sure column(s) chosen are the optimal data distribution key to minimize skew.
COMMENT ON TABLE tmp_wrong IS 'table comment';
ERROR:  relation "tmp_wrong" does not exist
COMMENT ON TABLE tmp IS 'table comment';
COMMENT ON TABLE tmp IS NULL;
ALTER TABLE tmp ADD COLUMN a int4 default 3;
ALTER TABLE tmp ADD COLUMN b name;
ALTER TABLE tmp ADD COLUMN c text;
ALTER TABLE tmp ADD COLUMN d float8;
ALTER TABLE tmp ADD COLUMN e float4;
ALTER TABLE tmp ADD COLUMN f int2;
ALTER TABLE tmp ADD COLUMN g polygon;
ALTER TABLE tmp ADD COLUMN h abstime;
ALTER TABLE tmp ADD COLUMN i char;
ALTER TABLE tmp ADD COLUMN j abstime[];
ALTER TABLE tmp ADD COLUMN k int4;
ALTER TABLE tmp ADD COLUMN l tid;
ALTER TABLE tmp ADD COLUMN m xid;
ALTER TABLE tmp ADD COLUMN n oidvector;
--ALTER TABLE tmp ADD COLUMN o lock;
ALTER TABLE tmp ADD COLUMN p smgr;
ALTER TABLE tmp ADD COLUMN q point;
ALTER TABLE tmp ADD COLUMN r lseg;
ALTER TABLE tmp ADD COLUMN s path;
ALTER TABLE tmp ADD COLUMN t box;
ALTER TABLE tmp ADD COLUMN u tinterval;
ALTER TABLE tmp ADD COLUMN v timestamp;
ALTER TABLE tmp ADD COLUMN w interval;
ALTER TABLE tmp ADD COLUMN x float8[];
ALTER TABLE tmp ADD COLUMN y float4[];
ALTER TABLE tmp ADD COLUMN z int2[];
INSERT INTO tmp (a, b, c, d, e, f, g, h, i, j, k, l, m, n, p, q, r, s, t, u,
	v, w, x, y, z)
   VALUES (4, 'name', 'text', 4.1, 4.1, 2, '(4.1,4.1,3.1,3.1)', 
        'Mon May  1 00:30:30 1995', 'c', '{Mon May  1 00:30:30 1995, Monday Aug 24 14:43:07 1992, epoch}', 
	314159, '(1,1)', '512',
	'1 2 3 4 5 6 7 8', 'magnetic disk', '(1.1,1.1)', '(4.1,4.1,3.1,3.1)',
	'(0,2,4.1,4.1,3.1,3.1)', '(4.1,4.1,3.1,3.1)', '["epoch" "infinity"]',
	'epoch', '01:00:10', '{1.0,2.0,3.0,4.0}', '{1.0,2.0,3.0,4.0}', '{1,2,3,4}');
SELECT * FROM tmp;
 initial | a |  b   |  c   |  d  |  e  | f |           g           |              h               | i |                                               j                                                |   k    |   l   |  m  |        n        |       p       |     q     |           r           |              s              |          t          |                      u                      |            v             |        w         |     x     |     y     |     z     
---------+---+------+------+-----+-----+---+-----------------------+------------------------------+---+------------------------------------------------------------------------------------------------+--------+-------+-----+-----------------+---------------+-----------+-----------------------+-----------------------------+---------------------+---------------------------------------------+--------------------------+------------------+-----------+-----------+-----------
         | 4 | name | text | 4.1 | 4.1 | 2 | ((4.1,4.1),(3.1,3.1)) | Mon May 01 00:30:30 1995 PDT | c | {"Mon May 01 00:30:30 1995 PDT","Mon Aug 24 14:43:07 1992 PDT","Wed Dec 31 16:00:00 1969 PST"} | 314159 | (1,1) | 512 | 1 2 3 4 5 6 7 8 | magnetic disk | (1.1,1.1) | [(4.1,4.1),(3.1,3.1)] | ((0,2),(4.1,4.1),(3.1,3.1)) | (4.1,4.1),(3.1,3.1) | ["Wed Dec 31 16:00:00 1969 PST" "infinity"] | Thu Jan 01 00:00:00 1970 | @ 1 hour 10 secs | {1,2,3,4} | {1,2,3,4} | {1,2,3,4}
(1 row)

DROP TABLE tmp;
-- the wolf bug - schema mods caused inconsistent row descriptors 
CREATE TABLE tmp (
	initial 	int4
);
NOTICE:  Table doesn't have 'DISTRIBUTED BY' clause -- Using column named 'initial' as the Greenplum Database data distribution key for this table.
HINT:  The 'DISTRIBUTED BY' clause determines the distribution of data. Make sure column(s) chosen are the optimal data distribution key to minimize skew.
ALTER TABLE tmp ADD COLUMN a int4;
ALTER TABLE tmp ADD COLUMN b name;
ALTER TABLE tmp ADD COLUMN c text;
ALTER TABLE tmp ADD COLUMN d float8;
ALTER TABLE tmp ADD COLUMN e float4;
ALTER TABLE tmp ADD COLUMN f int2;
ALTER TABLE tmp ADD COLUMN g polygon;
ALTER TABLE tmp ADD COLUMN h abstime;
ALTER TABLE tmp ADD COLUMN i char;
ALTER TABLE tmp ADD COLUMN j abstime[];
ALTER TABLE tmp ADD COLUMN k int4;
ALTER TABLE tmp ADD COLUMN l tid;
ALTER TABLE tmp ADD COLUMN m xid;
ALTER TABLE tmp ADD COLUMN n oidvector;
--ALTER TABLE tmp ADD COLUMN o lock;
ALTER TABLE tmp ADD COLUMN p smgr;
ALTER TABLE tmp ADD COLUMN q point;
ALTER TABLE tmp ADD COLUMN r lseg;
ALTER TABLE tmp ADD COLUMN s path;
ALTER TABLE tmp ADD COLUMN t box;
ALTER TABLE tmp ADD COLUMN u tinterval;
ALTER TABLE tmp ADD COLUMN v timestamp;
ALTER TABLE tmp ADD COLUMN w interval;
ALTER TABLE tmp ADD COLUMN x float8[];
ALTER TABLE tmp ADD COLUMN y float4[];
ALTER TABLE tmp ADD COLUMN z int2[];
INSERT INTO tmp (a, b, c, d, e, f, g, h, i, j, k, l, m, n, p, q, r, s, t, u,
	v, w, x, y, z)
   VALUES (4, 'name', 'text', 4.1, 4.1, 2, '(4.1,4.1,3.1,3.1)', 
        'Mon May  1 00:30:30 1995', 'c', '{Mon May  1 00:30:30 1995, Monday Aug 24 14:43:07 1992, epoch}', 
	314159, '(1,1)', '512',
	'1 2 3 4 5 6 7 8', 'magnetic disk', '(1.1,1.1)', '(4.1,4.1,3.1,3.1)',
	'(0,2,4.1,4.1,3.1,3.1)', '(4.1,4.1,3.1,3.1)', '["epoch" "infinity"]',
	'epoch', '01:00:10', '{1.0,2.0,3.0,4.0}', '{1.0,2.0,3.0,4.0}', '{1,2,3,4}');
SELECT * FROM tmp;
 initial | a |  b   |  c   |  d  |  e  | f |           g           |              h               | i |                                               j                                                |   k    |   l   |  m  |        n        |       p       |     q     |           r           |              s              |          t          |                      u                      |            v             |        w         |     x     |     y     |     z     
---------+---+------+------+-----+-----+---+-----------------------+------------------------------+---+------------------------------------------------------------------------------------------------+--------+-------+-----+-----------------+---------------+-----------+-----------------------+-----------------------------+---------------------+---------------------------------------------+--------------------------+------------------+-----------+-----------+-----------
         | 4 | name | text | 4.1 | 4.1 | 2 | ((4.1,4.1),(3.1,3.1)) | Mon May 01 00:30:30 1995 PDT | c | {"Mon May 01 00:30:30 1995 PDT","Mon Aug 24 14:43:07 1992 PDT","Wed Dec 31 16:00:00 1969 PST"} | 314159 | (1,1) | 512 | 1 2 3 4 5 6 7 8 | magnetic disk | (1.1,1.1) | [(4.1,4.1),(3.1,3.1)] | ((0,2),(4.1,4.1),(3.1,3.1)) | (4.1,4.1),(3.1,3.1) | ["Wed Dec 31 16:00:00 1969 PST" "infinity"] | Thu Jan 01 00:00:00 1970 | @ 1 hour 10 secs | {1,2,3,4} | {1,2,3,4} | {1,2,3,4}
(1 row)

DROP TABLE tmp;
--
-- rename - check on both non-temp and temp tables
--
CREATE TABLE tmp (regtable int);
NOTICE:  Table doesn't have 'DISTRIBUTED BY' clause -- Using column named 'regtable' as the Greenplum Database data distribution key for this table.
HINT:  The 'DISTRIBUTED BY' clause determines the distribution of data. Make sure column(s) chosen are the optimal data distribution key to minimize skew.
CREATE TEMP TABLE tmp (tmptable int);
NOTICE:  Table doesn't have 'DISTRIBUTED BY' clause -- Using column named 'tmptable' as the Greenplum Database data distribution key for this table.
HINT:  The 'DISTRIBUTED BY' clause determines the distribution of data. Make sure column(s) chosen are the optimal data distribution key to minimize skew.
ALTER TABLE tmp RENAME TO tmp_new;
SELECT * FROM tmp;
 regtable 
----------
(0 rows)

SELECT * FROM tmp_new;
 tmptable 
----------
(0 rows)

ALTER TABLE tmp RENAME TO tmp_new2;
SELECT * FROM tmp;		-- should fail
ERROR:  relation "tmp" does not exist
LINE 1: SELECT * FROM tmp;
                      ^
SELECT * FROM tmp_new;
 tmptable 
----------
(0 rows)

SELECT * FROM tmp_new2;
 regtable 
----------
(0 rows)

DROP TABLE tmp_new;
DROP TABLE tmp_new2;
-- ALTER TABLE ... RENAME on corrupted relations
SET allow_system_table_mods = dml;
-- missing entry
CREATE TABLE cor (a int, b float);
NOTICE:  Table doesn't have 'DISTRIBUTED BY' clause -- Using column named 'a' as the Greenplum Database data distribution key for this table.
HINT:  The 'DISTRIBUTED BY' clause determines the distribution of data. Make sure column(s) chosen are the optimal data distribution key to minimize skew.
INSERT INTO cor SELECT i, i+1 FROM generate_series(1,100)i;
DELETE FROM pg_attribute WHERE attname='a' AND attrelid='cor'::regclass;
ALTER TABLE cor RENAME TO oldcor;
INSERT INTO pg_attribute SELECT distinct * FROM gp_dist_random('pg_attribute') WHERE attname='a' AND attrelid='oldcor'::regclass;
DROP TABLE oldcor;
-- typname is out of sync
CREATE TABLE cor (a int, b float, c text);
NOTICE:  Table doesn't have 'DISTRIBUTED BY' clause -- Using column named 'a' as the Greenplum Database data distribution key for this table.
HINT:  The 'DISTRIBUTED BY' clause determines the distribution of data. Make sure column(s) chosen are the optimal data distribution key to minimize skew.
UPDATE pg_type SET typname='newcor' WHERE typrelid='cor'::regclass;
ALTER TABLE cor RENAME TO newcor;
ALTER TABLE newcor RENAME TO cor;
DROP TABLE cor;
-- relname is out of sync
CREATE TABLE cor (a int, b int);
NOTICE:  Table doesn't have 'DISTRIBUTED BY' clause -- Using column named 'a' as the Greenplum Database data distribution key for this table.
HINT:  The 'DISTRIBUTED BY' clause determines the distribution of data. Make sure column(s) chosen are the optimal data distribution key to minimize skew.
UPDATE pg_class SET relname='othercor' WHERE relname='cor';
ALTER TABLE othercor RENAME TO tmpcor;
ALTER TABLE tmpcor RENAME TO cor;
DROP TABLE cor;
RESET allow_system_table_mods;
-- ALTER TABLE ... RENAME on non-table relations
-- renaming indexes (FIXME: this should probably test the index's functionality)
ALTER INDEX onek_unique1 RENAME TO tmp_onek_unique1;
ALTER INDEX tmp_onek_unique1 RENAME TO onek_unique1;
-- renaming views
CREATE VIEW tmp_view (unique1) AS SELECT unique1 FROM tenk1;
ALTER TABLE tmp_view RENAME TO tmp_view_new;
-- hack to ensure we get an indexscan here
ANALYZE tenk1;
set enable_seqscan to off;
set enable_bitmapscan to off;
-- 5 values, sorted 
SELECT unique1 FROM tenk1 WHERE unique1 < 5 ORDER BY 1;
 unique1 
---------
       0
       1
       2
       3
       4
(5 rows)

reset enable_seqscan;
reset enable_bitmapscan;
DROP VIEW tmp_view_new;
-- toast-like relation name
alter table stud_emp rename to pg_toast_stud_emp;
alter table pg_toast_stud_emp rename to stud_emp;
-- FOREIGN KEY CONSTRAINT adding TEST
CREATE TABLE tmp2 (a int primary key) distributed by (a);
NOTICE:  CREATE TABLE / PRIMARY KEY will create implicit index "tmp2_pkey" for table "tmp2"
CREATE TABLE tmp3 (a int, b int);
CREATE TABLE tmp4 (a int, b int, unique(a,b)) distributed by (a);
NOTICE:  CREATE TABLE / UNIQUE will create implicit index "tmp4_a_key" for table "tmp4"
CREATE TABLE tmp5 (a int, b int);
-- Insert rows into tmp2 (pktable)
INSERT INTO tmp2 values (1);
INSERT INTO tmp2 values (2);
INSERT INTO tmp2 values (3);
INSERT INTO tmp2 values (4);
-- Insert rows into tmp3
INSERT INTO tmp3 values (1,10);
INSERT INTO tmp3 values (1,20);
INSERT INTO tmp3 values (5,50);
-- Try (and fail) to add constraint due to invalid source columns
ALTER TABLE tmp3 add constraint tmpconstr foreign key(c) references tmp2 match full;
ERROR:  column "c" referenced in foreign key constraint does not exist
-- Try (and fail) to add constraint due to invalide destination columns explicitly given
ALTER TABLE tmp3 add constraint tmpconstr foreign key(a) references tmp2(b) match full;
ERROR:  column "b" referenced in foreign key constraint does not exist
-- Try (and fail) to add constraint due to invalid data
ALTER TABLE tmp3 add constraint tmpconstr foreign key (a) references tmp2 match full;
WARNING:  Referential integrity (FOREIGN KEY) constraints are not supported in Greenplum Database, will not be enforced.
-- Delete one row, add the constraint again -- should fail
DELETE FROM tmp3 where a=5;
ALTER TABLE tmp3 add constraint tmpconstr foreign key (a) references tmp2 match full;
ERROR:  constraint "tmpconstr" for relation "tmp3" already exists
-- Try (and fail) to create constraint from tmp5(a) to tmp4(a) - unique constraint on
-- tmp4 is a,b
ALTER TABLE tmp5 add constraint tmpconstr foreign key(a) references tmp4(a) match full;
ERROR:  there is no unique constraint matching given keys for referenced table "tmp4"
DROP TABLE tmp5;
DROP TABLE tmp4;
DROP TABLE tmp3;
DROP TABLE tmp2;
-- Foreign key adding test with mixed types
-- Note: these tables are TEMP to avoid name conflicts when this test
-- is run in parallel with foreign_key.sql.
CREATE TEMP TABLE PKTABLE (ptest1 int PRIMARY KEY) distributed by (ptest1);
NOTICE:  CREATE TABLE / PRIMARY KEY will create implicit index "pktable_pkey" for table "pktable"
CREATE TEMP TABLE FKTABLE (ftest1 inet);
NOTICE:  Table doesn't have 'DISTRIBUTED BY' clause -- Using column named 'ftest1' as the Greenplum Database data distribution key for this table.
HINT:  The 'DISTRIBUTED BY' clause determines the distribution of data. Make sure column(s) chosen are the optimal data distribution key to minimize skew.
-- This next should fail, because inet=int does not exist
ALTER TABLE FKTABLE ADD FOREIGN KEY(ftest1) references pktable;
ERROR:  foreign key constraint "fktable_ftest1_fkey" cannot be implemented
DETAIL:  Key columns "ftest1" and "ptest1" are of incompatible types: inet and integer.
-- This should also fail for the same reason, but here we
-- give the column name
ALTER TABLE FKTABLE ADD FOREIGN KEY(ftest1) references pktable(ptest1);
ERROR:  foreign key constraint "fktable_ftest1_fkey" cannot be implemented
DETAIL:  Key columns "ftest1" and "ptest1" are of incompatible types: inet and integer.
-- This should succeed, even though they are different types
-- because varchar=int does exist
DROP TABLE FKTABLE;
CREATE TEMP TABLE FKTABLE (ftest1 varchar);
NOTICE:  Table doesn't have 'DISTRIBUTED BY' clause -- Using column named 'ftest1' as the Greenplum Database data distribution key for this table.
HINT:  The 'DISTRIBUTED BY' clause determines the distribution of data. Make sure column(s) chosen are the optimal data distribution key to minimize skew.
ALTER TABLE FKTABLE ADD FOREIGN KEY(ftest1) references pktable;
WARNING:  foreign key constraint "fktable_ftest1_fkey" will require costly sequential scans
DETAIL:  Key columns "ftest1" and "ptest1" are of different types: character varying and integer.
WARNING:  Referential integrity (FOREIGN KEY) constraints are not supported in Greenplum Database, will not be enforced.
-- As should this
ALTER TABLE FKTABLE ADD FOREIGN KEY(ftest1) references pktable(ptest1);
WARNING:  foreign key constraint "fktable_ftest1_fkey1" will require costly sequential scans
DETAIL:  Key columns "ftest1" and "ptest1" are of different types: character varying and integer.
WARNING:  Referential integrity (FOREIGN KEY) constraints are not supported in Greenplum Database, will not be enforced.
DROP TABLE pktable cascade;
NOTICE:  drop cascades to constraint fktable_ftest1_fkey1 on table fktable
NOTICE:  drop cascades to constraint fktable_ftest1_fkey on table fktable
DROP TABLE fktable;
CREATE TEMP TABLE PKTABLE (ptest1 int, ptest2 inet,
                           PRIMARY KEY(ptest1, ptest2))
                           distributed by (ptest1);
NOTICE:  CREATE TABLE / PRIMARY KEY will create implicit index "pktable_pkey" for table "pktable"
-- This should fail, because we just chose really odd types
CREATE TEMP TABLE FKTABLE (ftest1 cidr, ftest2 timestamp);
NOTICE:  Table doesn't have 'DISTRIBUTED BY' clause -- Using column named 'ftest1' as the Greenplum Database data distribution key for this table.
HINT:  The 'DISTRIBUTED BY' clause determines the distribution of data. Make sure column(s) chosen are the optimal data distribution key to minimize skew.
ALTER TABLE FKTABLE ADD FOREIGN KEY(ftest1, ftest2) references pktable;
ERROR:  foreign key constraint "fktable_ftest1_fkey" cannot be implemented
DETAIL:  Key columns "ftest1" and "ptest1" are of incompatible types: cidr and integer.
DROP TABLE FKTABLE;
-- Again, so should this...
CREATE TEMP TABLE FKTABLE (ftest1 cidr, ftest2 timestamp);
NOTICE:  Table doesn't have 'DISTRIBUTED BY' clause -- Using column named 'ftest1' as the Greenplum Database data distribution key for this table.
HINT:  The 'DISTRIBUTED BY' clause determines the distribution of data. Make sure column(s) chosen are the optimal data distribution key to minimize skew.
ALTER TABLE FKTABLE ADD FOREIGN KEY(ftest1, ftest2)
     references pktable(ptest1, ptest2);
ERROR:  foreign key constraint "fktable_ftest1_fkey" cannot be implemented
DETAIL:  Key columns "ftest1" and "ptest1" are of incompatible types: cidr and integer.
DROP TABLE FKTABLE;
-- This fails because we mixed up the column ordering
CREATE TEMP TABLE FKTABLE (ftest1 int, ftest2 inet);
NOTICE:  Table doesn't have 'DISTRIBUTED BY' clause -- Using column named 'ftest1' as the Greenplum Database data distribution key for this table.
HINT:  The 'DISTRIBUTED BY' clause determines the distribution of data. Make sure column(s) chosen are the optimal data distribution key to minimize skew.
ALTER TABLE FKTABLE ADD FOREIGN KEY(ftest1, ftest2)
     references pktable(ptest2, ptest1);
ERROR:  foreign key constraint "fktable_ftest1_fkey" cannot be implemented
DETAIL:  Key columns "ftest1" and "ptest2" are of incompatible types: integer and inet.
-- As does this...
ALTER TABLE FKTABLE ADD FOREIGN KEY(ftest2, ftest1)
     references pktable(ptest1, ptest2);
ERROR:  foreign key constraint "fktable_ftest2_fkey" cannot be implemented
DETAIL:  Key columns "ftest2" and "ptest1" are of incompatible types: inet and integer.
-- temp tables should go away by themselves, need not drop them.
-- test check constraint adding
create table atacc1 ( test int );
NOTICE:  Table doesn't have 'DISTRIBUTED BY' clause -- Using column named 'test' as the Greenplum Database data distribution key for this table.
HINT:  The 'DISTRIBUTED BY' clause determines the distribution of data. Make sure column(s) chosen are the optimal data distribution key to minimize skew.
-- add a check constraint
alter table atacc1 add constraint atacc_test1 check (test>3);
-- start_ignore
-- Known_opt_diff: MPP-21330
-- end_ignore
-- should fail
insert into atacc1 (test) values (2);
ERROR:  One or more assertions failed  (seg0 antova-mbp.local:40010 pid=87501)
DETAIL:  Check constraint atacc_test1 for table atacc1 was violated
-- should succeed
insert into atacc1 (test) values (4);
drop table atacc1;
-- let's do one where the check fails when added
create table atacc1 ( test int );
NOTICE:  Table doesn't have 'DISTRIBUTED BY' clause -- Using column named 'test' as the Greenplum Database data distribution key for this table.
HINT:  The 'DISTRIBUTED BY' clause determines the distribution of data. Make sure column(s) chosen are the optimal data distribution key to minimize skew.
-- insert a soon to be failing row
insert into atacc1 (test) values (2);
-- add a check constraint (fails)
alter table atacc1 add constraint atacc_test1 check (test>3);
ERROR:  check constraint "atacc_test1" is violated by some row  (seg1 usxxshenem1.local:40001 pid=85314)
insert into atacc1 (test) values (4);
drop table atacc1;
-- let's do one where the check fails because the column doesn't exist
create table atacc1 ( test int );
NOTICE:  Table doesn't have 'DISTRIBUTED BY' clause -- Using column named 'test' as the Greenplum Database data distribution key for this table.
HINT:  The 'DISTRIBUTED BY' clause determines the distribution of data. Make sure column(s) chosen are the optimal data distribution key to minimize skew.
-- add a check constraint (fails)
alter table atacc1 add constraint atacc_test1 check (test1>3);
ERROR:  column "test1" does not exist
drop table atacc1;
-- something a little more complicated
create table atacc1 ( test int, test2 int, test3 int);
NOTICE:  Table doesn't have 'DISTRIBUTED BY' clause -- Using column named 'test' as the Greenplum Database data distribution key for this table.
HINT:  The 'DISTRIBUTED BY' clause determines the distribution of data. Make sure column(s) chosen are the optimal data distribution key to minimize skew.
-- add a check constraint (fails)
alter table atacc1 add constraint atacc_test1 check (test+test2<test3*4);
-- should fail
insert into atacc1 (test,test2,test3) values (4,4,2);
ERROR:  One or more assertions failed  (seg0 antova-mbp.local:40010 pid=87501)
DETAIL:  Check constraint atacc_test1 for table atacc1 was violated
-- should succeed
insert into atacc1 (test,test2,test3) values (4,4,5);
drop table atacc1;
-- lets do some naming tests
create table atacc1 (test int check (test>3), test2 int);
NOTICE:  Table doesn't have 'DISTRIBUTED BY' clause -- Using column named 'test' as the Greenplum Database data distribution key for this table.
HINT:  The 'DISTRIBUTED BY' clause determines the distribution of data. Make sure column(s) chosen are the optimal data distribution key to minimize skew.
alter table atacc1 add check (test2>test);
-- should fail for $2
insert into atacc1 (test2, test) values (3, 4);
ERROR:  One or more assertions failed  (seg0 antova-mbp.local:40010 pid=87501)
DETAIL:  Check constraint atacc1_check for table atacc1 was violated
drop table atacc1;
-- inheritance related tests
create table atacc1 (test int);
NOTICE:  Table doesn't have 'DISTRIBUTED BY' clause -- Using column named 'test' as the Greenplum Database data distribution key for this table.
HINT:  The 'DISTRIBUTED BY' clause determines the distribution of data. Make sure column(s) chosen are the optimal data distribution key to minimize skew.
create table atacc2 (test2 int);
NOTICE:  Table doesn't have 'DISTRIBUTED BY' clause -- Using column named 'test2' as the Greenplum Database data distribution key for this table.
HINT:  The 'DISTRIBUTED BY' clause determines the distribution of data. Make sure column(s) chosen are the optimal data distribution key to minimize skew.
create table atacc3 (test3 int) inherits (atacc1, atacc2);
NOTICE:  Table has parent, setting distribution columns to match parent table
alter table atacc2 add constraint foo check (test2>0);
-- fail and then succeed on atacc2
insert into atacc2 (test2) values (-3);
ERROR:  new row for relation "atacc2" violates check constraint "foo"  (seg1 usxxshenem1.local:40001 pid=85314)
insert into atacc2 (test2) values (3);
-- fail and then succeed on atacc3
insert into atacc3 (test2) values (-3);
ERROR:  One or more assertions failed  (seg0 antova-mbp.local:40010 pid=87501)
DETAIL:  Check constraint foo for table atacc3 was violated
insert into atacc3 (test2) values (3);
drop table atacc3;
drop table atacc2;
drop table atacc1;
-- same things with one created with INHERIT
create table atacc1 (test int);
NOTICE:  Table doesn't have 'DISTRIBUTED BY' clause -- Using column named 'test' as the Greenplum Database data distribution key for this table.
HINT:  The 'DISTRIBUTED BY' clause determines the distribution of data. Make sure column(s) chosen are the optimal data distribution key to minimize skew.
create table atacc2 (test2 int);
NOTICE:  Table doesn't have 'DISTRIBUTED BY' clause -- Using column named 'test2' as the Greenplum Database data distribution key for this table.
HINT:  The 'DISTRIBUTED BY' clause determines the distribution of data. Make sure column(s) chosen are the optimal data distribution key to minimize skew.
create table atacc3 (test3 int) inherits (atacc1, atacc2);
NOTICE:  Table has parent, setting distribution columns to match parent table
alter table atacc3 no inherit atacc2;
-- fail
alter table atacc3 no inherit atacc2;
ERROR:  relation "atacc2" is not a parent of relation "atacc3"
-- make sure it really isn't a child
insert into atacc3 (test2) values (3);
select test2 from atacc2;
 test2 
-------
(0 rows)

-- fail due to missing constraint
alter table atacc2 add constraint foo check (test2>0);
alter table atacc3 inherit atacc2;
ERROR:  child table is missing constraint "foo"
-- fail due to missing column
alter table atacc3 rename test2 to testx;
alter table atacc3 inherit atacc2;
ERROR:  child table is missing column "test2"
-- fail due to mismatched data type
alter table atacc3 add test2 bool;
alter table atacc3 add inherit atacc2;
alter table atacc3 drop test2;
-- succeed
alter table atacc3 add test2 int;
update atacc3 set test2 = 4 where test2 is null;
alter table atacc3 add constraint foo check (test2>0);
alter table atacc3 inherit atacc2;
-- fail due to duplicates and circular inheritance
alter table atacc3 inherit atacc2;
ERROR:  inherited relation "atacc2" duplicated
alter table atacc2 inherit atacc3;
ERROR:  circular inheritance not allowed
DETAIL:  "atacc3" is already a child of "atacc2".
alter table atacc2 inherit atacc2;
ERROR:  circular inheritance not allowed
DETAIL:  "atacc2" is already a child of "atacc2".
-- test that we really are a child now (should see 4 not 3 and cascade should go through)
select test2 from atacc2;
 test2 
-------
     4
(1 row)

drop table atacc2 cascade;
NOTICE:  drop cascades to table atacc3
NOTICE:  drop cascades to constraint foo on table atacc3
drop table atacc1;
-- let's try only to add only to the parent
create table atacc1 (test int);
NOTICE:  Table doesn't have 'DISTRIBUTED BY' clause -- Using column named 'test' as the Greenplum Database data distribution key for this table.
HINT:  The 'DISTRIBUTED BY' clause determines the distribution of data. Make sure column(s) chosen are the optimal data distribution key to minimize skew.
create table atacc2 (test2 int);
NOTICE:  Table doesn't have 'DISTRIBUTED BY' clause -- Using column named 'test2' as the Greenplum Database data distribution key for this table.
HINT:  The 'DISTRIBUTED BY' clause determines the distribution of data. Make sure column(s) chosen are the optimal data distribution key to minimize skew.
create table atacc3 (test3 int) inherits (atacc1, atacc2);
NOTICE:  Table has parent, setting distribution columns to match parent table
alter table only atacc2 add constraint foo check (test2>0);
-- fail and then succeed on atacc2
insert into atacc2 (test2) values (-3);
ERROR:  new row for relation "atacc2" violates check constraint "foo"  (seg1 usxxshenem1.local:40001 pid=85314)
insert into atacc2 (test2) values (3);
-- both succeed on atacc3
insert into atacc3 (test2) values (-3);
insert into atacc3 (test2) values (3);
drop table atacc3;
drop table atacc2;
drop table atacc1;
-- test unique constraint adding
create table atacc1 ( test int ) with oids distributed by (test);
NOTICE:  OIDS=TRUE is not recommended for user-created tables. Use OIDS=FALSE to prevent wrap-around of the OID counter
-- add a unique constraint
alter table atacc1 add constraint atacc_test1 unique (test);
NOTICE:  ALTER TABLE / ADD UNIQUE will create implicit index "atacc1_test_key" for table "atacc1"
-- insert first value
insert into atacc1 (test) values (2);
-- should fail
insert into atacc1 (test) values (2);
ERROR:  duplicate key violates unique constraint "atacc1_test_key"  (seg1 usxxshenem1.local:40001 pid=85314)
-- should succeed
insert into atacc1 (test) values (4);
-- try adding a unique oid constraint
alter table atacc1 add constraint atacc_oid1 unique(oid);
ERROR:  cannot create unique index on system column
drop table atacc1;
-- let's do one where the unique constraint fails when added
create table atacc1 ( test int ) distributed by (test);
-- insert soon to be failing rows
insert into atacc1 (test) values (2);
insert into atacc1 (test) values (2);
-- add a unique constraint (fails)
alter table atacc1 add constraint atacc_test1 unique (test);
NOTICE:  ALTER TABLE / ADD UNIQUE will create implicit index "atacc1_test_key" for table "atacc1"
ERROR:  could not create unique index  (seg1 usxxshenem1.local:40001 pid=85314)
DETAIL:  Table contains duplicate values.
insert into atacc1 (test) values (3);
drop table atacc1;
-- let's do one where the unique constraint fails
-- because the column doesn't exist
create table atacc1 ( test int ) distributed by (test);
-- add a unique constraint (fails)
alter table atacc1 add constraint atacc_test1 unique (test1);
ERROR:  column "test1" named in key does not exist
drop table atacc1;
-- something a little more complicated
create table atacc1 ( test int, test2 int) distributed by (test);
-- add a unique constraint
alter table atacc1 add constraint atacc_test1 unique (test, test2);
NOTICE:  ALTER TABLE / ADD UNIQUE will create implicit index "atacc1_test_key" for table "atacc1"
-- insert initial value
insert into atacc1 (test,test2) values (4,4);
-- should fail
insert into atacc1 (test,test2) values (4,4);
ERROR:  duplicate key violates unique constraint "atacc1_test_key"  (seg1 usxxshenem1.local:40001 pid=85314)
-- should all succeed
insert into atacc1 (test,test2) values (4,5);
insert into atacc1 (test,test2) values (5,4);
insert into atacc1 (test,test2) values (5,5);
drop table atacc1;
-- MPP-20466 Dis-allow duplicate constraint names for same table
create table dupconstr (
						i int,
						j int constraint test CHECK (j > 10))
						distributed by (i);
-- should fail because of duplicate constraint name
alter table dupconstr add constraint test unique (i);
NOTICE:  ALTER TABLE / ADD UNIQUE will create implicit index "dupconstr_i_key" for table "dupconstr"
ERROR:  constraint "test" for relation "dupconstr" already exists
alter table dupconstr add constraint test primary key (i);
NOTICE:  ALTER TABLE / ADD PRIMARY KEY will create implicit index "dupconstr_pkey" for table "dupconstr"
ERROR:  constraint "test" for relation "dupconstr" already exists
-- cleanup
drop table dupconstr;
-- lets do some naming tests
create table atacc1 (test int, test2 int, unique(test)) distributed by (test);
NOTICE:  CREATE TABLE / UNIQUE will create implicit index "atacc1_test_key" for table "atacc1"
alter table atacc1 add unique (test2);
ERROR:  UNIQUE index must contain all columns in the distribution key of relation "atacc1"
-- should fail for @@ second one @@
insert into atacc1 (test2, test) values (3, 3);
insert into atacc1 (test2, test) values (2, 3);
ERROR:  duplicate key violates unique constraint "atacc1_test_key"  (seg0 usxxshenem1.local:40000 pid=85313)
drop table atacc1;
-- test primary key constraint adding
create table atacc1 ( test int ) with oids distributed by (test);
NOTICE:  OIDS=TRUE is not recommended for user-created tables. Use OIDS=FALSE to prevent wrap-around of the OID counter
-- add a primary key constraint
alter table atacc1 add constraint atacc_test1 primary key (test);
NOTICE:  ALTER TABLE / ADD PRIMARY KEY will create implicit index "atacc1_pkey" for table "atacc1"
-- insert first value
insert into atacc1 (test) values (2);
-- should fail
insert into atacc1 (test) values (2);
ERROR:  duplicate key violates unique constraint "atacc1_pkey"  (seg1 usxxshenem1.local:40001 pid=85314)
-- should succeed
insert into atacc1 (test) values (4);
-- inserting NULL should fail
insert into atacc1 (test) values(NULL);
ERROR:  One or more assertions failed  (seg0 antova-mbp.local:40010 pid=87501)
DETAIL:  Not null constraint for column test of table atacc1 was violated
-- try adding a second primary key (should fail)
alter table atacc1 add constraint atacc_oid1 primary key(oid);
ERROR:  multiple primary keys for table "atacc1" are not allowed
-- drop first primary key constraint
alter table atacc1 drop constraint atacc_test1 restrict;
-- try adding a primary key on oid (should fail)
alter table atacc1 add constraint atacc_oid1 primary key(oid);
ERROR:  cannot create primary key on system column
drop table atacc1;
-- let's do one where the primary key constraint fails when added
create table atacc1 ( test int ) distributed by (test);
-- insert soon to be failing rows
insert into atacc1 (test) values (2);
insert into atacc1 (test) values (2);
-- add a primary key (fails)
alter table atacc1 add constraint atacc_test1 primary key (test);
NOTICE:  ALTER TABLE / ADD PRIMARY KEY will create implicit index "atacc1_pkey" for table "atacc1"
ERROR:  could not create unique index  (seg1 usxxshenem1.local:40001 pid=85314)
DETAIL:  Table contains duplicate values.
insert into atacc1 (test) values (3);
drop table atacc1;
-- let's do another one where the primary key constraint fails when added
create table atacc1 ( test int ) distributed by (test);
-- insert soon to be failing row
insert into atacc1 (test) values (NULL);
-- add a primary key (fails)
alter table atacc1 add constraint atacc_test1 primary key (test);
NOTICE:  ALTER TABLE / ADD PRIMARY KEY will create implicit index "atacc1_pkey" for table "atacc1"
ERROR:  column "test" contains null values  (seg0 usxxshenem1.local:40000 pid=85313)
insert into atacc1 (test) values (3);
drop table atacc1;
-- let's do one where the primary key constraint fails
-- because the column doesn't exist
create table atacc1 ( test int ) distributed by (test);
-- add a primary key constraint (fails)
alter table atacc1 add constraint atacc_test1 primary key (test1);
ERROR:  column "test1" named in key does not exist
drop table atacc1;
-- adding a new column as primary key to a non-empty table.
-- should fail unless the column has a non-null default value.
create table atacc1 ( test int ) distributed by (test);
insert into atacc1 (test) values (0);
-- add a primary key column without a default (fails).
alter table atacc1 add column test2 int primary key;
ERROR:  Cannot add column with primary key constraint (analyze.c:11406)
-- now add a primary key column with a default (succeeds).
alter table atacc1 add column test2 int default 0 primary key;
ERROR:  Cannot add column with primary key constraint (analyze.c:11406)
drop table atacc1;
-- something a little more complicated
create table atacc1 ( test int, test2 int) distributed by (test);
-- add a primary key constraint
alter table atacc1 add constraint atacc_test1 primary key (test, test2);
NOTICE:  ALTER TABLE / ADD PRIMARY KEY will create implicit index "atacc1_pkey" for table "atacc1"
-- try adding a second primary key - should fail
alter table atacc1 add constraint atacc_test2 primary key (test);
ERROR:  multiple primary keys for table "atacc1" are not allowed
-- insert initial value
insert into atacc1 (test,test2) values (4,4);
-- should fail
insert into atacc1 (test,test2) values (4,4);
ERROR:  duplicate key violates unique constraint "atacc1_pkey"  (seg1 usxxshenem1.local:40001 pid=85314)
insert into atacc1 (test,test2) values (NULL,3);
ERROR:  One or more assertions failed  (seg0 antova-mbp.local:40010 pid=87501)
DETAIL:  Not null constraint for column test of table atacc1 was violated
insert into atacc1 (test,test2) values (3, NULL);
ERROR:  One or more assertions failed  (seg0 antova-mbp.local:40010 pid=87501)
DETAIL:  Not null constraint for column test2 of table atacc1 was violated
insert into atacc1 (test,test2) values (NULL,NULL);
ERROR:  One or more assertions failed  (seg0 antova-mbp.local:40010 pid=87501)
DETAIL:  
Not null constraint for column test of table atacc1 was violated
Not null constraint for column test2 of table atacc1 was violated
-- should all succeed
insert into atacc1 (test,test2) values (4,5);
insert into atacc1 (test,test2) values (5,4);
insert into atacc1 (test,test2) values (5,5);
drop table atacc1;
-- lets do some naming tests
create table atacc1 (test int, test2 int, primary key(test)) distributed by (test);
NOTICE:  CREATE TABLE / PRIMARY KEY will create implicit index "atacc1_pkey" for table "atacc1"
-- only first should succeed
insert into atacc1 (test2, test) values (3, 3);
insert into atacc1 (test2, test) values (2, 3);
ERROR:  duplicate key violates unique constraint "atacc1_pkey"  (seg0 usxxshenem1.local:40000 pid=85313)
insert into atacc1 (test2, test) values (1, NULL);
ERROR:  One or more assertions failed  (seg0 antova-mbp.local:40010 pid=87501)
DETAIL:  Not null constraint for column test of table atacc1 was violated
drop table atacc1;
-- alter table / alter column [set/drop] not null tests
-- try altering system catalogs, should fail
alter table pg_class alter column relname drop not null;
ERROR:  permission denied: "pg_class" is a system catalog
alter table pg_class alter relname set not null;
ERROR:  permission denied: "pg_class" is a system catalog
-- try altering non-existent table, should fail
alter table non_existent alter column bar set not null;
ERROR:  relation "non_existent" does not exist
alter table non_existent alter column bar drop not null;
ERROR:  relation "non_existent" does not exist
-- test setting columns to null and not null and vice versa
-- test checking for null values and primary key
create table atacc1 (test int not null) with oids distributed by (test);
NOTICE:  Table doesn't have 'DISTRIBUTED BY' clause -- Using column named 'test' as the Greenplum Database data distribution key for this table.
HINT:  The 'DISTRIBUTED BY' clause determines the distribution of data. Make sure column(s) chosen are the optimal data distribution key to minimize skew.
NOTICE:  OIDS=TRUE is not recommended for user-created tables. Use OIDS=FALSE to prevent wrap-around of the OID counter
alter table atacc1 add constraint "atacc1_pkey" primary key (test);
NOTICE:  ALTER TABLE / ADD PRIMARY KEY will create implicit index "atacc1_pkey" for table "atacc1"
alter table atacc1 alter column test drop not null;
ERROR:  column "test" is in a primary key
alter table atacc1 drop constraint "atacc1_pkey";
alter table atacc1 alter column test drop not null;
insert into atacc1 values (null);
alter table atacc1 alter test set not null;
ERROR:  column "test" contains null values  (seg0 usxxshenem1.local:40000 pid=85313)
delete from atacc1;
alter table atacc1 alter test set not null;
-- try altering a non-existent column, should fail
alter table atacc1 alter bar set not null;
ERROR:  column "bar" of relation "atacc1" does not exist
alter table atacc1 alter bar drop not null;
ERROR:  column "bar" of relation "atacc1" does not exist
-- try altering the oid column, should fail
alter table atacc1 alter oid set not null;
ERROR:  cannot alter system column "oid"
alter table atacc1 alter oid drop not null;
ERROR:  cannot alter system column "oid"
-- try creating a view and altering that, should fail
create view myview as select * from atacc1;
alter table myview alter column test drop not null;
ERROR:  "myview" is not a table
alter table myview alter column test set not null;
ERROR:  "myview" is not a table
drop view myview;
drop table atacc1;
-- test inheritance
create table parent (a int);
NOTICE:  Table doesn't have 'DISTRIBUTED BY' clause -- Using column named 'a' as the Greenplum Database data distribution key for this table.
HINT:  The 'DISTRIBUTED BY' clause determines the distribution of data. Make sure column(s) chosen are the optimal data distribution key to minimize skew.
create table child (b varchar(255)) inherits (parent);
NOTICE:  Table has parent, setting distribution columns to match parent table
alter table parent alter a set not null;
insert into parent values (NULL);
ERROR:  null value in column "a" violates not-null constraint  (seg0 usxxshenem1.local:40000 pid=85313)
insert into child (a, b) values (NULL, 'foo');
ERROR:  One or more assertions failed  (seg0 antova-mbp.local:40010 pid=90951)
DETAIL:  Not null constraint for column a of table child was violated
alter table parent alter a drop not null;
insert into parent values (NULL);
insert into child (a, b) values (NULL, 'foo');
alter table only parent alter a set not null;
ERROR:  column "a" contains null values  (seg0 usxxshenem1.local:40000 pid=85313)
alter table child alter a set not null;
ERROR:  column "a" contains null values  (seg0 usxxshenem1.local:40000 pid=85313)
delete from parent;
alter table only parent alter a set not null;
insert into parent values (NULL);
ERROR:  null value in column "a" violates not-null constraint  (seg0 usxxshenem1.local:40000 pid=85313)
alter table child alter a set not null;
insert into child (a, b) values (NULL, 'foo');
ERROR:  One or more assertions failed  (seg1 antova-mbp.local:40011 pid=87502)
DETAIL:  Not null constraint for column a of table child was violated
delete from child;
alter table child alter a set not null;
insert into child (a, b) values (NULL, 'foo');
ERROR:  One or more assertions failed  (seg1 antova-mbp.local:40011 pid=87502)
DETAIL:  Not null constraint for column a of table child was violated
drop table child;
drop table parent;
-- test setting and removing default values
create table def_test (
	c1	int4 default 5,
	c2	text default 'initial_default'
);
NOTICE:  Table doesn't have 'DISTRIBUTED BY' clause -- Using column named 'c1' as the Greenplum Database data distribution key for this table.
HINT:  The 'DISTRIBUTED BY' clause determines the distribution of data. Make sure column(s) chosen are the optimal data distribution key to minimize skew.
insert into def_test default values;
alter table def_test alter column c1 drop default;
insert into def_test default values;
alter table def_test alter column c2 drop default;
insert into def_test default values;
alter table def_test alter column c1 set default 10;
alter table def_test alter column c2 set default 'new_default';
insert into def_test default values;
select * from def_test order by 1,2;
 c1 |       c2        
----+-----------------
  5 | initial_default
 10 | new_default
    | initial_default
    | 
(4 rows)

-- set defaults to an incorrect type: this should fail
alter table def_test alter column c1 set default 'wrong_datatype';
ERROR:  invalid input syntax for integer: "wrong_datatype"
alter table def_test alter column c2 set default 20;
-- set defaults on a non-existent column: this should fail
alter table def_test alter column c3 set default 30;
ERROR:  column "c3" of relation "def_test" does not exist
-- set defaults on views: we need to create a view, add a rule
-- to allow insertions into it, and then alter the view to add
-- a default
create view def_view_test as select * from def_test;
create rule def_view_test_ins as
	on insert to def_view_test
	do instead insert into def_test select new.*;
insert into def_view_test default values;
alter table def_view_test alter column c1 set default 45;
insert into def_view_test default values;
alter table def_view_test alter column c2 set default 'view_default';
insert into def_view_test default values;
select * from def_view_test order by 1,2;
 c1 |       c2        
----+-----------------
  5 | initial_default
 10 | new_default
 45 | view_default
 45 | 
    | initial_default
    | 
    | 
(7 rows)

drop rule def_view_test_ins on def_view_test;
drop view def_view_test;
drop table def_test;
-- alter table / drop column tests
-- try altering system catalogs, should fail
alter table pg_class drop column relname;
ERROR:  permission denied: "pg_class" is a system catalog
-- try altering non-existent table, should fail
alter table nosuchtable drop column bar;
ERROR:  relation "nosuchtable" does not exist
-- test dropping columns
create table atacc1 (a int4 not null, b int4, c int4 not null, d int4) with oids
distributed by (a);
NOTICE:  OIDS=TRUE is not recommended for user-created tables. Use OIDS=FALSE to prevent wrap-around of the OID counter
insert into atacc1 values (1, 2, 3, 4);
alter table atacc1 drop a;
NOTICE:  Dropping a column that is part of the distribution policy forces a NULL distribution policy
alter table atacc1 drop a;
ERROR:  column "a" of relation "atacc1" does not exist
-- SELECTs
select * from atacc1;
 b | c | d 
---+---+---
 2 | 3 | 4
(1 row)

select * from atacc1 order by a;
ERROR:  column "a" does not exist
LINE 1: select * from atacc1 order by a;
                                      ^
select * from atacc1 order by "........pg.dropped.1........";
ERROR:  column "........pg.dropped.1........" does not exist
LINE 1: select * from atacc1 order by "........pg.dropped.1........"...
                                      ^
select * from atacc1 group by a;
ERROR:  column "a" does not exist
LINE 1: select * from atacc1 group by a;
                                      ^
select * from atacc1 group by "........pg.dropped.1........";
ERROR:  column "........pg.dropped.1........" does not exist
LINE 1: select * from atacc1 group by "........pg.dropped.1........"...
                                      ^
select atacc1.* from atacc1;
 b | c | d 
---+---+---
 2 | 3 | 4
(1 row)

select a from atacc1;
ERROR:  column "a" does not exist
LINE 1: select a from atacc1;
               ^
select atacc1.a from atacc1;
ERROR:  column atacc1.a does not exist
LINE 1: select atacc1.a from atacc1;
               ^
select b,c,d from atacc1;
 b | c | d 
---+---+---
 2 | 3 | 4
(1 row)

select a,b,c,d from atacc1;
ERROR:  column "a" does not exist
LINE 1: select a,b,c,d from atacc1;
               ^
select * from atacc1 where a = 1;
ERROR:  column "a" does not exist
LINE 1: select * from atacc1 where a = 1;
                                   ^
select "........pg.dropped.1........" from atacc1;
ERROR:  column "........pg.dropped.1........" does not exist
LINE 1: select "........pg.dropped.1........" from atacc1;
               ^
select atacc1."........pg.dropped.1........" from atacc1;
ERROR:  column atacc1.........pg.dropped.1........ does not exist
LINE 1: select atacc1."........pg.dropped.1........" from atacc1;
               ^
select "........pg.dropped.1........",b,c,d from atacc1;
ERROR:  column "........pg.dropped.1........" does not exist
LINE 1: select "........pg.dropped.1........",b,c,d from atacc1;
               ^
select * from atacc1 where "........pg.dropped.1........" = 1;
ERROR:  column "........pg.dropped.1........" does not exist
LINE 1: select * from atacc1 where "........pg.dropped.1........" = ...
                                   ^
-- UPDATEs
update atacc1 set a = 3;
ERROR:  column "a" of relation "atacc1" does not exist
LINE 1: update atacc1 set a = 3;
                          ^
update atacc1 set b = 2 where a = 3;
ERROR:  column "a" does not exist
LINE 1: update atacc1 set b = 2 where a = 3;
                                      ^
update atacc1 set "........pg.dropped.1........" = 3;
ERROR:  column "........pg.dropped.1........" of relation "atacc1" does not exist
LINE 1: update atacc1 set "........pg.dropped.1........" = 3;
                          ^
update atacc1 set b = 2 where "........pg.dropped.1........" = 3;
ERROR:  column "........pg.dropped.1........" does not exist
LINE 1: update atacc1 set b = 2 where "........pg.dropped.1........"...
                                      ^
-- INSERTs
insert into atacc1 values (10, 11, 12, 13);
ERROR:  INSERT has more expressions than target columns
insert into atacc1 values (default, 11, 12, 13);
ERROR:  INSERT has more expressions than target columns
insert into atacc1 values (11, 12, 13);
insert into atacc1 (a) values (10);
ERROR:  column "a" of relation "atacc1" does not exist
LINE 1: insert into atacc1 (a) values (10);
                            ^
insert into atacc1 (a) values (default);
ERROR:  column "a" of relation "atacc1" does not exist
LINE 1: insert into atacc1 (a) values (default);
                            ^
insert into atacc1 (a,b,c,d) values (10,11,12,13);
ERROR:  column "a" of relation "atacc1" does not exist
LINE 1: insert into atacc1 (a,b,c,d) values (10,11,12,13);
                            ^
insert into atacc1 (a,b,c,d) values (default,11,12,13);
ERROR:  column "a" of relation "atacc1" does not exist
LINE 1: insert into atacc1 (a,b,c,d) values (default,11,12,13);
                            ^
insert into atacc1 (b,c,d) values (11,12,13);
insert into atacc1 ("........pg.dropped.1........") values (10);
ERROR:  column "........pg.dropped.1........" of relation "atacc1" does not exist
LINE 1: insert into atacc1 ("........pg.dropped.1........") values (...
                            ^
insert into atacc1 ("........pg.dropped.1........") values (default);
ERROR:  column "........pg.dropped.1........" of relation "atacc1" does not exist
LINE 1: insert into atacc1 ("........pg.dropped.1........") values (...
                            ^
insert into atacc1 ("........pg.dropped.1........",b,c,d) values (10,11,12,13);
ERROR:  column "........pg.dropped.1........" of relation "atacc1" does not exist
LINE 1: insert into atacc1 ("........pg.dropped.1........",b,c,d) va...
                            ^
insert into atacc1 ("........pg.dropped.1........",b,c,d) values (default,11,12,13);
ERROR:  column "........pg.dropped.1........" of relation "atacc1" does not exist
LINE 1: insert into atacc1 ("........pg.dropped.1........",b,c,d) va...
                            ^
-- DELETEs
delete from atacc1 where a = 3;
ERROR:  column "a" does not exist
LINE 1: delete from atacc1 where a = 3;
                                 ^
delete from atacc1 where "........pg.dropped.1........" = 3;
ERROR:  column "........pg.dropped.1........" does not exist
LINE 1: delete from atacc1 where "........pg.dropped.1........" = 3;
                                 ^
delete from atacc1;
-- try dropping a non-existent column, should fail
alter table atacc1 drop bar;
ERROR:  column "bar" of relation "atacc1" does not exist
-- try dropping the oid column, should succeed
alter table atacc1 drop oid;
-- try dropping the xmin column, should fail
alter table atacc1 drop xmin;
ERROR:  cannot drop system column "xmin"
-- try creating a view and altering that, should fail
create view myview as select * from atacc1;
select * from myview order by 1,2,3;
 b | c | d 
---+---+---
(0 rows)

alter table myview drop d;
ERROR:  "myview" is not a table
drop view myview;
-- test some commands to make sure they fail on the dropped column
analyze atacc1(a);
ERROR:  Relation atacc1 does not have an attribute named a.
analyze atacc1("........pg.dropped.1........");
ERROR:  Relation atacc1 does not have an attribute named ........pg.dropped.1.........
vacuum analyze atacc1(a);
ERROR:  Relation atacc1 does not have an attribute named a.
vacuum analyze atacc1("........pg.dropped.1........");
ERROR:  Relation atacc1 does not have an attribute named ........pg.dropped.1.........
comment on column atacc1.a is 'testing';
ERROR:  column "a" of relation "atacc1" does not exist
comment on column atacc1."........pg.dropped.1........" is 'testing';
ERROR:  column "........pg.dropped.1........" of relation "atacc1" does not exist
alter table atacc1 alter a set storage plain;
ERROR:  column "a" of relation "atacc1" does not exist
alter table atacc1 alter "........pg.dropped.1........" set storage plain;
ERROR:  column "........pg.dropped.1........" of relation "atacc1" does not exist
alter table atacc1 alter a set statistics 0;
ERROR:  column "a" of relation "atacc1" does not exist
alter table atacc1 alter "........pg.dropped.1........" set statistics 0;
ERROR:  column "........pg.dropped.1........" of relation "atacc1" does not exist
alter table atacc1 alter a set default 3;
ERROR:  column "a" of relation "atacc1" does not exist
alter table atacc1 alter "........pg.dropped.1........" set default 3;
ERROR:  column "........pg.dropped.1........" of relation "atacc1" does not exist
alter table atacc1 alter a drop default;
ERROR:  column "a" of relation "atacc1" does not exist
alter table atacc1 alter "........pg.dropped.1........" drop default;
ERROR:  column "........pg.dropped.1........" of relation "atacc1" does not exist
alter table atacc1 alter a set not null;
ERROR:  column "a" of relation "atacc1" does not exist
alter table atacc1 alter "........pg.dropped.1........" set not null;
ERROR:  column "........pg.dropped.1........" of relation "atacc1" does not exist
alter table atacc1 alter a drop not null;
ERROR:  column "a" of relation "atacc1" does not exist
alter table atacc1 alter "........pg.dropped.1........" drop not null;
ERROR:  column "........pg.dropped.1........" of relation "atacc1" does not exist
alter table atacc1 rename a to x;
ERROR:  column "a" does not exist
alter table atacc1 rename "........pg.dropped.1........" to x;
ERROR:  column "........pg.dropped.1........" does not exist
alter table atacc1 add primary key(a);
ERROR:  column "a" named in key does not exist
alter table atacc1 add primary key("........pg.dropped.1........");
ERROR:  column "........pg.dropped.1........" named in key does not exist
alter table atacc1 add unique(a);
ERROR:  column "a" named in key does not exist
alter table atacc1 add unique("........pg.dropped.1........");
ERROR:  column "........pg.dropped.1........" named in key does not exist
alter table atacc1 add check (a > 3);
ERROR:  column "a" does not exist
alter table atacc1 add check ("........pg.dropped.1........" > 3);
ERROR:  column "........pg.dropped.1........" does not exist
create table atacc2 (id int4 unique) distributed by (id);
NOTICE:  CREATE TABLE / UNIQUE will create implicit index "atacc2_id_key" for table "atacc2"
alter table atacc1 add foreign key (a) references atacc2(id);
ERROR:  column "a" referenced in foreign key constraint does not exist
alter table atacc1 add foreign key ("........pg.dropped.1........") references atacc2(id);
ERROR:  column "........pg.dropped.1........" referenced in foreign key constraint does not exist
alter table atacc2 add foreign key (id) references atacc1(a);
ERROR:  column "a" referenced in foreign key constraint does not exist
alter table atacc2 add foreign key (id) references atacc1("........pg.dropped.1........");
ERROR:  column "........pg.dropped.1........" referenced in foreign key constraint does not exist
drop table atacc2;
create index "testing_idx" on atacc1(a);
ERROR:  column "a" does not exist
create index "testing_idx" on atacc1("........pg.dropped.1........");
ERROR:  column "........pg.dropped.1........" does not exist
-- test create as and select into
insert into atacc1 values (21, 22, 23);
create table alter_table_test1 as select * from atacc1;
NOTICE:  Table doesn't have 'DISTRIBUTED BY' clause -- Using column(s) named 'b' as the Greenplum Database data distribution key for this table.
HINT:  The 'DISTRIBUTED BY' clause determines the distribution of data. Make sure column(s) chosen are the optimal data distribution key to minimize skew.
select * from alter_table_test1 order by 1,2;
 b  | c  | d  
----+----+----
 21 | 22 | 23
(1 row)

drop table alter_table_test1;
select * into alter_table_test2 from atacc1;
NOTICE:  Table doesn't have 'DISTRIBUTED BY' clause -- Using column(s) named 'b' as the Greenplum Database data distribution key for this table.
HINT:  The 'DISTRIBUTED BY' clause determines the distribution of data. Make sure column(s) chosen are the optimal data distribution key to minimize skew.
select * from alter_table_test2 order by 1,2;
 b  | c  | d  
----+----+----
 21 | 22 | 23
(1 row)

drop table alter_table_test2;
-- try dropping all columns
alter table atacc1 drop c;
alter table atacc1 drop d;
alter table atacc1 drop b;
select * from atacc1;
--
(1 row)

drop table atacc1;
-- test inheritance
create table parent (a int, b int, c int);
NOTICE:  Table doesn't have 'DISTRIBUTED BY' clause -- Using column named 'a' as the Greenplum Database data distribution key for this table.
HINT:  The 'DISTRIBUTED BY' clause determines the distribution of data. Make sure column(s) chosen are the optimal data distribution key to minimize skew.
insert into parent values (1, 2, 3);
alter table parent drop a;
NOTICE:  Dropping a column that is part of the distribution policy forces a NULL distribution policy
create table child (d varchar(255)) inherits (parent);
NOTICE:  Table has parent, setting distribution columns to match parent table
insert into child values (12, 13, 'testing');
select * from parent order by 1,2,3;
ERROR:  ORDER BY position 3 is not in select list
LINE 1: select * from parent order by 1,2,3;
                                          ^
select * from child;
 b  | c  |    d    
----+----+---------
 12 | 13 | testing
(1 row)

alter table parent drop c;
select * from parent order by 1,2;
ERROR:  ORDER BY position 2 is not in select list
LINE 1: select * from parent order by 1,2;
                                        ^
select * from child;
 b  |    d    
----+---------
 12 | testing
(1 row)

drop table child;
drop table parent;
-- test copy in/out
create table alter_table_test (a int4, b int4, c int4);
NOTICE:  Table doesn't have 'DISTRIBUTED BY' clause -- Using column named 'a' as the Greenplum Database data distribution key for this table.
HINT:  The 'DISTRIBUTED BY' clause determines the distribution of data. Make sure column(s) chosen are the optimal data distribution key to minimize skew.
insert into alter_table_test values (1,2,3);
alter table alter_table_test drop a;
NOTICE:  Dropping a column that is part of the distribution policy forces a NULL distribution policy
copy alter_table_test to stdout;
2	3
copy alter_table_test(a) to stdout;
ERROR:  column "a" of relation "alter_table_test" does not exist
copy alter_table_test("........pg.dropped.1........") to stdout;
ERROR:  column "........pg.dropped.1........" of relation "alter_table_test" does not exist
copy alter_table_test from stdin;
ERROR:  extra data after last expected column
CONTEXT:  COPY alter_table_test, line 1: "10	11	12"
select * from alter_table_test order by 1;
 b | c 
---+---
 2 | 3
(1 row)

copy alter_table_test from stdin;
select * from alter_table_test order by 1;
 b  | c  
----+----
  2 |  3
 21 | 22
(2 rows)

copy alter_table_test(a) from stdin;
ERROR:  column "a" of relation "alter_table_test" does not exist
copy alter_table_test("........pg.dropped.1........") from stdin;
ERROR:  column "........pg.dropped.1........" of relation "alter_table_test" does not exist
copy alter_table_test(b,c) from stdin;
select * from alter_table_test order by 1;
 b  | c  
----+----
  2 |  3
 21 | 22
 31 | 32
(3 rows)

drop table alter_table_test;
-- test inheritance
create table dropColumn (a int, b int, e int);
NOTICE:  Table doesn't have 'DISTRIBUTED BY' clause -- Using column named 'a' as the Greenplum Database data distribution key for this table.
HINT:  The 'DISTRIBUTED BY' clause determines the distribution of data. Make sure column(s) chosen are the optimal data distribution key to minimize skew.
create table dropColumnChild (c int) inherits (dropColumn);
NOTICE:  Table has parent, setting distribution columns to match parent table
create table dropColumnAnother (d int) inherits (dropColumnChild);
NOTICE:  Table has parent, setting distribution columns to match parent table
-- these two should fail
alter table dropColumnchild drop column a;
ERROR:  cannot drop inherited column "a"
alter table only dropColumnChild drop column b;
ERROR:  cannot drop inherited column "b"
-- these three should work
alter table only dropColumn drop column e;
alter table dropColumnChild drop column c;
alter table dropColumn drop column a;
NOTICE:  Dropping a column that is part of the distribution policy forces a NULL distribution policy
NOTICE:  Dropping a column that is part of the distribution policy forces a NULL distribution policy
NOTICE:  Dropping a column that is part of the distribution policy forces a NULL distribution policy
create table renameColumn (a int);
NOTICE:  Table doesn't have 'DISTRIBUTED BY' clause -- Using column named 'a' as the Greenplum Database data distribution key for this table.
HINT:  The 'DISTRIBUTED BY' clause determines the distribution of data. Make sure column(s) chosen are the optimal data distribution key to minimize skew.
create table renameColumnChild (b int) inherits (renameColumn);
NOTICE:  Table has parent, setting distribution columns to match parent table
create table renameColumnAnother (c int) inherits (renameColumnChild);
NOTICE:  Table has parent, setting distribution columns to match parent table
-- these three should fail
alter table renameColumnChild rename column a to d;
ERROR:  cannot rename inherited column "a"
alter table only renameColumnChild rename column a to d;
ERROR:  inherited column "a" must be renamed in child tables too
alter table only renameColumn rename column a to d;
ERROR:  inherited column "a" must be renamed in child tables too
-- these should work
alter table renameColumn rename column a to d;
alter table renameColumnChild rename column b to a;
-- this should work
alter table renameColumn add column w int;
-- this should fail
alter table only renameColumn add column x int;
ERROR:  column must be added to child tables too
-- Test corner cases in dropping of inherited columns
create table p1 (f1 int, f2 int);
NOTICE:  Table doesn't have 'DISTRIBUTED BY' clause -- Using column named 'f1' as the Greenplum Database data distribution key for this table.
HINT:  The 'DISTRIBUTED BY' clause determines the distribution of data. Make sure column(s) chosen are the optimal data distribution key to minimize skew.
create table c1 (f1 int not null) inherits(p1);
NOTICE:  Table has parent, setting distribution columns to match parent table
NOTICE:  merging column "f1" with inherited definition
-- should be rejected since c1.f1 is inherited
alter table c1 drop column f1;
ERROR:  cannot drop inherited column "f1"
-- should work
alter table p1 drop column f1;
NOTICE:  Dropping a column that is part of the distribution policy forces a NULL distribution policy
-- c1.f1 is still there, but no longer inherited
select f1 from c1 order by 1;
 f1 
----
(0 rows)

alter table c1 drop column f1;
NOTICE:  Dropping a column that is part of the distribution policy forces a NULL distribution policy
select f1 from c1;
ERROR:  column "f1" does not exist
LINE 1: select f1 from c1;
               ^
drop table p1 cascade;
NOTICE:  drop cascades to table c1
create table p1 (f1 int, f2 int);
NOTICE:  Table doesn't have 'DISTRIBUTED BY' clause -- Using column named 'f1' as the Greenplum Database data distribution key for this table.
HINT:  The 'DISTRIBUTED BY' clause determines the distribution of data. Make sure column(s) chosen are the optimal data distribution key to minimize skew.
create table c1 () inherits(p1);
NOTICE:  Table has parent, setting distribution columns to match parent table
-- should be rejected since c1.f1 is inherited
alter table c1 drop column f1;
ERROR:  cannot drop inherited column "f1"
alter table p1 drop column f1;
NOTICE:  Dropping a column that is part of the distribution policy forces a NULL distribution policy
NOTICE:  Dropping a column that is part of the distribution policy forces a NULL distribution policy
-- c1.f1 is dropped now, since there is no local definition for it
select f1 from c1;
ERROR:  column "f1" does not exist
LINE 1: select f1 from c1;
               ^
drop table p1 cascade;
NOTICE:  drop cascades to table c1
create table p1 (f1 int, f2 int);
NOTICE:  Table doesn't have 'DISTRIBUTED BY' clause -- Using column named 'f1' as the Greenplum Database data distribution key for this table.
HINT:  The 'DISTRIBUTED BY' clause determines the distribution of data. Make sure column(s) chosen are the optimal data distribution key to minimize skew.
create table c1 () inherits(p1);
NOTICE:  Table has parent, setting distribution columns to match parent table
-- should be rejected since c1.f1 is inherited
alter table c1 drop column f1;
ERROR:  cannot drop inherited column "f1"
alter table only p1 drop column f1;
NOTICE:  Dropping a column that is part of the distribution policy forces a NULL distribution policy
-- c1.f1 is NOT dropped, but must now be considered non-inherited
alter table c1 drop column f1;
NOTICE:  Dropping a column that is part of the distribution policy forces a NULL distribution policy
drop table p1 cascade;
NOTICE:  drop cascades to table c1
create table p1 (f1 int, f2 int);
NOTICE:  Table doesn't have 'DISTRIBUTED BY' clause -- Using column named 'f1' as the Greenplum Database data distribution key for this table.
HINT:  The 'DISTRIBUTED BY' clause determines the distribution of data. Make sure column(s) chosen are the optimal data distribution key to minimize skew.
create table c1 (f1 int not null) inherits(p1);
NOTICE:  Table has parent, setting distribution columns to match parent table
NOTICE:  merging column "f1" with inherited definition
-- should be rejected since c1.f1 is inherited
alter table c1 drop column f1;
ERROR:  cannot drop inherited column "f1"
alter table only p1 drop column f1;
NOTICE:  Dropping a column that is part of the distribution policy forces a NULL distribution policy
-- c1.f1 is still there, but no longer inherited
alter table c1 drop column f1;
NOTICE:  Dropping a column that is part of the distribution policy forces a NULL distribution policy
drop table p1 cascade;
NOTICE:  drop cascades to table c1
create table p1(id int, name text);
NOTICE:  Table doesn't have 'DISTRIBUTED BY' clause -- Using column named 'id' as the Greenplum Database data distribution key for this table.
HINT:  The 'DISTRIBUTED BY' clause determines the distribution of data. Make sure column(s) chosen are the optimal data distribution key to minimize skew.
create table p2(id2 int, name text, height int);
NOTICE:  Table doesn't have 'DISTRIBUTED BY' clause -- Using column named 'id2' as the Greenplum Database data distribution key for this table.
HINT:  The 'DISTRIBUTED BY' clause determines the distribution of data. Make sure column(s) chosen are the optimal data distribution key to minimize skew.
create table c1(age int) inherits(p1,p2);
NOTICE:  Table has parent, setting distribution columns to match parent table
NOTICE:  merging multiple inherited definitions of column "name"
create table gc1() inherits (c1);
NOTICE:  Table has parent, setting distribution columns to match parent table
select relname, attname, attinhcount, attislocal
from pg_class join pg_attribute on (pg_class.oid = pg_attribute.attrelid)
where relname in ('p1','p2','c1','gc1') and attnum > 0 and not attisdropped
order by relname, attnum;
 relname | attname | attinhcount | attislocal 
---------+---------+-------------+------------
 c1      | id      |           1 | f
 c1      | name    |           2 | f
 c1      | id2     |           1 | f
 c1      | height  |           1 | f
 c1      | age     |           0 | t
 gc1     | id      |           1 | f
 gc1     | name    |           1 | f
 gc1     | id2     |           1 | f
 gc1     | height  |           1 | f
 gc1     | age     |           1 | f
 p1      | id      |           0 | t
 p1      | name    |           0 | t
 p2      | id2     |           0 | t
 p2      | name    |           0 | t
 p2      | height  |           0 | t
(15 rows)

-- should work
alter table only p1 drop column name;
-- should work. Now c1.name is local and inhcount is 0.
alter table p2 drop column name;
-- should be rejected since its inherited
alter table gc1 drop column name;
ERROR:  cannot drop inherited column "name"
-- should work, and drop gc1.name along
alter table c1 drop column name;
-- should fail: column does not exist
alter table gc1 drop column name;
ERROR:  column "name" of relation "gc1" does not exist
-- should work and drop the attribute in all tables
alter table p2 drop column height;
select relname, attname, attinhcount, attislocal
from pg_class join pg_attribute on (pg_class.oid = pg_attribute.attrelid)
where relname in ('p1','p2','c1','gc1') and attnum > 0 and not attisdropped
order by relname, attnum;
 relname | attname | attinhcount | attislocal 
---------+---------+-------------+------------
 c1      | id      |           1 | f
 c1      | id2     |           1 | f
 c1      | age     |           0 | t
 gc1     | id      |           1 | f
 gc1     | id2     |           1 | f
 gc1     | age     |           1 | f
 p1      | id      |           0 | t
 p2      | id2     |           0 | t
(8 rows)

drop table p1, p2 cascade;
NOTICE:  drop cascades to table c1
NOTICE:  drop cascades to table gc1
--
-- Test the ALTER TABLE WITHOUT OIDS command
--
create table altstartwith (col integer) with oids;
NOTICE:  Table doesn't have 'DISTRIBUTED BY' clause -- Using column named 'col' as the Greenplum Database data distribution key for this table.
HINT:  The 'DISTRIBUTED BY' clause determines the distribution of data. Make sure column(s) chosen are the optimal data distribution key to minimize skew.
NOTICE:  OIDS=TRUE is not recommended for user-created tables. Use OIDS=FALSE to prevent wrap-around of the OID counter
insert into altstartwith values (1);
select oid > 0, * from altstartwith;
 ?column? | col 
----------+-----
 t        |   1
(1 row)

alter table altstartwith set without oids;
select oid > 0, * from altstartwith; -- fails
ERROR:  column "oid" does not exist
LINE 1: select oid > 0, * from altstartwith;
               ^
select * from altstartwith;
 col 
-----
   1
(1 row)

-- Run inheritance tests
create table altwithoid (col integer) with oids;
NOTICE:  Table doesn't have 'DISTRIBUTED BY' clause -- Using column named 'col' as the Greenplum Database data distribution key for this table.
HINT:  The 'DISTRIBUTED BY' clause determines the distribution of data. Make sure column(s) chosen are the optimal data distribution key to minimize skew.
NOTICE:  OIDS=TRUE is not recommended for user-created tables. Use OIDS=FALSE to prevent wrap-around of the OID counter
-- Inherits parents oid column
create table altinhoid () inherits (altwithoid) without oids;
NOTICE:  Table has parent, setting distribution columns to match parent table
NOTICE:  OIDS=TRUE is not recommended for user-created tables. Use OIDS=FALSE to prevent wrap-around of the OID counter
insert into altinhoid values (1);
select oid > 0, * from altwithoid order by col;
 ?column? | col 
----------+-----
 t        |   1
(1 row)

select oid > 0, * from altinhoid order by col;
 ?column? | col 
----------+-----
 t        |   1
(1 row)

alter table altwithoid set without oids;
alter table altinhoid set without oids;
select oid > 0, * from altwithoid; -- fails
ERROR:  column "oid" does not exist
LINE 1: select oid > 0, * from altwithoid;
               ^
select oid > 0, * from altinhoid; -- fails
ERROR:  column "oid" does not exist
LINE 1: select oid > 0, * from altinhoid;
               ^
select * from altwithoid;
 col 
-----
   1
(1 row)

select * from altinhoid;
 col 
-----
   1
(1 row)

-- test renumbering of child-table columns in inherited operations
create table p1 (f1 int);
NOTICE:  Table doesn't have 'DISTRIBUTED BY' clause -- Using column named 'f1' as the Greenplum Database data distribution key for this table.
HINT:  The 'DISTRIBUTED BY' clause determines the distribution of data. Make sure column(s) chosen are the optimal data distribution key to minimize skew.
create table c1 (f2 text, f3 int) inherits (p1);
NOTICE:  Table has parent, setting distribution columns to match parent table
alter table p1 add column a1 int check (a1 > 0);
alter table p1 add column f2 text;
NOTICE:  merging definition of column "f2" for child "c1"
insert into p1 values (1,2,'abc');
insert into c1 values(11,'xyz',33,0); -- should fail
ERROR:  One or more assertions failed  (seg0 antova-mbp.local:40010 pid=90951)
DETAIL:  Check constraint c1_a1_check for table c1 was violated
insert into c1 values(11,'xyz',33,22);
select * from p1 order by 1,2,3;
 f1 | a1 | f2  
----+----+-----
  1 |  2 | abc
 11 | 22 | xyz
(2 rows)

update p1 set a1 = a1 + 1, f2 = upper(f2);
select * from p1 order by 1,2,3;
 f1 | a1 | f2  
----+----+-----
  1 |  3 | ABC
 11 | 23 | XYZ
(2 rows)

drop table p1 cascade;
NOTICE:  drop cascades to table c1
NOTICE:  drop cascades to constraint c1_a1_check on table c1
-- test that operations with a dropped column do not try to reference
-- its datatype
create domain mytype as text;
create temp table foo (f1 text, f2 mytype, f3 text);
NOTICE:  Table doesn't have 'DISTRIBUTED BY' clause -- Using column named 'f1' as the Greenplum Database data distribution key for this table.
HINT:  The 'DISTRIBUTED BY' clause determines the distribution of data. Make sure column(s) chosen are the optimal data distribution key to minimize skew.
insert into foo values('aa','bb','cc');
select * from foo;
 f1 | f2 | f3 
----+----+----
 aa | bb | cc
(1 row)

drop domain mytype cascade;
NOTICE:  drop cascades to table foo column f2
select * from foo;
 f1 | f3 
----+----
 aa | cc
(1 row)

insert into foo values('qq','rr');
select * from foo order by 1,2;
 f1 | f3 
----+----
 aa | cc
 qq | rr
(2 rows)

update foo set f3 = 'zz';
select * from foo order by 1,2;
 f1 | f3 
----+----
 aa | zz
 qq | zz
(2 rows)

select f3,max(f1) from foo group by f3 order by f3;
 f3 | max 
----+-----
 zz | qq
(1 row)

-- Simple tests for alter table column type
alter table foo alter f1 TYPE integer; -- fails
ERROR:  column "f1" cannot be cast to type "pg_catalog.int4"
alter table foo alter f1 TYPE varchar(10);
--
-- Test ALTER COLUMN TYPE after dropped column with text datatype (see MPP-19146)
--
drop table foo;
create domain mytype as text;
create temp table foo (f1 text, f2 mytype, f3 text);
NOTICE:  Table doesn't have 'DISTRIBUTED BY' clause -- Using column named 'f1' as the Greenplum Database data distribution key for this table.
HINT:  The 'DISTRIBUTED BY' clause determines the distribution of data. Make sure column(s) chosen are the optimal data distribution key to minimize skew.
insert into foo values('aa','bb','cc');
drop domain mytype cascade;
NOTICE:  drop cascades to table foo column f2
alter table foo alter f1 TYPE varchar(10);
drop table foo;
create domain mytype as int;
create temp table foo (f1 text, f2 mytype, f3 text);
NOTICE:  Table doesn't have 'DISTRIBUTED BY' clause -- Using column named 'f1' as the Greenplum Database data distribution key for this table.
HINT:  The 'DISTRIBUTED BY' clause determines the distribution of data. Make sure column(s) chosen are the optimal data distribution key to minimize skew.
insert into foo values('aa',0,'cc');
drop domain mytype cascade;
NOTICE:  drop cascades to table foo column f2
alter table foo alter f1 TYPE varchar(10);
create table anothertab (atcol1 serial8, atcol2 boolean,
	constraint anothertab_chk check (atcol1 <= 3))
	distributed by (atcol1);
NOTICE:  CREATE TABLE will create implicit sequence "anothertab_atcol1_seq" for serial column "anothertab.atcol1"
insert into anothertab (atcol1, atcol2) values (default, true);
insert into anothertab (atcol1, atcol2) values (default, false);
select * from anothertab order by 1,2;
 atcol1 | atcol2 
--------+--------
      1 | t
      2 | f
(2 rows)

alter table anothertab alter column atcol1 type boolean; -- fails
ERROR:  column "atcol1" cannot be cast to type "pg_catalog.bool"
alter table anothertab alter column atcol1 type integer;
select * from anothertab order by 1,2;
 atcol1 | atcol2 
--------+--------
      1 | t
      2 | f
(2 rows)

insert into anothertab (atcol1, atcol2) values (45, null); -- fails
ERROR:  One or more assertions failed  (seg0 antova-mbp.local:40010 pid=87501)
DETAIL:  Check constraint anothertab_chk for table anothertab was violated
insert into anothertab (atcol1, atcol2) values (default, null);
select * from anothertab order by 1,2;
 atcol1 | atcol2 
--------+--------
      1 | t
      2 | f
      3 | 
(3 rows)

alter table anothertab alter column atcol2 type text
      using case when atcol2 is true then 'IT WAS TRUE' 
                 when atcol2 is false then 'IT WAS FALSE'
                 else 'IT WAS NULL!' end;
select * from anothertab order by 1,2;
 atcol1 |    atcol2    
--------+--------------
      1 | IT WAS TRUE
      2 | IT WAS FALSE
      3 | IT WAS NULL!
(3 rows)

alter table anothertab alter column atcol1 type boolean
        using case when atcol1 % 2 = 0 then true else false end; -- fails
ERROR:  default for column "atcol1" cannot be cast to type "pg_catalog.bool"
alter table anothertab alter column atcol1 drop default;
alter table anothertab alter column atcol1 type boolean
        using case when atcol1 % 2 = 0 then true else false end; -- fails
ERROR:  cannot alter type of a column used in a distribution policy
alter table anothertab drop constraint anothertab_chk;
alter table anothertab alter column atcol1 type boolean
        using case when atcol1 % 2 = 0 then true else false end;
ERROR:  cannot alter type of a column used in a distribution policy
select * from anothertab order by 1,2;
 atcol1 |    atcol2    
--------+--------------
      1 | IT WAS TRUE
      2 | IT WAS FALSE
      3 | IT WAS NULL!
(3 rows)

drop table anothertab;
create table another (f1 int, f2 text) distributed by (f1);
insert into another values(1, 'one');
insert into another values(2, 'two');
insert into another values(3, 'three');
select * from another order by 1,2;
 f1 |  f2   
----+-------
  1 | one
  2 | two
  3 | three
(3 rows)

alter table another
  alter f1 type text using f2 || ' more',
  alter f2 type bigint using f1 * 10;
ERROR:  cannot alter type of a column used in a distribution policy
select * from another order by 1,2;
 f1 |  f2   
----+-------
  1 | one
  2 | two
  3 | three
(3 rows)

drop table another;
--
-- alter function
--
create function test_strict(text) returns text as
    'select coalesce($1, ''got passed a null'');'
    language sql CONTAINS SQL returns null on null input;
select test_strict(NULL);
 test_strict 
-------------
 
(1 row)

alter function test_strict(text) called on null input;
select test_strict(NULL);
    test_strict    
-------------------
 got passed a null
(1 row)

create function non_strict(text) returns text as
    'select coalesce($1, ''got passed a null'');'
    language sql CONTAINS SQL called on null input;
select non_strict(NULL);
    non_strict     
-------------------
 got passed a null
(1 row)

alter function non_strict(text) returns null on null input;
select non_strict(NULL);
 non_strict 
------------
 
(1 row)

--
-- alter object set schema
--
create schema alter1;
create schema alter2;
create table alter1.t1(f1 serial primary key, f2 int check (f2 > 0)) distributed by (f1);
NOTICE:  CREATE TABLE will create implicit sequence "t1_f1_seq" for serial column "t1.f1"
NOTICE:  CREATE TABLE / PRIMARY KEY will create implicit index "t1_pkey" for table "t1"
create view alter1.v1 as select * from alter1.t1;
create function alter1.plus1(int) returns int as 'select $1+1' language sql CONTAINS SQL;
create domain alter1.posint integer check (value > 0);
create type alter1.ctype as (f1 int, f2 text);
insert into alter1.t1(f2) values(11);
insert into alter1.t1(f2) values(12);
alter table alter1.t1 set schema alter2;
alter table alter1.v1 set schema alter2;
alter function alter1.plus1(int) set schema alter2;
alter domain alter1.posint set schema alter2;
alter type alter1.ctype set schema alter2;
-- this should succeed because nothing is left in alter1
drop schema alter1;
insert into alter2.t1(f2) values(13);
insert into alter2.t1(f2) values(14);
select * from alter2.t1 order by 1;
 f1 | f2 
----+----
  1 | 11
  2 | 12
  3 | 13
  4 | 14
(4 rows)

select * from alter2.v1 order by 1;
 f1 | f2 
----+----
  1 | 11
  2 | 12
  3 | 13
  4 | 14
(4 rows)

select alter2.plus1(41);
 plus1 
-------
    42
(1 row)

-- clean up
drop schema alter2 cascade;
NOTICE:  drop cascades to type alter2.ctype
NOTICE:  drop cascades to type alter2.posint
NOTICE:  drop cascades to function alter2.plus1(integer)
NOTICE:  drop cascades to view alter2.v1
NOTICE:  drop cascades to rule _RETURN on view alter2.v1
NOTICE:  drop cascades to sequence alter2.t1_f1_seq
NOTICE:  drop cascades to default for table alter2.t1 column f1
NOTICE:  drop cascades to table alter2.t1
NOTICE:  drop cascades to constraint t1_f2_check on table alter2.t1
--
-- Test ALTER TABLE ADD COLUMN WITH NULL DEFAULT on AO TABLES
--
---
--- basic support for alter add column with NULL default to AO tables
--- 
drop table if exists ao1;
NOTICE:  table "ao1" does not exist, skipping
create table ao1(col1 varchar(2), col2 int) WITH (APPENDONLY=TRUE) distributed randomly;
insert into ao1 values('aa', 1);
insert into ao1 values('bb', 2);
-- following should be OK.
alter table ao1 add column col3 char(1) default 5;
-- the following should be supported now
alter table ao1 add column col4 char(1) default NULL;
select * from ao1;
 col1 | col2 | col3 | col4 
------+------+------+------
 aa   |    1 | 5    | 
 bb   |    2 | 5    | 
(2 rows)

insert into ao1 values('cc', 3);
select * from ao1;
 col1 | col2 | col3 | col4 
------+------+------+------
 aa   |    1 | 5    | 
 bb   |    2 | 5    | 
 cc   |    3 | 5    | 
(3 rows)

alter table ao1 alter column col4 drop default; 
select * from ao1;
 col1 | col2 | col3 | col4 
------+------+------+------
 aa   |    1 | 5    | 
 bb   |    2 | 5    | 
 cc   |    3 | 5    | 
(3 rows)

insert into ao1 values('dd', 4);
select * from ao1;
 col1 | col2 | col3 | col4 
------+------+------+------
 aa   |    1 | 5    | 
 bb   |    2 | 5    | 
 cc   |    3 | 5    | 
 dd   |    4 | 5    | 
(4 rows)

---
--- check catalog contents after alter table on AO tables 
---
drop table if exists ao1;
create table ao1(col1 varchar(2), col2 int) WITH (APPENDONLY=TRUE) distributed randomly;
-- relnatts is 2
select relname, relnatts from pg_class where relname = 'ao1';
 relname | relnatts 
---------+----------
 ao1     |        2
(1 row)

alter table ao1 add column col3 char(1) default NULL;
-- relnatts in pg_class should be 3
select relname, relnatts from pg_class where relname = 'ao1';
 relname | relnatts 
---------+----------
 ao1     |        3
(1 row)

-- check col details in pg_attribute
select  pg_class.relname, attname, typname from pg_attribute, pg_class, pg_type where attrelid = pg_class.oid and pg_class.relname = 'ao1' and atttypid = pg_type.oid and attname = 'col3';
 relname | attname | typname 
---------+---------+---------
 ao1     | col3    | bpchar
(1 row)

-- no explicit entry in pg_attrdef for NULL default
select relname, attname, adsrc from pg_class, pg_attribute, pg_attrdef where attrelid = pg_class.oid and adrelid = pg_class.oid and adnum = pg_attribute.attnum and pg_class.relname = 'ao1';
 relname | attname | adsrc 
---------+---------+-------
(0 rows)

--- 
--- check with IS NOT NULL constraint
--- 
drop table if exists ao1;
create table ao1(col1 varchar(2), col2 int) WITH (APPENDONLY=TRUE) distributed randomly;
insert into ao1 values('a', 1); 
-- should fail
alter table ao1 add column col3 char(1) not null default NULL; 
ERROR:  column "col3" contains null values  (seg1 usxxshenem1.local:40001 pid=85314)
drop table if exists ao1;
create table ao1(col1 varchar(2), col2 int) WITH (APPENDONLY=TRUE) distributed randomly;
-- should pass
alter table ao1 add column col3 char(1) not null default NULL; 
-- this should fail (same behavior as heap tables)
insert into ao1(col1, col2) values('a', 10);
ERROR:  NULL value in column "col3" violates not-null constraint (COptTasks.cpp:1289)
---
--- alter add with no default should continue to fail
---
drop table if exists ao1;
create table ao1(col1 varchar(1)) with (APPENDONLY=TRUE) distributed randomly;
insert into ao1 values('1');
insert into ao1 values('1');
insert into ao1 values('1');
insert into ao1 values('1');
alter table ao1 add column col2 char(1);
ERROR:  ADD COLUMN with no default value in append-only tables is not yet supported.
select * from ao1;
 col1 
------
 1
 1
 1
 1
(4 rows)

--
-- MPP-19664 
-- Test ALTER TABLE ADD COLUMN WITH NULL DEFAULT on AO/CO TABLES
--
--- 
--- basic support for alter add column with NULL default to AO/CO tables
--- 
drop table if exists aoco1;
NOTICE:  table "aoco1" does not exist, skipping
create table aoco1(col1 varchar(2), col2 int)
WITH (APPENDONLY=TRUE, ORIENTATION=column) distributed randomly;
insert into aoco1 values('aa', 1);
insert into aoco1 values('bb', 2);
-- following should be OK.
alter table aoco1 add column col3 char(1) default 5;
-- the following should be supported now
alter table aoco1 add column col4 char(1) default NULL;
select * from aoco1;
 col1 | col2 | col3 | col4 
------+------+------+------
 aa   |    1 | 5    | 
 bb   |    2 | 5    | 
(2 rows)

insert into aoco1 values('cc', 3);
select * from aoco1;
 col1 | col2 | col3 | col4 
------+------+------+------
 aa   |    1 | 5    | 
 bb   |    2 | 5    | 
 cc   |    3 | 5    | 
(3 rows)

alter table aoco1 alter column col4 drop default; 
select * from aoco1;
 col1 | col2 | col3 | col4 
------+------+------+------
 aa   |    1 | 5    | 
 bb   |    2 | 5    | 
 cc   |    3 | 5    | 
(3 rows)

insert into aoco1 values('dd', 4);
select * from aoco1;
 col1 | col2 | col3 | col4 
------+------+------+------
 aa   |    1 | 5    | 
 bb   |    2 | 5    | 
 cc   |    3 | 5    | 
 dd   |    4 | 5    | 
(4 rows)

---
--- check catalog contents after alter table on AO/CO tables 
---
drop table if exists aoco1;
create table aoco1(col1 varchar(2), col2 int)
WITH (APPENDONLY=TRUE, ORIENTATION=column) distributed randomly;
-- relnatts is 2
select relname, relnatts from pg_class where relname = 'aoco1';
 relname | relnatts 
---------+----------
 aoco1   |        2
(1 row)

alter table aoco1 add column col3 char(1) default NULL;
-- relnatts in pg_class should be 3
select relname, relnatts from pg_class where relname = 'aoco1';
 relname | relnatts 
---------+----------
 aoco1   |        3
(1 row)

-- check col details in pg_attribute
select  pg_class.relname, attname, typname from pg_attribute, pg_class, pg_type where attrelid = pg_class.oid and pg_class.relname = 'aoco1' and atttypid = pg_type.oid and attname = 'col3';
 relname | attname | typname 
---------+---------+---------
 aoco1   | col3    | bpchar
(1 row)

-- no explicit entry in pg_attrdef for NULL default
select relname, attname, adsrc from pg_class, pg_attribute, pg_attrdef where attrelid = pg_class.oid and adrelid = pg_class.oid and adnum = pg_attribute.attnum and pg_class.relname = 'aoco1';
 relname | attname | adsrc 
---------+---------+-------
(0 rows)

--- 
--- check with IS NOT NULL constraint
--- 
drop table if exists aoco1;
create table aoco1(col1 varchar(2), col2 int)
WITH (APPENDONLY=TRUE, ORIENTATION=column) distributed randomly;
insert into aoco1 values('a', 1); 
-- should fail (rewrite needs to do null checking) 
alter table aoco1 add column col3 char(1) not null default NULL; 
ERROR:  column "col3" contains null values  (seg1 usxxshenem1.local:40001 pid=85314)
alter table aoco1 add column c5 int check (c5 IS NOT NULL) default NULL;
ERROR:  check constraint "aoco1_c5_check" is violated  (seg1 usxxshenem1.local:40001 pid=85314)
-- should fail (rewrite needs to do constraint checking) 
insert into aoco1(col1, col2) values('a', NULL);
alter table aoco1 alter column col2 set not null; 
ERROR:  column "col2" contains null values  (seg1 usxxshenem1.local:40001 pid=85314)
-- should pass (rewrite needs to do constraint checking) 
alter table aoco1 alter column col2 type int; 
drop table if exists aoco1;
create table aoco1(col1 varchar(2), col2 int)
WITH (APPENDONLY=TRUE, ORIENTATION=column) distributed randomly;
-- should pass
alter table aoco1 add column col3 char(1) not null default NULL; 
-- this should fail (same behavior as heap tables)
insert into aoco1 (col1, col2) values('a', 10);
ERROR:  NULL value in column "col3" violates not-null constraint (COptTasks.cpp:1289)
drop table if exists aoco1;
create table aoco1(col1 varchar(2), col2 int not null)
WITH (APPENDONLY=TRUE, ORIENTATION=column) distributed randomly;
insert into aoco1 values('aa', 1);
alter table aoco1 add column col3 char(1) default NULL;
insert into aoco1 values('bb', 2);
select * from aoco1;
 col1 | col2 | col3 
------+------+------
 aa   |    1 | 
 bb   |    2 | 
(2 rows)

alter table aoco1 add column col4 char(1) not NULL default NULL;
ERROR:  column "col4" contains null values  (seg1 usxxshenem1.local:40001 pid=85314)
select * from aoco1;
 col1 | col2 | col3 
------+------+------
 aa   |    1 | 
 bb   |    2 | 
(2 rows)

---
--- alter add with no default should continue to fail
---
drop table if exists aoco1;
create table aoco1(col1 varchar(1))
WITH (APPENDONLY=TRUE, ORIENTATION=column) distributed randomly;
insert into aoco1 values('1');
insert into aoco1 values('1');
insert into aoco1 values('1');
insert into aoco1 values('1');
alter table aoco1 add column col2 char(1);
ERROR:  ADD COLUMN with no default value in append-only tables is not yet supported.
select * from aoco1;
 col1 
------
 1
 1
 1
 1
(4 rows)

drop table aoco1;
---
--- new column with a domain type
---
drop table if exists ao1;
create table ao1(col1 varchar(5)) with (APPENDONLY=TRUE) distributed randomly;
insert into ao1 values('abcde');
drop domain zipcode;
ERROR:  type "zipcode" does not exist
create domain zipcode as text
constraint c1 not null;
-- following should fail
alter table ao1 add column col2 zipcode;
ERROR:  ADD COLUMN with no default value in append-only tables is not yet supported.
alter table ao1 add column col2 zipcode default NULL;
ERROR:  domain zipcode does not allow null values  (seg1 usxxshenem1.local:40001 pid=85314)
select * from ao1;
 col1  
-------
 abcde
(1 row)

-- cleanup
drop table ao1;
drop domain zipcode;
drop schema if exists mpp17582 cascade;
NOTICE:  schema "mpp17582" does not exist, skipping
create schema mpp17582;
set search_path=mpp17582;
DROP TABLE testbug_char5;
ERROR:  table "testbug_char5" does not exist
CREATE TABLE testbug_char5
(
timest character varying(6),
user_id numeric(16,0) NOT NULL,
to_be_drop char(5), -- Iterate through different data types
tag1 char(5), -- Iterate through different data types
tag2 char(5)
)
DISTRIBUTED BY (user_id)
PARTITION BY LIST(timest)
(
PARTITION part201203 VALUES('201203') WITH (APPENDONLY=true, COMPRESSLEVEL=5, ORIENTATION=column),
PARTITION part201204 VALUES('201204') WITH (APPENDONLY=true, COMPRESSLEVEL=5, ORIENTATION=row),
PARTITION part201205 VALUES('201205')
);
NOTICE:  CREATE TABLE will create partition "testbug_char5_1_prt_part201203" for table "testbug_char5"
NOTICE:  CREATE TABLE will create partition "testbug_char5_1_prt_part201204" for table "testbug_char5"
NOTICE:  CREATE TABLE will create partition "testbug_char5_1_prt_part201205" for table "testbug_char5"
create index testbug_char5_tag1 on testbug_char5 using btree(tag1);
NOTICE:  building index for child partition "testbug_char5_1_prt_part201203"
NOTICE:  building index for child partition "testbug_char5_1_prt_part201204"
NOTICE:  building index for child partition "testbug_char5_1_prt_part201205"
insert into testbug_char5 (timest,user_id,to_be_drop) select '201203',1111,'10000';
insert into testbug_char5 (timest,user_id,to_be_drop) select '201204',1111,'10000';
insert into testbug_char5 (timest,user_id,to_be_drop) select '201205',1111,'10000';
select * from testbug_char5 order by 1,2;
 timest | user_id | to_be_drop | tag1 | tag2 
--------+---------+------------+------+------
 201203 |    1111 | 10000      |      | 
 201204 |    1111 | 10000      |      | 
 201205 |    1111 | 10000      |      | 
(3 rows)

ALTER TABLE testbug_char5 drop column to_be_drop;
select * from testbug_char5 order by 1,2;
 timest | user_id | tag1 | tag2 
--------+---------+------+------
 201203 |    1111 |      | 
 201204 |    1111 |      | 
 201205 |    1111 |      | 
(3 rows)

insert into testbug_char5 (timest,user_id,tag2) select '201203',2222,'2';
insert into testbug_char5 (timest,user_id,tag2) select '201204',2222,'2';
insert into testbug_char5 (timest,user_id,tag2) select '201205',2222,'2';
select * from testbug_char5 order by 1,2;
 timest | user_id | tag1 | tag2  
--------+---------+------+-------
 201203 |    1111 |      | 
 201203 |    2222 |      | 2    
 201204 |    1111 |      | 
 201204 |    2222 |      | 2    
 201205 |    1111 |      | 
 201205 |    2222 |      | 2    
(6 rows)

alter table testbug_char5 add PARTITION part201206 VALUES('201206') WITH (APPENDONLY=true, COMPRESSLEVEL=5, ORIENTATION=column);
NOTICE:  CREATE TABLE will create partition "testbug_char5_1_prt_part201206" for table "testbug_char5"
alter table testbug_char5 add PARTITION part201207 VALUES('201207') WITH (APPENDONLY=true, COMPRESSLEVEL=5, ORIENTATION=row);
NOTICE:  CREATE TABLE will create partition "testbug_char5_1_prt_part201207" for table "testbug_char5"
alter table testbug_char5 add PARTITION part201208 VALUES('201208');
NOTICE:  CREATE TABLE will create partition "testbug_char5_1_prt_part201208" for table "testbug_char5"
insert into testbug_char5 select '201206',3333,'1','2';
insert into testbug_char5 select '201207',3333,'1','2';
insert into testbug_char5 select '201208',3333,'1','2';
select * from testbug_char5 order by 1,2;
 timest | user_id | tag1  | tag2  
--------+---------+-------+-------
 201203 |    1111 |       | 
 201203 |    2222 |       | 2    
 201204 |    1111 |       | 
 201204 |    2222 |       | 2    
 201205 |    1111 |       | 
 201205 |    2222 |       | 2    
 201206 |    3333 | 1     | 2    
 201207 |    3333 | 1     | 2    
 201208 |    3333 | 1     | 2    
(9 rows)

--
-- Check index scan
--
set enable_seqscan=off;
set enable_indexscan=on;
select * from testbug_char5 where tag1='1';
 timest | user_id | tag1  | tag2  
--------+---------+-------+-------
 201206 |    3333 | 1     | 2    
 201207 |    3333 | 1     | 2    
 201208 |    3333 | 1     | 2    
(3 rows)

--
-- Check NL Index scan plan
--
create table dim(tag1 char(5));
NOTICE:  Table doesn't have 'DISTRIBUTED BY' clause -- Using column named 'tag1' as the Greenplum Database data distribution key for this table.
HINT:  The 'DISTRIBUTED BY' clause determines the distribution of data. Make sure column(s) chosen are the optimal data distribution key to minimize skew.
insert into dim values('1');
set enable_hashjoin=off;
set enable_seqscan=off;
set enable_nestloop=on;
set enable_indexscan=on;
select * from testbug_char5, dim where testbug_char5.tag1=dim.tag1;
 timest | user_id | tag1  | tag2  | tag1  
--------+---------+-------+-------+-------
 201206 |    3333 | 1     | 2     | 1    
 201207 |    3333 | 1     | 2     | 1    
 201208 |    3333 | 1     | 2     | 1    
(3 rows)

--
-- Load from another table
--
DROP TABLE load;
ERROR:  table "load" does not exist
CREATE TABLE load
(
timest character varying(6),
user_id numeric(16,0) NOT NULL,
tag1 char(5),
tag2 char(5)
)
DISTRIBUTED randomly;
insert into load select '20120' || i , 1111 * (i + 2), '1','2' from generate_series(3,8) i;
select * from load;
 timest | user_id | tag1  | tag2  
--------+---------+-------+-------
 201203 |    5555 | 1     | 2    
 201205 |    7777 | 1     | 2    
 201207 |    9999 | 1     | 2    
 201204 |    6666 | 1     | 2    
 201206 |    8888 | 1     | 2    
 201208 |   11110 | 1     | 2    
(6 rows)

insert into testbug_char5 select * from load;
select * from testbug_char5;
 timest | user_id | tag1  | tag2  
--------+---------+-------+-------
 201203 |    1111 |       | 
 201204 |    1111 |       | 
 201205 |    1111 |       | 
 201205 |    7777 | 1     | 2    
 201208 |   11110 | 1     | 2    
 201203 |    2222 |       | 2    
 201203 |    5555 | 1     | 2    
 201204 |    2222 |       | 2    
 201204 |    6666 | 1     | 2    
 201205 |    2222 |       | 2    
 201206 |    3333 | 1     | 2    
 201206 |    8888 | 1     | 2    
 201207 |    3333 | 1     | 2    
 201207 |    9999 | 1     | 2    
 201208 |    3333 | 1     | 2    
(15 rows)

--
-- Update values
--
update testbug_char5 set tag1='6' where tag1='1' and timest='201208';
update testbug_char5 set tag2='7' where tag2='1' and timest='201208';
select * from testbug_char5;
 timest | user_id | tag1  | tag2  
--------+---------+-------+-------
 201203 |    1111 |       | 
 201204 |    1111 |       | 
 201205 |    1111 |       | 
 201205 |    7777 | 1     | 2    
 201208 |   11110 | 6     | 2    
 201203 |    2222 |       | 2    
 201203 |    5555 | 1     | 2    
 201204 |    2222 |       | 2    
 201204 |    6666 | 1     | 2    
 201205 |    2222 |       | 2    
 201206 |    3333 | 1     | 2    
 201206 |    8888 | 1     | 2    
 201207 |    3333 | 1     | 2    
 201207 |    9999 | 1     | 2    
 201208 |    3333 | 6     | 2    
(15 rows)

set search_path=public;
drop schema if exists mpp17582 cascade;
NOTICE:  drop cascades to table mpp17582.load
NOTICE:  drop cascades to table mpp17582.dim
NOTICE:  drop cascades to table mpp17582.testbug_char5_1_prt_part201208
NOTICE:  drop cascades to constraint testbug_char5_1_prt_part201208_check on table mpp17582.testbug_char5_1_prt_part201208
NOTICE:  drop cascades to append only table mpp17582.testbug_char5_1_prt_part201207
NOTICE:  drop cascades to constraint testbug_char5_1_prt_part201207_check on append only table mpp17582.testbug_char5_1_prt_part201207
NOTICE:  drop cascades to append only columnar table mpp17582.testbug_char5_1_prt_part201206
NOTICE:  drop cascades to constraint testbug_char5_1_prt_part201206_check on append only columnar table mpp17582.testbug_char5_1_prt_part201206
NOTICE:  drop cascades to table mpp17582.testbug_char5_1_prt_part201205
NOTICE:  drop cascades to constraint testbug_char5_1_prt_part201205_check on table mpp17582.testbug_char5_1_prt_part201205
NOTICE:  drop cascades to append only table mpp17582.testbug_char5_1_prt_part201204
NOTICE:  drop cascades to constraint testbug_char5_1_prt_part201204_check on append only table mpp17582.testbug_char5_1_prt_part201204
NOTICE:  drop cascades to append only columnar table mpp17582.testbug_char5_1_prt_part201203
NOTICE:  drop cascades to constraint testbug_char5_1_prt_part201203_check on append only columnar table mpp17582.testbug_char5_1_prt_part201203
NOTICE:  drop cascades to table mpp17582.testbug_char5
