\c regressbkuptestadv
select * from t1;
 i | j | k 
---+---+---
 1 | 1 | 1
 3 | 4 |  
 2 | 2 | 2
(3 rows)

select * from v1;
 i | j | k 
---+---+---
 1 | 1 | 1
 2 | 2 | 2
(2 rows)

insert into t1 values (2, 1, 3);
ERROR:  new row for relation "t1" violates check constraint "t1_check"  (seg1 localhost:13003 pid=10293)
insert into t1 values (1, 5, 10);
ERROR:  duplicate key violates unique constraint "t1_pkey"  (seg0 localhost:13002 pid=10292)
insert into t1 values (100, NULL, 3);
ERROR:  null value in column "j" violates not-null constraint  (seg1 localhost:13003 pid=10293)
insert into t1 values (20, 20, 30);
insert into t1 values (21, 22, 23);
select * from t1;
 i  | j  | k  
----+----+----
  1 |  1 |  1
  3 |  4 |   
 21 | 22 | 23
  2 |  2 |  2
 20 | 20 | 30
(5 rows)

select * from v1;
 i  | j  | k  
----+----+----
  1 |  1 |  1
  2 |  2 |  2
 20 | 20 | 30
(3 rows)

select * from oids;
ERROR:  relation "oids" does not exist
select oid from oids where 1 = 0;
ERROR:  relation "oids" does not exist
select * from idxt;
 i | j 
---+---
(0 rows)

insert into idxt (1, 1);
ERROR:  syntax error at or near "1"
LINE 1: insert into idxt (1, 1);
                          ^
insert into idxt (1, 1);
ERROR:  syntax error at or near "1"
LINE 1: insert into idxt (1, 1);
                          ^
select C3ToBit('OK');
 c3tobit 
---------
 101
(1 row)

select C3ToBit(NULL);
 c3tobit 
---------
 
(1 row)

select 'ABC'::char(3)::bit(3);
 bit 
-----
 101
(1 row)

select incr(100);
 incr 
------
  101
(1 row)

create function decr (i int) returns int as
$$ 
BEGIN
	return i-1;
END
$$ language plpgsql;
select decr(100);
 decr 
------
   99
(1 row)

select * from tt1;
 i | j |    upc     
---+---+------------
 4 | 4 | 94041
 1 | 1 | 53706
 2 | 1 | 90210
 3 | 1 | 55555-4444
(4 rows)

insert into tt1 values (10, 10, '1234');
ERROR:  value for domain us_postal_code violates check constraint "us_postal_code_check"  (seg0 slice1 localhost:13002 pid=10294)
insert into tt1 values (11, 11, '1234A');
ERROR:  value for domain us_postal_code violates check constraint "us_postal_code_check"  (seg0 slice1 localhost:13002 pid=10294)
select * from tt2;
 i | j |  upc  | state 
---+---+-------+-------
 4 | 4 | 94041 | CA
(1 row)

select * from rt;
 i | j 
---+---
 1 | 1
(1 row)

delete from rt;
select * from rt;
 i | j 
---+---
 1 | 1
(1 row)

insert into rt values (100, 100);
select * from rt;
 i | j 
---+---
 1 | 2
(1 row)

select nextval('seq');
 nextval 
---------
     200
(1 row)

select nextval('seq');
 nextval 
---------
     210
(1 row)

\c regressrestoretestadv1
select * from t1;
 i | j | k 
---+---+---
 1 | 1 | 1
 3 | 4 |  
 2 | 2 | 2
(3 rows)

select * from v1;
 i | j | k 
---+---+---
 1 | 1 | 1
 2 | 2 | 2
(2 rows)

insert into t1 values (2, 1, 3);
ERROR:  new row for relation "t1" violates check constraint "t1_check"  (seg1 localhost:13003 pid=10297)
insert into t1 values (1, 5, 10);
ERROR:  duplicate key violates unique constraint "t1_pkey"  (seg0 localhost:13002 pid=10296)
insert into t1 values (100, NULL, 3);
ERROR:  null value in column "j" violates not-null constraint  (seg1 localhost:13003 pid=10297)
insert into t1 values (20, 20, 30);
insert into t1 values (21, 22, 23);
select * from t1;
 i  | j  | k  
----+----+----
  1 |  1 |  1
  3 |  4 |   
 21 | 22 | 23
  2 |  2 |  2
 20 | 20 | 30
(5 rows)

select * from v1;
 i  | j  | k  
----+----+----
  1 |  1 |  1
  2 |  2 |  2
 20 | 20 | 30
(3 rows)

select * from oids;
ERROR:  relation "oids" does not exist
select oid from oids where 1 = 0;
ERROR:  relation "oids" does not exist
select * from idxt;
 i | j 
---+---
(0 rows)

insert into idxt (1, 1);
ERROR:  syntax error at or near "1"
LINE 1: insert into idxt (1, 1);
                          ^
insert into idxt (1, 1);
ERROR:  syntax error at or near "1"
LINE 1: insert into idxt (1, 1);
                          ^
select C3ToBit('OK');
 c3tobit 
---------
 101
(1 row)

select C3ToBit(NULL);
 c3tobit 
---------
 
(1 row)

select 'ABC'::char(3)::bit(3);
 bit 
-----
 101
(1 row)

select incr(100);
 incr 
------
  101
(1 row)

create function decr (i int) returns int as
$$ 
BEGIN
	return i-1;
END
$$ language plpgsql;
select decr(100);
 decr 
------
   99
(1 row)

select * from tt1;
 i | j |    upc     
---+---+------------
 1 | 1 | 53706
 2 | 1 | 90210
 3 | 1 | 55555-4444
 4 | 4 | 94041
(4 rows)

insert into tt1 values (10, 10, '1234');
ERROR:  value for domain us_postal_code violates check constraint "us_postal_code_check"  (seg1 slice1 localhost:13003 pid=10298)
insert into tt1 values (11, 11, '1234A');
ERROR:  value for domain us_postal_code violates check constraint "us_postal_code_check"  (seg1 slice1 localhost:13003 pid=10298)
select * from tt2;
 i | j |  upc  | state 
---+---+-------+-------
 4 | 4 | 94041 | CA
(1 row)

select * from rt;
 i | j 
---+---
 1 | 1
(1 row)

delete from rt;
select * from rt;
 i | j 
---+---
 1 | 1
(1 row)

insert into rt values (100, 100);
select * from rt;
 i | j 
---+---
 1 | 2
(1 row)

select nextval('seq');
 nextval 
---------
     200
(1 row)

select nextval('seq');
 nextval 
---------
     210
(1 row)

\c regressrestoretestadv2
select * from t1;
 i | j | k 
---+---+---
 2 | 2 | 2
 1 | 1 | 1
 3 | 4 |  
(3 rows)

select * from v1;
 i | j | k 
---+---+---
 1 | 1 | 1
 2 | 2 | 2
(2 rows)

insert into t1 values (2, 1, 3);
ERROR:  new row for relation "t1" violates check constraint "t1_check"  (seg1 localhost:13003 pid=10301)
insert into t1 values (1, 5, 10);
ERROR:  duplicate key violates unique constraint "t1_pkey"  (seg0 localhost:13002 pid=10300)
insert into t1 values (100, NULL, 3);
ERROR:  null value in column "j" violates not-null constraint  (seg1 localhost:13003 pid=10301)
insert into t1 values (20, 20, 30);
insert into t1 values (21, 22, 23);
select * from t1;
 i  | j  | k  
----+----+----
  1 |  1 |  1
  3 |  4 |   
 21 | 22 | 23
  2 |  2 |  2
 20 | 20 | 30
(5 rows)

select * from v1;
 i  | j  | k  
----+----+----
  1 |  1 |  1
  2 |  2 |  2
 20 | 20 | 30
(3 rows)

select * from oids;
ERROR:  relation "oids" does not exist
select oid from oids where 1 = 0;
ERROR:  relation "oids" does not exist
select * from idxt;
 i | j 
---+---
(0 rows)

insert into idxt (1, 1);
ERROR:  syntax error at or near "1"
LINE 1: insert into idxt (1, 1);
                          ^
insert into idxt (1, 1);
ERROR:  syntax error at or near "1"
LINE 1: insert into idxt (1, 1);
                          ^
select C3ToBit('OK');
 c3tobit 
---------
 101
(1 row)

select C3ToBit(NULL);
 c3tobit 
---------
 
(1 row)

select 'ABC'::char(3)::bit(3);
 bit 
-----
 101
(1 row)

select incr(100);
 incr 
------
  101
(1 row)

create function decr (i int) returns int as
$$ 
BEGIN
	return i-1;
END
$$ language plpgsql;
select decr(100);
 decr 
------
   99
(1 row)

select * from tt1;
 i | j |    upc     
---+---+------------
 2 | 1 | 90210
 4 | 4 | 94041
 1 | 1 | 53706
 3 | 1 | 55555-4444
(4 rows)

insert into tt1 values (10, 10, '1234');
ERROR:  value for domain us_postal_code violates check constraint "us_postal_code_check"  (seg0 slice1 localhost:13002 pid=10302)
insert into tt1 values (11, 11, '1234A');
ERROR:  value for domain us_postal_code violates check constraint "us_postal_code_check"  (seg0 slice1 localhost:13002 pid=10302)
select * from tt2;
 i | j |  upc  | state 
---+---+-------+-------
 4 | 4 | 94041 | CA
(1 row)

select * from rt;
 i | j 
---+---
 1 | 1
(1 row)

delete from rt;
select * from rt;
 i | j 
---+---
 1 | 1
(1 row)

insert into rt values (100, 100);
select * from rt;
 i | j 
---+---
 1 | 2
(1 row)

select nextval('seq');
 nextval 
---------
     200
(1 row)

select nextval('seq');
 nextval 
---------
     210
(1 row)

\c regressbkuptestmisc
select * from t1;
 i | col3 
---+------
 1 |    1
 3 |     
 2 |    2
(3 rows)

select * from t2;
 i | k | j 
---+---+---
 1 | 1 | 
 3 |   | 
 2 | 2 | 
(3 rows)

select * from t3;
 i | j | k 
---+---+---
 1 | 1 | 1
 3 | 4 |  
 2 | 2 | 2
(3 rows)

select * from t4;
  i  |  j  |  k  
-----+-----+-----
 100 | 100 | 100
 200 | 200 | 200
(2 rows)

select * from t5;
 i | j | k 
---+---+---
 3 | 4 |  
 3 | 4 |  
 1 | 1 | 1
 3 | 4 |  
 2 | 2 | 2
(5 rows)

select relpages, reltuples from pg_class where relname = 't3';
 relpages | reltuples 
----------+-----------
        1 |         2
(1 row)

\c regressrestoretestmisc1
select * from t1;
 i | col3 
---+------
 1 |    1
 3 |     
 2 |    2
(3 rows)

select * from t2;
 i | k | j 
---+---+---
 1 | 1 | 
 3 |   | 
 2 | 2 | 
(3 rows)

select * from t3;
 i | j | k 
---+---+---
 1 | 1 | 1
 3 | 4 |  
 2 | 2 | 2
(3 rows)

select * from t4;
  i  |  j  |  k  
-----+-----+-----
 100 | 100 | 100
 200 | 200 | 200
(2 rows)

select * from t5;
 i | j | k 
---+---+---
 3 | 4 |  
 3 | 4 |  
 1 | 1 | 1
 3 | 4 |  
 2 | 2 | 2
(5 rows)

select relpages, reltuples from pg_class where relname = 't3';
 relpages | reltuples 
----------+-----------
        0 |         0
(1 row)

\c regressrestoretestmisc1
select * from t1;
 i | col3 
---+------
 1 |    1
 3 |     
 2 |    2
(3 rows)

select * from t2;
 i | k | j 
---+---+---
 1 | 1 | 
 3 |   | 
 2 | 2 | 
(3 rows)

select * from t3;
 i | j | k 
---+---+---
 1 | 1 | 1
 3 | 4 |  
 2 | 2 | 2
(3 rows)

select * from t4;
  i  |  j  |  k  
-----+-----+-----
 100 | 100 | 100
 200 | 200 | 200
(2 rows)

select * from t5;
 i | j | k 
---+---+---
 3 | 4 |  
 3 | 4 |  
 1 | 1 | 1
 3 | 4 |  
 2 | 2 | 2
(5 rows)

select relpages, reltuples from pg_class where relname = 't3';
 relpages | reltuples 
----------+-----------
        0 |         0
(1 row)

