--
-- Test inheritance features
--
CREATE TABLE a (dummy serial, aa TEXT);
NOTICE:  CREATE TABLE will create implicit sequence "a_dummy_seq" for serial column "a.dummy"
CREATE TABLE b (bb TEXT) INHERITS (a);
CREATE TABLE c (cc TEXT) INHERITS (a);
CREATE TABLE d (dd TEXT) INHERITS (b,c,a);
NOTICE:  merging multiple inherited definitions of column "dummy"
NOTICE:  merging multiple inherited definitions of column "aa"
NOTICE:  merging multiple inherited definitions of column "dummy"
NOTICE:  merging multiple inherited definitions of column "aa"
INSERT INTO a(aa) VALUES('aaa');
INSERT INTO a(aa) VALUES('aaaa');
INSERT INTO a(aa) VALUES('aaaaa');
INSERT INTO a(aa) VALUES('aaaaaa');
INSERT INTO a(aa) VALUES('aaaaaaa');
INSERT INTO a(aa) VALUES('aaaaaaaa');
INSERT INTO b(aa) VALUES('bbb');
INSERT INTO b(aa) VALUES('bbbb');
INSERT INTO b(aa) VALUES('bbbbb');
INSERT INTO b(aa) VALUES('bbbbbb');
INSERT INTO b(aa) VALUES('bbbbbbb');
INSERT INTO b(aa) VALUES('bbbbbbbb');
INSERT INTO c(aa) VALUES('ccc');
INSERT INTO c(aa) VALUES('cccc');
INSERT INTO c(aa) VALUES('ccccc');
INSERT INTO c(aa) VALUES('cccccc');
INSERT INTO c(aa) VALUES('ccccccc');
INSERT INTO c(aa) VALUES('cccccccc');
INSERT INTO d(aa) VALUES('ddd');
INSERT INTO d(aa) VALUES('dddd');
INSERT INTO d(aa) VALUES('ddddd');
INSERT INTO d(aa) VALUES('dddddd');
INSERT INTO d(aa) VALUES('ddddddd');
INSERT INTO d(aa) VALUES('dddddddd');
SELECT relname, a.* FROM a, pg_class where a.tableoid = pg_class.oid ORDER BY 1,2;
 relname | dummy |    aa    
---------+-------+----------
 a       |     1 | aaa
 a       |     2 | aaaa
 a       |     3 | aaaaa
 a       |     4 | aaaaaa
 a       |     5 | aaaaaaa
 a       |     6 | aaaaaaaa
 b       |     7 | bbb
 b       |     8 | bbbb
 b       |     9 | bbbbb
 b       |    10 | bbbbbb
 b       |    11 | bbbbbbb
 b       |    12 | bbbbbbbb
 c       |    13 | ccc
 c       |    14 | cccc
 c       |    15 | ccccc
 c       |    16 | cccccc
 c       |    17 | ccccccc
 c       |    18 | cccccccc
 d       |    19 | ddd
 d       |    20 | dddd
 d       |    21 | ddddd
 d       |    22 | dddddd
 d       |    23 | ddddddd
 d       |    24 | dddddddd
(24 rows)

SELECT relname, b.* FROM b, pg_class where b.tableoid = pg_class.oid ORDER BY 1,2;
 relname | dummy |    aa    | bb 
---------+-------+----------+----
 b       |     7 | bbb      | 
 b       |     8 | bbbb     | 
 b       |     9 | bbbbb    | 
 b       |    10 | bbbbbb   | 
 b       |    11 | bbbbbbb  | 
 b       |    12 | bbbbbbbb | 
 d       |    19 | ddd      | 
 d       |    20 | dddd     | 
 d       |    21 | ddddd    | 
 d       |    22 | dddddd   | 
 d       |    23 | ddddddd  | 
 d       |    24 | dddddddd | 
(12 rows)

SELECT relname, c.* FROM c, pg_class where c.tableoid = pg_class.oid ORDER BY 1,2;
 relname | dummy |    aa    | cc 
---------+-------+----------+----
 c       |    13 | ccc      | 
 c       |    14 | cccc     | 
 c       |    15 | ccccc    | 
 c       |    16 | cccccc   | 
 c       |    17 | ccccccc  | 
 c       |    18 | cccccccc | 
 d       |    19 | ddd      | 
 d       |    20 | dddd     | 
 d       |    21 | ddddd    | 
 d       |    22 | dddddd   | 
 d       |    23 | ddddddd  | 
 d       |    24 | dddddddd | 
(12 rows)

SELECT relname, d.* FROM d, pg_class where d.tableoid = pg_class.oid ORDER BY 1,2;
 relname | dummy |    aa    | bb | cc | dd 
---------+-------+----------+----+----+----
 d       |    19 | ddd      |    |    | 
 d       |    20 | dddd     |    |    | 
 d       |    21 | ddddd    |    |    | 
 d       |    22 | dddddd   |    |    | 
 d       |    23 | ddddddd  |    |    | 
 d       |    24 | dddddddd |    |    | 
(6 rows)

SELECT relname, a.* FROM ONLY a, pg_class where a.tableoid = pg_class.oid ORDER BY 1,2;
 relname | dummy |    aa    
---------+-------+----------
 a       |     1 | aaa
 a       |     2 | aaaa
 a       |     3 | aaaaa
 a       |     4 | aaaaaa
 a       |     5 | aaaaaaa
 a       |     6 | aaaaaaaa
(6 rows)

SELECT relname, b.* FROM ONLY b, pg_class where b.tableoid = pg_class.oid ORDER BY 1,2;
 relname | dummy |    aa    | bb 
---------+-------+----------+----
 b       |     7 | bbb      | 
 b       |     8 | bbbb     | 
 b       |     9 | bbbbb    | 
 b       |    10 | bbbbbb   | 
 b       |    11 | bbbbbbb  | 
 b       |    12 | bbbbbbbb | 
(6 rows)

SELECT relname, c.* FROM ONLY c, pg_class where c.tableoid = pg_class.oid ORDER BY 1,2;
 relname | dummy |    aa    | cc 
---------+-------+----------+----
 c       |    13 | ccc      | 
 c       |    14 | cccc     | 
 c       |    15 | ccccc    | 
 c       |    16 | cccccc   | 
 c       |    17 | ccccccc  | 
 c       |    18 | cccccccc | 
(6 rows)

SELECT relname, d.* FROM ONLY d, pg_class where d.tableoid = pg_class.oid ORDER BY 1,2;
 relname | dummy |    aa    | bb | cc | dd 
---------+-------+----------+----+----+----
 d       |    19 | ddd      |    |    | 
 d       |    20 | dddd     |    |    | 
 d       |    21 | ddddd    |    |    | 
 d       |    22 | dddddd   |    |    | 
 d       |    23 | ddddddd  |    |    | 
 d       |    24 | dddddddd |    |    | 
(6 rows)

UPDATE a SET aa='zzzz' WHERE aa='aaaa';
UPDATE ONLY a SET aa='zzzzz' WHERE aa='aaaaa';
UPDATE b SET aa='zzz' WHERE aa='aaa';
UPDATE ONLY b SET aa='zzz' WHERE aa='aaa';
UPDATE a SET aa='zzzzzz' WHERE aa LIKE 'aaa%';
SELECT relname, a.* FROM a, pg_class where a.tableoid = pg_class.oid ORDER BY 1,2;
 relname | dummy |    aa    
---------+-------+----------
 a       |     1 | zzzzzz
 a       |     2 | zzzz
 a       |     3 | zzzzz
 a       |     4 | zzzzzz
 a       |     5 | zzzzzz
 a       |     6 | zzzzzz
 b       |     7 | bbb
 b       |     8 | bbbb
 b       |     9 | bbbbb
 b       |    10 | bbbbbb
 b       |    11 | bbbbbbb
 b       |    12 | bbbbbbbb
 c       |    13 | ccc
 c       |    14 | cccc
 c       |    15 | ccccc
 c       |    16 | cccccc
 c       |    17 | ccccccc
 c       |    18 | cccccccc
 d       |    19 | ddd
 d       |    20 | dddd
 d       |    21 | ddddd
 d       |    22 | dddddd
 d       |    23 | ddddddd
 d       |    24 | dddddddd
(24 rows)

SELECT relname, b.* FROM b, pg_class where b.tableoid = pg_class.oid ORDER BY 1,2;
 relname | dummy |    aa    | bb 
---------+-------+----------+----
 b       |     7 | bbb      | 
 b       |     8 | bbbb     | 
 b       |     9 | bbbbb    | 
 b       |    10 | bbbbbb   | 
 b       |    11 | bbbbbbb  | 
 b       |    12 | bbbbbbbb | 
 d       |    19 | ddd      | 
 d       |    20 | dddd     | 
 d       |    21 | ddddd    | 
 d       |    22 | dddddd   | 
 d       |    23 | ddddddd  | 
 d       |    24 | dddddddd | 
(12 rows)

SELECT relname, c.* FROM c, pg_class where c.tableoid = pg_class.oid ORDER BY 1,2;
 relname | dummy |    aa    | cc 
---------+-------+----------+----
 c       |    13 | ccc      | 
 c       |    14 | cccc     | 
 c       |    15 | ccccc    | 
 c       |    16 | cccccc   | 
 c       |    17 | ccccccc  | 
 c       |    18 | cccccccc | 
 d       |    19 | ddd      | 
 d       |    20 | dddd     | 
 d       |    21 | ddddd    | 
 d       |    22 | dddddd   | 
 d       |    23 | ddddddd  | 
 d       |    24 | dddddddd | 
(12 rows)

SELECT relname, d.* FROM d, pg_class where d.tableoid = pg_class.oid ORDER BY 1,2;
 relname | dummy |    aa    | bb | cc | dd 
---------+-------+----------+----+----+----
 d       |    19 | ddd      |    |    | 
 d       |    20 | dddd     |    |    | 
 d       |    21 | ddddd    |    |    | 
 d       |    22 | dddddd   |    |    | 
 d       |    23 | ddddddd  |    |    | 
 d       |    24 | dddddddd |    |    | 
(6 rows)

SELECT relname, a.* FROM ONLY a, pg_class where a.tableoid = pg_class.oid ORDER BY 1,2;
 relname | dummy |   aa   
---------+-------+--------
 a       |     1 | zzzzzz
 a       |     2 | zzzz
 a       |     3 | zzzzz
 a       |     4 | zzzzzz
 a       |     5 | zzzzzz
 a       |     6 | zzzzzz
(6 rows)

SELECT relname, b.* FROM ONLY b, pg_class where b.tableoid = pg_class.oid ORDER BY 1,2;
 relname | dummy |    aa    | bb 
---------+-------+----------+----
 b       |     7 | bbb      | 
 b       |     8 | bbbb     | 
 b       |     9 | bbbbb    | 
 b       |    10 | bbbbbb   | 
 b       |    11 | bbbbbbb  | 
 b       |    12 | bbbbbbbb | 
(6 rows)

SELECT relname, c.* FROM ONLY c, pg_class where c.tableoid = pg_class.oid ORDER BY 1,2;
 relname | dummy |    aa    | cc 
---------+-------+----------+----
 c       |    13 | ccc      | 
 c       |    14 | cccc     | 
 c       |    15 | ccccc    | 
 c       |    16 | cccccc   | 
 c       |    17 | ccccccc  | 
 c       |    18 | cccccccc | 
(6 rows)

SELECT relname, d.* FROM ONLY d, pg_class where d.tableoid = pg_class.oid ORDER BY 1,2;
 relname | dummy |    aa    | bb | cc | dd 
---------+-------+----------+----+----+----
 d       |    19 | ddd      |    |    | 
 d       |    20 | dddd     |    |    | 
 d       |    21 | ddddd    |    |    | 
 d       |    22 | dddddd   |    |    | 
 d       |    23 | ddddddd  |    |    | 
 d       |    24 | dddddddd |    |    | 
(6 rows)

UPDATE b SET aa='new';
SELECT relname, a.* FROM a, pg_class where a.tableoid = pg_class.oid ORDER BY 1,2;
 relname | dummy |    aa    
---------+-------+----------
 a       |     1 | zzzzzz
 a       |     2 | zzzz
 a       |     3 | zzzzz
 a       |     4 | zzzzzz
 a       |     5 | zzzzzz
 a       |     6 | zzzzzz
 b       |     7 | new
 b       |     8 | new
 b       |     9 | new
 b       |    10 | new
 b       |    11 | new
 b       |    12 | new
 c       |    13 | ccc
 c       |    14 | cccc
 c       |    15 | ccccc
 c       |    16 | cccccc
 c       |    17 | ccccccc
 c       |    18 | cccccccc
 d       |    19 | new
 d       |    20 | new
 d       |    21 | new
 d       |    22 | new
 d       |    23 | new
 d       |    24 | new
(24 rows)

SELECT relname, b.* FROM b, pg_class where b.tableoid = pg_class.oid ORDER BY 1,2;
 relname | dummy | aa  | bb 
---------+-------+-----+----
 b       |     7 | new | 
 b       |     8 | new | 
 b       |     9 | new | 
 b       |    10 | new | 
 b       |    11 | new | 
 b       |    12 | new | 
 d       |    19 | new | 
 d       |    20 | new | 
 d       |    21 | new | 
 d       |    22 | new | 
 d       |    23 | new | 
 d       |    24 | new | 
(12 rows)

SELECT relname, c.* FROM c, pg_class where c.tableoid = pg_class.oid ORDER BY 1,2;
 relname | dummy |    aa    | cc 
---------+-------+----------+----
 c       |    13 | ccc      | 
 c       |    14 | cccc     | 
 c       |    15 | ccccc    | 
 c       |    16 | cccccc   | 
 c       |    17 | ccccccc  | 
 c       |    18 | cccccccc | 
 d       |    19 | new      | 
 d       |    20 | new      | 
 d       |    21 | new      | 
 d       |    22 | new      | 
 d       |    23 | new      | 
 d       |    24 | new      | 
(12 rows)

SELECT relname, d.* FROM d, pg_class where d.tableoid = pg_class.oid ORDER BY 1,2;
 relname | dummy | aa  | bb | cc | dd 
---------+-------+-----+----+----+----
 d       |    19 | new |    |    | 
 d       |    20 | new |    |    | 
 d       |    21 | new |    |    | 
 d       |    22 | new |    |    | 
 d       |    23 | new |    |    | 
 d       |    24 | new |    |    | 
(6 rows)

SELECT relname, a.* FROM ONLY a, pg_class where a.tableoid = pg_class.oid ORDER BY 1,2;
 relname | dummy |   aa   
---------+-------+--------
 a       |     1 | zzzzzz
 a       |     2 | zzzz
 a       |     3 | zzzzz
 a       |     4 | zzzzzz
 a       |     5 | zzzzzz
 a       |     6 | zzzzzz
(6 rows)

SELECT relname, b.* FROM ONLY b, pg_class where b.tableoid = pg_class.oid ORDER BY 1,2;
 relname | dummy | aa  | bb 
---------+-------+-----+----
 b       |     7 | new | 
 b       |     8 | new | 
 b       |     9 | new | 
 b       |    10 | new | 
 b       |    11 | new | 
 b       |    12 | new | 
(6 rows)

SELECT relname, c.* FROM ONLY c, pg_class where c.tableoid = pg_class.oid ORDER BY 1,2;
 relname | dummy |    aa    | cc 
---------+-------+----------+----
 c       |    13 | ccc      | 
 c       |    14 | cccc     | 
 c       |    15 | ccccc    | 
 c       |    16 | cccccc   | 
 c       |    17 | ccccccc  | 
 c       |    18 | cccccccc | 
(6 rows)

SELECT relname, d.* FROM ONLY d, pg_class where d.tableoid = pg_class.oid ORDER BY 1,2;
 relname | dummy | aa  | bb | cc | dd 
---------+-------+-----+----+----+----
 d       |    19 | new |    |    | 
 d       |    20 | new |    |    | 
 d       |    21 | new |    |    | 
 d       |    22 | new |    |    | 
 d       |    23 | new |    |    | 
 d       |    24 | new |    |    | 
(6 rows)

UPDATE a SET aa='new';
DELETE FROM ONLY c WHERE aa='new';
SELECT relname, a.* FROM a, pg_class where a.tableoid = pg_class.oid ORDER BY 1,2;
 relname | dummy | aa  
---------+-------+-----
 a       |     1 | new
 a       |     2 | new
 a       |     3 | new
 a       |     4 | new
 a       |     5 | new
 a       |     6 | new
 b       |     7 | new
 b       |     8 | new
 b       |     9 | new
 b       |    10 | new
 b       |    11 | new
 b       |    12 | new
 d       |    19 | new
 d       |    20 | new
 d       |    21 | new
 d       |    22 | new
 d       |    23 | new
 d       |    24 | new
(18 rows)

SELECT relname, b.* FROM b, pg_class where b.tableoid = pg_class.oid ORDER BY 1,2;
 relname | dummy | aa  | bb 
---------+-------+-----+----
 b       |     7 | new | 
 b       |     8 | new | 
 b       |     9 | new | 
 b       |    10 | new | 
 b       |    11 | new | 
 b       |    12 | new | 
 d       |    19 | new | 
 d       |    20 | new | 
 d       |    21 | new | 
 d       |    22 | new | 
 d       |    23 | new | 
 d       |    24 | new | 
(12 rows)

SELECT relname, c.* FROM c, pg_class where c.tableoid = pg_class.oid ORDER BY 1,2;
 relname | dummy | aa  | cc 
---------+-------+-----+----
 d       |    19 | new | 
 d       |    20 | new | 
 d       |    21 | new | 
 d       |    22 | new | 
 d       |    23 | new | 
 d       |    24 | new | 
(6 rows)

SELECT relname, d.* FROM d, pg_class where d.tableoid = pg_class.oid ORDER BY 1,2;
 relname | dummy | aa  | bb | cc | dd 
---------+-------+-----+----+----+----
 d       |    19 | new |    |    | 
 d       |    20 | new |    |    | 
 d       |    21 | new |    |    | 
 d       |    22 | new |    |    | 
 d       |    23 | new |    |    | 
 d       |    24 | new |    |    | 
(6 rows)

SELECT relname, a.* FROM ONLY a, pg_class where a.tableoid = pg_class.oid ORDER BY 1,2;
 relname | dummy | aa  
---------+-------+-----
 a       |     1 | new
 a       |     2 | new
 a       |     3 | new
 a       |     4 | new
 a       |     5 | new
 a       |     6 | new
(6 rows)

SELECT relname, b.* FROM ONLY b, pg_class where b.tableoid = pg_class.oid ORDER BY 1,2;
 relname | dummy | aa  | bb 
---------+-------+-----+----
 b       |     7 | new | 
 b       |     8 | new | 
 b       |     9 | new | 
 b       |    10 | new | 
 b       |    11 | new | 
 b       |    12 | new | 
(6 rows)

SELECT relname, c.* FROM ONLY c, pg_class where c.tableoid = pg_class.oid ORDER BY 1,2;
 relname | dummy | aa | cc 
---------+-------+----+----
(0 rows)

SELECT relname, d.* FROM ONLY d, pg_class where d.tableoid = pg_class.oid ORDER BY 1,2;
 relname | dummy | aa  | bb | cc | dd 
---------+-------+-----+----+----+----
 d       |    19 | new |    |    | 
 d       |    20 | new |    |    | 
 d       |    21 | new |    |    | 
 d       |    22 | new |    |    | 
 d       |    23 | new |    |    | 
 d       |    24 | new |    |    | 
(6 rows)

DELETE FROM a;
SELECT relname, a.* FROM a, pg_class where a.tableoid = pg_class.oid ORDER BY 1,2;
 relname | dummy | aa 
---------+-------+----
(0 rows)

SELECT relname, b.* FROM b, pg_class where b.tableoid = pg_class.oid ORDER BY 1,2;
 relname | dummy | aa | bb 
---------+-------+----+----
(0 rows)

SELECT relname, c.* FROM c, pg_class where c.tableoid = pg_class.oid ORDER BY 1,2;
 relname | dummy | aa | cc 
---------+-------+----+----
(0 rows)

SELECT relname, d.* FROM d, pg_class where d.tableoid = pg_class.oid ORDER BY 1,2;
 relname | dummy | aa | bb | cc | dd 
---------+-------+----+----+----+----
(0 rows)

SELECT relname, a.* FROM ONLY a, pg_class where a.tableoid = pg_class.oid ORDER BY 1,2;
 relname | dummy | aa 
---------+-------+----
(0 rows)

SELECT relname, b.* FROM ONLY b, pg_class where b.tableoid = pg_class.oid ORDER BY 1,2;
 relname | dummy | aa | bb 
---------+-------+----+----
(0 rows)

SELECT relname, c.* FROM ONLY c, pg_class where c.tableoid = pg_class.oid ORDER BY 1,2;
 relname | dummy | aa | cc 
---------+-------+----+----
(0 rows)

SELECT relname, d.* FROM ONLY d, pg_class where d.tableoid = pg_class.oid ORDER BY 1,2;
 relname | dummy | aa | bb | cc | dd 
---------+-------+----+----+----+----
(0 rows)

-- Confirm PRIMARY KEY adds NOT NULL constraint to child table
CREATE TEMP TABLE z (b TEXT, PRIMARY KEY(aa, b)) inherits (a);
NOTICE:  CREATE TABLE / PRIMARY KEY will create implicit index "z_pkey" for table "z"
INSERT INTO z VALUES (NULL, 'text'); -- should fail
ERROR:  null value in column "dummy" violates not-null constraint
-- Check UPDATE with inherited target and an inherited source table
create temp table foo(f1 int, f2 int);
create temp table foo2(f3 int) inherits (foo);
create temp table bar(f1 int, f2 int);
create temp table bar2(f3 int) inherits (bar);
insert into foo values(1,1);
insert into foo values(3,3);
insert into foo2 values(2,2,2);
insert into foo2 values(3,3,3);
insert into bar values(1,1);
insert into bar values(2,2);
insert into bar values(3,3);
insert into bar values(4,4);
insert into bar2 values(1,1,1);
insert into bar2 values(2,2,2);
insert into bar2 values(3,3,3);
insert into bar2 values(4,4,4);
update bar set f2 = f2 + 100 where f1 in (select f1 from foo);
 ERROR:  Cannot parallelize that UPDATE yet
 DETAIL:  Result depends on values of CTID system column.  Support for CTID system column may change in the future.
SELECT relname, bar.* FROM bar, pg_class where bar.tableoid = pg_class.oid
order by 1,2;
 relname | f1 | f2  
---------+----+----
 bar     |  1 | 1
 bar     |  2 | 2
 bar     |  3 | 3
 bar     |  4 | 4
 bar2    |  1 | 1
 bar2    |  2 | 2
 bar2    |  3 | 3
 bar2    |  4 | 4
(8 rows)

/* Test inheritance of structure (LIKE) */
CREATE TABLE inhx (xx text DEFAULT 'text');
/*
 * Test double inheritance
 *
 * Ensure that defaults are NOT included unless
 * INCLUDING DEFAULTS is specified 
 */
CREATE TABLE inhe (ee text, LIKE inhx) inherits (b);
INSERT INTO inhe VALUES ('ee-col1', 'ee-col2', DEFAULT, 'ee-col4');
ERROR:  invalid input syntax for integer: "ee-col1"
SELECT * FROM inhe; /* Columns aa, bb, xx value NULL, ee */
 dummy | aa | bb | ee | xx 
-------+----+----+----+----
(0 rows)

SELECT * FROM inhx; /* Empty set since LIKE inherits structure only */
 xx 
----
(0 rows)

SELECT * FROM b; /* Has ee entry */
 dummy | aa | bb 
-------+----+----
(0 rows)

SELECT * FROM a; /* Has ee entry */
 dummy | aa 
-------+----
(0 rows)

CREATE TABLE inhf (LIKE inhx, LIKE inhx); /* Throw error */
ERROR:  column "xx" duplicated
CREATE TABLE inhf (LIKE inhx INCLUDING DEFAULTS INCLUDING CONSTRAINTS);
INSERT INTO inhf DEFAULT VALUES;
SELECT * FROM inhf; /* Single entry with value 'text' */
  xx  
------
 text
(1 row)

ALTER TABLE inhx add constraint foo CHECK (xx = 'text');
ALTER TABLE inhx ADD PRIMARY KEY (xx);
NOTICE:  ALTER TABLE / ADD PRIMARY KEY will create implicit index "inhx_pkey" for table "inhx"
CREATE TABLE inhg (LIKE inhx); /* Doesn't copy constraint */
INSERT INTO inhg VALUES ('foo');
DROP TABLE inhg;
CREATE TABLE inhg (x text, LIKE inhx INCLUDING CONSTRAINTS, y text); /* Copies constraints */
INSERT INTO inhg VALUES ('x', 'text', 'y'); /* Succeeds */
INSERT INTO inhg VALUES ('x', 'text', 'y'); /* Succeeds -- Unique constraints not copied */
INSERT INTO inhg VALUES ('x', 'foo',  'y');  /* fails due to constraint */
ERROR:  new row for relation "inhg" violates check constraint "foo"
SELECT * FROM inhg; /* Two records with three columns in order x=x, xx=text, y=y */
 x |  xx  | y 
---+------+---
 x | text | y
 x | text | y
(2 rows)

DROP TABLE inhg;
CREATE TABLE inhg (x text, LIKE inhx INCLUDING INDEXES, y text); /* copies indexes */
NOTICE:  CREATE TABLE / PRIMARY KEY will create implicit index "inhg_pkey" for table "inhg"
INSERT INTO inhg VALUES (5, 10);
INSERT INTO inhg VALUES (20, 10); -- should fail
ERROR:  duplicate key value violates unique constraint "inhg_pkey"
DROP TABLE inhg;
/* Multiple primary keys creation should fail */
CREATE TABLE inhg (x text, LIKE inhx INCLUDING INDEXES, PRIMARY KEY(x)); /* fails */
ERROR:  multiple primary keys for table "inhg" are not allowed
CREATE TABLE inhz (xx text DEFAULT 'text', yy int UNIQUE);
NOTICE:  CREATE TABLE / UNIQUE will create implicit index "inhz_yy_key" for table "inhz"
CREATE UNIQUE INDEX inhz_xx_idx on inhz (xx) WHERE xx <> 'test';
/* Ok to create multiple unique indexes */
CREATE TABLE inhg (x text UNIQUE, LIKE inhz INCLUDING INDEXES);
NOTICE:  CREATE TABLE / UNIQUE will create implicit index "inhg_x_key" for table "inhg"
NOTICE:  CREATE TABLE / UNIQUE will create implicit index "inhg_yy_key" for table "inhg"
INSERT INTO inhg (xx, yy, x) VALUES ('test', 5, 10);
INSERT INTO inhg (xx, yy, x) VALUES ('test', 10, 15);
INSERT INTO inhg (xx, yy, x) VALUES ('foo', 10, 15); -- should fail
ERROR:  duplicate key value violates unique constraint "inhg_x_key"
DROP TABLE inhg;
DROP TABLE inhz;
-- Test changing the type of inherited columns
insert into d values('test','one','two','three');
ERROR:  invalid input syntax for integer: "test"
alter table a alter column aa type integer using bit_length(aa);
select * from d ORDER BY 1,2,3;
 dummy | aa | bb | cc | dd 
-------+----+----+----+----
(0 rows)

-- Tests for casting between the rowtypes of parent and child
-- tables. See the pgsql-hackers thread beginning Dec. 4/04
create table base (i integer);
create table derived () inherits (base);
insert into derived (i) values (0);
select derived::base from derived;
 derived 
---------
 (0)
(1 row)

drop table derived;
drop table base;
create table p1(ff1 int);
create table p2(f1 text);
create function p2text(p2) returns text as 'select $1.f1' language sql;
create table c1(f3 int) inherits(p1,p2);
insert into c1 values(123456789, 'hi', 42);
select p2text(c1.*) from c1;
 p2text 
--------
 hi
(1 row)

drop function p2text(p2);
drop table c1;
drop table p2;
drop table p1;
